[
  {
    "id": "abcb297003edc5f7bbd711bd",
    "sourceRow": 1,
    "learningName": "Health and Migration: Regional strategic lines of action on health and migration - 2022",
    "description": "The course is designed to guide public authorities within the health sector, and beyond, on developing inclusive and evidence-based policies, strategies, and programs on health and migration, aimed at improving the health of migrants in countries throughout the Region of the Americas.",
    "technicalArea": "Health emergency preparedness and response management",
    "focusArea": "Migration & Health",
    "intendedAudience": "WHO staff/MoH/HCPs",
    "owner": "WHO",
    "developer": "PAHO/Virtual campus for public health",
    "contactDetails": "https://campus.paho.org/en/contact",
    "languages": [
      "English",
      "Spanish"
    ],
    "modalityRaw": "Online",
    "modality": "online",
    "platform": "Virtual campus for public health",
    "link": "https://campus.paho.org/en/course/health-and-migration",
    "comment": "",
    "signoffStatus": "",
    "normalizedLink": "https://campus.paho.org/en/course/health-and-migration",
    "searchText": "health and migration: regional strategic lines of action on health and migration - 2022 | the course is designed to guide public authorities within the health sector, and beyond, on developing inclusive and evidence-based policies, strategies, and programs on health and migration, aimed at improving the health of migrants in countries throughout the region of the americas. | health emergency preparedness and response management | migration & health | who staff/moh/hcps | who | paho/virtual campus for public health | https://campus.paho.org/en/contact | english, spanish | virtual campus for public health | https://campus.paho.org/en/course/health-and-migration"
  },
  {
    "id": "1a9681037e13251d2916f900",
    "sourceRow": 2,
    "learningName": "Health Cluster Coordination",
    "description": "The Global Health Cluster (GHC) has developed this Health Cluster Coordination eLearning course in order to increase the skills and knowledge of Health Cluster teams and partners and to strengthen the efficiency and accountability of all stakeholders in responding to humanitarian crises.",
    "technicalArea": "Health emergency preparedness and response management",
    "focusArea": "Health cluster coordination",
    "intendedAudience": "Health Cluster teams and partners",
    "owner": "WHO",
    "developer": "HQ/WHE",
    "contactDetails": "WHEtraining@who.int",
    "languages": [
      "English"
    ],
    "modalityRaw": "Online",
    "modality": "online",
    "platform": "OpenWHO",
    "link": "https://openwho.org/playlist/dedicated/495459/0_tueews0p/0_ah5tl4il",
    "comment": "",
    "signoffStatus": "",
    "normalizedLink": "https://openwho.org/playlist/dedicated/495459/0_tueews0p/0_ah5tl4il",
    "searchText": "health cluster coordination | the global health cluster (ghc) has developed this health cluster coordination elearning course in order to increase the skills and knowledge of health cluster teams and partners and to strengthen the efficiency and accountability of all stakeholders in responding to humanitarian crises. | health emergency preparedness and response management | health cluster coordination | health cluster teams and partners | who | hq/whe | whetraining@who.int | english | openwho | https://openwho.org/playlist/dedicated/495459/0_tueews0p/0_ah5tl4il"
  },
  {
    "id": "650b6d15296cc4afde3ec4d0",
    "sourceRow": 3,
    "learningName": "Health Emergency Readiness for Response Operations",
    "description": "This training defines key principles, approaches, and tools to assess your readiness status and plan for anticipatory actions to strengthen your readiness for response operations.",
    "technicalArea": "Health emergency preparedness and response management",
    "focusArea": "Emergency Response",
    "intendedAudience": "Member states/ MoH/WHO staff",
    "owner": "WHO",
    "developer": "HQ/WHE",
    "contactDetails": "WHEtraining@who.int",
    "languages": [
      "English"
    ],
    "modalityRaw": "Online",
    "modality": "online",
    "platform": "OpenWHO",
    "link": "https://openwho.org/playlist/dedicated/504475/0_ig03lfgl/0_sapp05yg",
    "comment": "",
    "signoffStatus": "",
    "normalizedLink": "https://openwho.org/playlist/dedicated/504475/0_ig03lfgl/0_sapp05yg",
    "searchText": "health emergency readiness for response operations | this training defines key principles, approaches, and tools to assess your readiness status and plan for anticipatory actions to strengthen your readiness for response operations. | health emergency preparedness and response management | emergency response | member states/ moh/who staff | who | hq/whe | whetraining@who.int | english | openwho | https://openwho.org/playlist/dedicated/504475/0_ig03lfgl/0_sapp05yg"
  },
  {
    "id": "aa80f10e38a0872d31e7e5bb",
    "sourceRow": 4,
    "learningName": "Health Security Training for Western Balkans",
    "description": "National Action Plan for Health Security training in the Western Balkans",
    "technicalArea": "Health emergency preparedness and response management",
    "focusArea": "IHR",
    "intendedAudience": "Multisectoral experts",
    "owner": "WHO",
    "developer": "HQ/WHE",
    "contactDetails": "",
    "languages": [
      "English"
    ],
    "modalityRaw": "In-person",
    "modality": "in_person",
    "platform": "",
    "link": "",
    "comment": "",
    "signoffStatus": "",
    "normalizedLink": "",
    "searchText": "health security training for western balkans | national action plan for health security training in the western balkans | health emergency preparedness and response management | ihr | multisectoral experts | who | hq/whe |  | english |  | "
  },
  {
    "id": "0c179c7e006d05349482317f",
    "sourceRow": 5,
    "learningName": "Hospital Violence Preparedness Assessment Tool",
    "description": "The Hospital Preparedness to Violence assessment tool has been created based on the recommendations of the publication \"Ensuring the Preparedness and Safety of Health Care Facilities in Armed Conflict and Other Emergencies\". The purpose is to train evaluators who can facilitate the application of the tool to verify hospital preparedness for violence",
    "technicalArea": "Health emergency preparedness and response management",
    "focusArea": "Preventing violence against health workers",
    "intendedAudience": "WHO staff/MoH/HCPs",
    "owner": "WHO",
    "developer": "PAHO/Virtual campus for public health",
    "contactDetails": "https://campus.paho.org/en/contact",
    "languages": [
      "Spanish"
    ],
    "modalityRaw": "Online",
    "modality": "online",
    "platform": "Virtual campus for public health",
    "link": "https://www.campusvirtualsp.org/es/node/28750",
    "comment": "",
    "signoffStatus": "",
    "normalizedLink": "https://www.campusvirtualsp.org/es/node/28750",
    "searchText": "hospital violence preparedness assessment tool | the hospital preparedness to violence assessment tool has been created based on the recommendations of the publication \"ensuring the preparedness and safety of health care facilities in armed conflict and other emergencies\". the purpose is to train evaluators who can facilitate the application of the tool to verify hospital preparedness for violence | health emergency preparedness and response management | preventing violence against health workers | who staff/moh/hcps | who | paho/virtual campus for public health | https://campus.paho.org/en/contact | spanish | virtual campus for public health | https://www.campusvirtualsp.org/es/node/28750"
  },
  {
    "id": "cc7b0197cef61ea648925c57",
    "sourceRow": 6,
    "learningName": "How to install Go.Data",
    "description": "This tutorial is a compilation of short videos that explains, in detail, the different ways in which Go.Data can be installed depending on the user needs.",
    "technicalArea": "Surveillance",
    "focusArea": "Outbreak investigation tool",
    "intendedAudience": "WHO staff",
    "owner": "WHO",
    "developer": "HQ/WHE/GOARN",
    "contactDetails": "goarn@who.int",
    "languages": [
      "English",
      "Spanish"
    ],
    "modalityRaw": "Online",
    "modality": "online",
    "platform": "OpenWHO",
    "link": "https://openwho.org/playlist/dedicated/502240/0_glt2e3wv/0_t0bf5iq1",
    "comment": "",
    "signoffStatus": "",
    "normalizedLink": "https://openwho.org/playlist/dedicated/502240/0_glt2e3wv/0_t0bf5iq1",
    "searchText": "how to install go.data | this tutorial is a compilation of short videos that explains, in detail, the different ways in which go.data can be installed depending on the user needs. | surveillance | outbreak investigation tool | who staff | who | hq/whe/goarn | goarn@who.int | english, spanish | openwho | https://openwho.org/playlist/dedicated/502240/0_glt2e3wv/0_t0bf5iq1"
  },
  {
    "id": "879c06c66e1810ddcd4d6984",
    "sourceRow": 7,
    "learningName": "International Coordinating Group on Vaccine Provision",
    "description": "Examine foundational understanding of the ICG and its mechanism to access the emergency vaccine stockpile for Ebola, Yellow Fever, Cholera and Meningitis.",
    "technicalArea": "Health services provision",
    "focusArea": "Vaccines",
    "intendedAudience": "Member states/ MoH/WHO staff",
    "owner": "WHO",
    "developer": "HQ/WHE",
    "contactDetails": "WHEtraining@who.int",
    "languages": [
      "English"
    ],
    "modalityRaw": "Online",
    "modality": "online",
    "platform": "OpenWHO",
    "link": "https://openwho.org/channel/International%2BCoordinating%2BGroup%2Bon%2BVaccine%2BProvision/528037",
    "comment": "",
    "signoffStatus": "",
    "normalizedLink": "https://openwho.org/channel/International%2BCoordinating%2BGroup%2Bon%2BVaccine%2BProvision/528037",
    "searchText": "international coordinating group on vaccine provision | examine foundational understanding of the icg and its mechanism to access the emergency vaccine stockpile for ebola, yellow fever, cholera and meningitis. | health services provision | vaccines | member states/ moh/who staff | who | hq/whe | whetraining@who.int | english | openwho | https://openwho.org/channel/international%2bcoordinating%2bgroup%2bon%2bvaccine%2bprovision/528037"
  },
  {
    "id": "17e10a9bbbf049525ccf0c87",
    "sourceRow": 8,
    "learningName": "IDSR Training",
    "description": "Provide you with additional information and resources to effectively conduct Integrated Disease Surveillance and Response (IDSR) activities.",
    "technicalArea": "Surveillance",
    "focusArea": "Integrated disease surveillance and response",
    "intendedAudience": "WHO staff",
    "owner": "WHO",
    "developer": "HQ/WHE",
    "contactDetails": "WHEtraining@who.int",
    "languages": [
      "English"
    ],
    "modalityRaw": "Online",
    "modality": "online",
    "platform": "OpenWHO",
    "link": "https://openwho.org/channel/Integrated+disease+surveillance+and+response/500000",
    "comment": "",
    "signoffStatus": "",
    "normalizedLink": "https://openwho.org/channel/Integrated+disease+surveillance+and+response/500000",
    "searchText": "idsr training | provide you with additional information and resources to effectively conduct integrated disease surveillance and response (idsr) activities. | surveillance | integrated disease surveillance and response | who staff | who | hq/whe | whetraining@who.int | english | openwho | https://openwho.org/channel/integrated+disease+surveillance+and+response/500000"
  },
  {
    "id": "04d964acb73eb5bb171af829",
    "sourceRow": 9,
    "learningName": "IMS and ERF training for WCOs",
    "description": "Training package for WCO on IMS, ERF and BCP",
    "technicalArea": "Health emergency preparedness and response management",
    "focusArea": "WHO IMS",
    "intendedAudience": "WCO",
    "owner": "WHO",
    "developer": "HQ/WHE",
    "contactDetails": "",
    "languages": [
      "English"
    ],
    "modalityRaw": "In-person",
    "modality": "in_person",
    "platform": "",
    "link": "",
    "comment": "",
    "signoffStatus": "",
    "normalizedLink": "",
    "searchText": "ims and erf training for wcos | training package for wco on ims, erf and bcp | health emergency preparedness and response management | who ims | wco | who | hq/whe |  | english |  | "
  },
  {
    "id": "5bcf43b5f7bd9613aa4fb9b6",
    "sourceRow": 10,
    "learningName": "Incident Command System for Hospitals (ICS-H)",
    "description": "Provide a framework for first responders to implement the Hospital Incident Command System (HCS) to address incidents of any size and complexity.",
    "technicalArea": "Health emergency preparedness and response management",
    "focusArea": "Incident command system",
    "intendedAudience": "WHO staff/MoH/HCPs",
    "owner": "WHO",
    "developer": "PAHO/Virtual campus for public health",
    "contactDetails": "https://campus.paho.org/en/contact",
    "languages": [
      "Spanish"
    ],
    "modalityRaw": "Online",
    "modality": "online",
    "platform": "Virtual campus for public health",
    "link": "https://www.campusvirtualsp.org/es/node/29200",
    "comment": "",
    "signoffStatus": "",
    "normalizedLink": "https://www.campusvirtualsp.org/es/node/29200",
    "searchText": "incident command system for hospitals (ics-h) | provide a framework for first responders to implement the hospital incident command system (hcs) to address incidents of any size and complexity. | health emergency preparedness and response management | incident command system | who staff/moh/hcps | who | paho/virtual campus for public health | https://campus.paho.org/en/contact | spanish | virtual campus for public health | https://www.campusvirtualsp.org/es/node/29200"
  },
  {
    "id": "fabd07e06af96f2370aab75b",
    "sourceRow": 11,
    "learningName": "Infectious Substances Shipping Training (e-ISST) Global",
    "description": "Contribute to improving compliance with applicable regulations, ensuring safety of staff, the public and the environment. Compliance also increases access to carrier services, and subsequent timely package delivery.",
    "technicalArea": "Laboratory",
    "focusArea": "Infectious substances shipping",
    "intendedAudience": "WHO staff",
    "owner": "WHO",
    "developer": "HQ/WHE",
    "contactDetails": "",
    "languages": [
      "English"
    ],
    "modalityRaw": "Online",
    "modality": "online",
    "platform": "HSLP",
    "link": "https://extranet.who.int/hslp/training/course/index.php?categoryid=43",
    "comment": "",
    "signoffStatus": "",
    "normalizedLink": "https://extranet.who.int/hslp/training/course/index.php?categoryid=43",
    "searchText": "infectious substances shipping training (e-isst) global | contribute to improving compliance with applicable regulations, ensuring safety of staff, the public and the environment. compliance also increases access to carrier services, and subsequent timely package delivery. | laboratory | infectious substances shipping | who staff | who | hq/whe |  | english | hslp | https://extranet.who.int/hslp/training/course/index.php?categoryid=43"
  },
  {
    "id": "3b2d2dc5711b1a68da7bd479",
    "sourceRow": 12,
    "learningName": "Influenza sentinel surveillance training",
    "description": "Learn how to analyse, summarise, report, present, and interpret data collected within a sentinel influenza surveillance system.",
    "technicalArea": "Surveillance",
    "focusArea": "Surveillance",
    "intendedAudience": "WHO staff/MoH/HCPs",
    "owner": "WHO",
    "developer": "HQ/WHE",
    "contactDetails": "WHEtraining@who.int",
    "languages": [
      "English"
    ],
    "modalityRaw": "Online",
    "modality": "online",
    "platform": "OpenWHO",
    "link": "https://openwho.org/playlist/dedicated/501679/0_9dc1d2ag/0_7ity3lsm",
    "comment": "",
    "signoffStatus": "",
    "normalizedLink": "https://openwho.org/playlist/dedicated/501679/0_9dc1d2ag/0_7ity3lsm",
    "searchText": "influenza sentinel surveillance training | learn how to analyse, summarise, report, present, and interpret data collected within a sentinel influenza surveillance system. | surveillance | surveillance | who staff/moh/hcps | who | hq/whe | whetraining@who.int | english | openwho | https://openwho.org/playlist/dedicated/501679/0_9dc1d2ag/0_7ity3lsm"
  },
  {
    "id": "c7bd1364a86b7cd370bb1370",
    "sourceRow": 13,
    "learningName": "Influenza surveillance data analysis and bulletin writing workshop",
    "description": "Workshop to build capacity in influenza surveillance data analysis, threshold setting and bulletin writing",
    "technicalArea": "Surveillance",
    "focusArea": "Surveillance",
    "intendedAudience": "NFPs/surveillance staff",
    "owner": "WHO",
    "developer": "HQ/WHE",
    "contactDetails": "",
    "languages": [
      "English"
    ],
    "modalityRaw": "In-person",
    "modality": "in_person",
    "platform": "",
    "link": "",
    "comment": "",
    "signoffStatus": "",
    "normalizedLink": "",
    "searchText": "influenza surveillance data analysis and bulletin writing workshop | workshop to build capacity in influenza surveillance data analysis, threshold setting and bulletin writing | surveillance | surveillance | nfps/surveillance staff | who | hq/whe |  | english |  | "
  },
  {
    "id": "6d88510246f8a064d2fab323",
    "sourceRow": 14,
    "learningName": "Influenza surveillance data threshold setting workshop",
    "description": "Review approach and support in application of Pandemic Influenza Severity Assessment and appyling threshold setting to inluenza/syndromic surveillance data using the moving epidemic method",
    "technicalArea": "Surveillance",
    "focusArea": "Surveillance",
    "intendedAudience": "NFPs/surveillance staff",
    "owner": "WHO",
    "developer": "HQ/WHE",
    "contactDetails": "",
    "languages": [
      "English"
    ],
    "modalityRaw": "In-person",
    "modality": "in_person",
    "platform": "",
    "link": "",
    "comment": "",
    "signoffStatus": "",
    "normalizedLink": "",
    "searchText": "influenza surveillance data threshold setting workshop | review approach and support in application of pandemic influenza severity assessment and appyling threshold setting to inluenza/syndromic surveillance data using the moving epidemic method | surveillance | surveillance | nfps/surveillance staff | who | hq/whe |  | english |  | "
  },
  {
    "id": "f5b2ba8b78281fb99a25d85b",
    "sourceRow": 15,
    "learningName": "Infodemic Management 101",
    "description": "Course is for anyone interested in understanding what an infodemic is, how it dramatically affects public health and what we can do about it now and into the future",
    "technicalArea": "Risk communication and community engagement (RCCE)",
    "focusArea": "COVID-19",
    "intendedAudience": "WHO staff",
    "owner": "WHO",
    "developer": "HQ/WHE",
    "contactDetails": "WHEtraining@who.int",
    "languages": [
      "English"
    ],
    "modalityRaw": "Online",
    "modality": "online",
    "platform": "OpenWHO",
    "link": "https://openwho.org/playlist/dedicated/499738/0_47ngign5/0_q6tpx5f6",
    "comment": "",
    "signoffStatus": "",
    "normalizedLink": "https://openwho.org/playlist/dedicated/499738/0_47ngign5/0_q6tpx5f6",
    "searchText": "infodemic management 101 | course is for anyone interested in understanding what an infodemic is, how it dramatically affects public health and what we can do about it now and into the future | risk communication and community engagement (rcce) | covid-19 | who staff | who | hq/whe | whetraining@who.int | english | openwho | https://openwho.org/playlist/dedicated/499738/0_47ngign5/0_q6tpx5f6"
  },
  {
    "id": "4a8f0b7d375b5a101b1e844d",
    "sourceRow": 16,
    "learningName": "Infodemic Management: Addressing health misinformation and disinformation",
    "description": "This course introduces the learners to the concept of health misinformation in an infodemic management context, what harms it can cause, how it spreads, and how to prevent and manage it. It also dives deeper into the difference between misinformation and disinformation with an overview of how threat actors weaponize information during public health emergencies to cause harm.",
    "technicalArea": "Risk communication and community engagement (RCCE)",
    "focusArea": "Infodemic",
    "intendedAudience": "Member states/ MoH/WHO staff",
    "owner": "WHO",
    "developer": "HQ/WHE/EPP",
    "contactDetails": "WHEtraining@who.int",
    "languages": [
      "English"
    ],
    "modalityRaw": "Online",
    "modality": "online",
    "platform": "OpenWHO",
    "link": "https://openwho.org/playlist/dedicated/499738/0_4tojm0ij/0_5zupie62",
    "comment": "",
    "signoffStatus": "",
    "normalizedLink": "https://openwho.org/playlist/dedicated/499738/0_4tojm0ij/0_5zupie62",
    "searchText": "infodemic management: addressing health misinformation and disinformation | this course introduces the learners to the concept of health misinformation in an infodemic management context, what harms it can cause, how it spreads, and how to prevent and manage it. it also dives deeper into the difference between misinformation and disinformation with an overview of how threat actors weaponize information during public health emergencies to cause harm. | risk communication and community engagement (rcce) | infodemic | member states/ moh/who staff | who | hq/whe/epp | whetraining@who.int | english | openwho | https://openwho.org/playlist/dedicated/499738/0_4tojm0ij/0_5zupie62"
  },
  {
    "id": "c57d47f2cad6fd8e183333cf",
    "sourceRow": 17,
    "learningName": "Infodemic Management: Defining a taxonomy for social listening",
    "description": "When practicing social listening activities for public health purposes such as infodemic management, health professionals need a taxonomy adapted to their questions and to the domain they cover. Tailoring their search strategy to collect data relevant for infodemic insights generation will allow them to build strong and evidence-based recommendations for public health action. This course will equip health public health workers to design a taxonomy for social listening adapted to their needs.",
    "technicalArea": "Risk communication and community engagement (RCCE)",
    "focusArea": "Infodemic",
    "intendedAudience": "Member states/ MoH/WHO staff",
    "owner": "WHO",
    "developer": "HQ/WHE/EPP",
    "contactDetails": "WHEtraining@who.int",
    "languages": [
      "English"
    ],
    "modalityRaw": "Online",
    "modality": "online",
    "platform": "OpenWHO",
    "link": "https://openwho.org/playlist/dedicated/499738/0_fsg88i20/0_mbihfi83",
    "comment": "",
    "signoffStatus": "",
    "normalizedLink": "https://openwho.org/playlist/dedicated/499738/0_fsg88i20/0_mbihfi83",
    "searchText": "infodemic management: defining a taxonomy for social listening | when practicing social listening activities for public health purposes such as infodemic management, health professionals need a taxonomy adapted to their questions and to the domain they cover. tailoring their search strategy to collect data relevant for infodemic insights generation will allow them to build strong and evidence-based recommendations for public health action. this course will equip health public health workers to design a taxonomy for social listening adapted to their needs. | risk communication and community engagement (rcce) | infodemic | member states/ moh/who staff | who | hq/whe/epp | whetraining@who.int | english | openwho | https://openwho.org/playlist/dedicated/499738/0_fsg88i20/0_mbihfi83"
  },
  {
    "id": "485a7d0ef58e96acac64d2cb",
    "sourceRow": 18,
    "learningName": "Infodemic management: Developing an infodemic insights report",
    "description": "This course, which is part of the “Infodemic management course series” provides an overview of the steps the learners can take to plan for and develop an infodemic insights report. Developing an infodemic insights report is one of the key actions taken by infodemic managers to help health authorities and partners identify, questions, concerns, information voids, narratives and circulating mis- and disinformation on a particular health topic and propose preventive and corrective actions toward mitigating the infodemic.",
    "technicalArea": "Risk communication and community engagement (RCCE)",
    "focusArea": "Infodemic",
    "intendedAudience": "Member states/ MoH/WHO staff",
    "owner": "WHO",
    "developer": "HQ/WHE/EPP",
    "contactDetails": "WHEtraining@who.int",
    "languages": [
      "English"
    ],
    "modalityRaw": "Online",
    "modality": "online",
    "platform": "OpenWHO",
    "link": "https://openwho.org/playlist/dedicated/499738/0_tbe4lkl3/0_u6k3jz0o",
    "comment": "",
    "signoffStatus": "",
    "normalizedLink": "https://openwho.org/playlist/dedicated/499738/0_tbe4lkl3/0_u6k3jz0o",
    "searchText": "infodemic management: developing an infodemic insights report | this course, which is part of the “infodemic management course series” provides an overview of the steps the learners can take to plan for and develop an infodemic insights report. developing an infodemic insights report is one of the key actions taken by infodemic managers to help health authorities and partners identify, questions, concerns, information voids, narratives and circulating mis- and disinformation on a particular health topic and propose preventive and corrective actions toward mitigating the infodemic. | risk communication and community engagement (rcce) | infodemic | member states/ moh/who staff | who | hq/whe/epp | whetraining@who.int | english | openwho | https://openwho.org/playlist/dedicated/499738/0_tbe4lkl3/0_u6k3jz0o"
  },
  {
    "id": "8defa295d7b624393fcc8d5e",
    "sourceRow": 19,
    "learningName": "Infodemic Management: Social marketing and message testing methods",
    "description": "This course shows how social marketing and message testing methods can help public health authorities to design effective campaigns and interventions.",
    "technicalArea": "Risk communication and community engagement (RCCE)",
    "focusArea": "Infodemic",
    "intendedAudience": "Member states/ MoH/WHO staff",
    "owner": "WHO",
    "developer": "HQ/WHE/EPP",
    "contactDetails": "WHEtraining@who.int",
    "languages": [
      "English"
    ],
    "modalityRaw": "Online",
    "modality": "online",
    "platform": "OpenWHO",
    "link": "https://openwho.org/playlist/dedicated/499738/0_upydku29/0_8zk7zfd2",
    "comment": "",
    "signoffStatus": "",
    "normalizedLink": "https://openwho.org/playlist/dedicated/499738/0_upydku29/0_8zk7zfd2",
    "searchText": "infodemic management: social marketing and message testing methods | this course shows how social marketing and message testing methods can help public health authorities to design effective campaigns and interventions. | risk communication and community engagement (rcce) | infodemic | member states/ moh/who staff | who | hq/whe/epp | whetraining@who.int | english | openwho | https://openwho.org/playlist/dedicated/499738/0_upydku29/0_8zk7zfd2"
  },
  {
    "id": "abdae2a8268f10f11985cb38",
    "sourceRow": 20,
    "learningName": "Infodemic Management: Using human-centered design good practices",
    "description": "This course helps public health workers to understand and use best practices of Human-Centered Design (HCD) to inform their work at different stages of their infodemic management process.",
    "technicalArea": "Risk communication and community engagement (RCCE)",
    "focusArea": "Infodemic",
    "intendedAudience": "Member states/ MoH/WHO staff",
    "owner": "WHO",
    "developer": "HQ/WHE/EPP",
    "contactDetails": "WHEtraining@who.int",
    "languages": [
      "English"
    ],
    "modalityRaw": "Online",
    "modality": "online",
    "platform": "OpenWHO",
    "link": "https://openwho.org/playlist/dedicated/499738/0_st7yq8gd/0_ab9vz8fn",
    "comment": "",
    "signoffStatus": "",
    "normalizedLink": "https://openwho.org/playlist/dedicated/499738/0_st7yq8gd/0_ab9vz8fn",
    "searchText": "infodemic management: using human-centered design good practices | this course helps public health workers to understand and use best practices of human-centered design (hcd) to inform their work at different stages of their infodemic management process. | risk communication and community engagement (rcce) | infodemic | member states/ moh/who staff | who | hq/whe/epp | whetraining@who.int | english | openwho | https://openwho.org/playlist/dedicated/499738/0_st7yq8gd/0_ab9vz8fn"
  },
  {
    "id": "196595c3f6ce434187e59df5",
    "sourceRow": 21,
    "learningName": "Infodemic Management: Working effectively as an infodemic manager in the field",
    "description": "This course introduces learners to the work of an infodemic manager in the field, during health emergencies or in routine. It explains what the principles of this new kind of job are. It also allows learners to discover what tasks and challenges an infodemic manager needs to handle, and how to master them.",
    "technicalArea": "Risk communication and community engagement (RCCE)",
    "focusArea": "Infodemic",
    "intendedAudience": "Member states/ MoH/WHO staff",
    "owner": "WHO",
    "developer": "HQ/WHE/EPP",
    "contactDetails": "WHEtraining@who.int",
    "languages": [
      "English"
    ],
    "modalityRaw": "Online",
    "modality": "online",
    "platform": "OpenWHO",
    "link": "https://openwho.org/playlist/dedicated/499738/0_npzy2jre/0_7debt56o",
    "comment": "",
    "signoffStatus": "",
    "normalizedLink": "https://openwho.org/playlist/dedicated/499738/0_npzy2jre/0_7debt56o",
    "searchText": "infodemic management: working effectively as an infodemic manager in the field | this course introduces learners to the work of an infodemic manager in the field, during health emergencies or in routine. it explains what the principles of this new kind of job are. it also allows learners to discover what tasks and challenges an infodemic manager needs to handle, and how to master them. | risk communication and community engagement (rcce) | infodemic | member states/ moh/who staff | who | hq/whe/epp | whetraining@who.int | english | openwho | https://openwho.org/playlist/dedicated/499738/0_npzy2jre/0_7debt56o"
  },
  {
    "id": "d8e799520305eaf8a83a2275",
    "sourceRow": 22,
    "learningName": "Interregional Field Simulation Exercise (IFX) Programme for Rapid Response Mobile Labs",
    "description": "Rapid Response Mobile Laboratories (RRMLs) provide critical laboratory diagnostic support in crisis situations and are an important asset of the global emergency workforce. In 2018, the Health Emergencies Programme (WHE) at the WHO Regional Office for Europe established the RRML Network, driven by the European partner institutions of the Global Outbreak Alert and Response Network (GOARN), to advance and integrate RRMLs into existing preparedness and response structures and to standardize RRML operations in the field.",
    "technicalArea": "Laboratory",
    "focusArea": "GOARN",
    "intendedAudience": "",
    "owner": "WHO",
    "developer": "HQ/WHE/GOARN",
    "contactDetails": "goarn@who.int",
    "languages": [
      "English"
    ],
    "modalityRaw": "In-person",
    "modality": "in_person",
    "platform": "GOARN",
    "link": "",
    "comment": "",
    "signoffStatus": "",
    "normalizedLink": "",
    "searchText": "interregional field simulation exercise (ifx) programme for rapid response mobile labs | rapid response mobile laboratories (rrmls) provide critical laboratory diagnostic support in crisis situations and are an important asset of the global emergency workforce. in 2018, the health emergencies programme (whe) at the who regional office for europe established the rrml network, driven by the european partner institutions of the global outbreak alert and response network (goarn), to advance and integrate rrmls into existing preparedness and response structures and to standardize rrml operations in the field. | laboratory | goarn |  | who | hq/whe/goarn | goarn@who.int | english | goarn | "
  },
  {
    "id": "cc0dd0e021423fdbced9684f",
    "sourceRow": 23,
    "learningName": "Introducing Mental Health and Psychosocial Support (MHPSS) in emergencies",
    "description": "Strengthening the competencies of health sector actors working in emergencies, to establish, support and scale up Mental Health and Psychosocial Support in countries.",
    "technicalArea": "Health services provision",
    "focusArea": "Mental health",
    "intendedAudience": "Member states/ MoH/WHO staff",
    "owner": "WHO",
    "developer": "HQ/WHE",
    "contactDetails": "WHEtraining@who.int",
    "languages": [
      "English",
      "Spanish",
      "Polish",
      "Ukrainian"
    ],
    "modalityRaw": "Online",
    "modality": "online",
    "platform": "OpenWHO",
    "link": "https://openwho.org/playlist/dedicated/536361/0_fi0dbfix/0_blb84xc7",
    "comment": "",
    "signoffStatus": "",
    "normalizedLink": "https://openwho.org/playlist/dedicated/536361/0_fi0dbfix/0_blb84xc7",
    "searchText": "introducing mental health and psychosocial support (mhpss) in emergencies | strengthening the competencies of health sector actors working in emergencies, to establish, support and scale up mental health and psychosocial support in countries. | health services provision | mental health | member states/ moh/who staff | who | hq/whe | whetraining@who.int | english, spanish, polish, ukrainian | openwho | https://openwho.org/playlist/dedicated/536361/0_fi0dbfix/0_blb84xc7"
  },
  {
    "id": "dd4181f69e9917868bdb1a30",
    "sourceRow": 24,
    "learningName": "Introduction to Epidemic Intelligence from Open Sources",
    "description": "This series of videos provides an introduction to the EIOS Initiative and the EIOS System. This course provides an orientation of the key features and functionalities of the EIOS System.",
    "technicalArea": "Surveillance",
    "focusArea": "IHR, surveillance",
    "intendedAudience": "Health care workforce, public healht officers and policy makers/ Member states/ MoH/WHO staff",
    "owner": "WHO",
    "developer": "HQ/WHE/EIOS",
    "contactDetails": "eios@who.int",
    "languages": [
      "Arabic",
      "English",
      "French",
      "Portuguese",
      "Spanish"
    ],
    "modalityRaw": "Online",
    "modality": "online",
    "platform": "WHO Academy",
    "link": "https://whoacademy.org/coursewares/course-v1:WHOAcademy-Hosted+H0119EN+2025_Q1?source=edX",
    "comment": "",
    "signoffStatus": "",
    "normalizedLink": "https://whoacademy.org/coursewares/course-v1:WHOAcademy-Hosted+H0119EN+2025_Q1?source=edX",
    "searchText": "introduction to epidemic intelligence from open sources | this series of videos provides an introduction to the eios initiative and the eios system. this course provides an orientation of the key features and functionalities of the eios system. | surveillance | ihr, surveillance | health care workforce, public healht officers and policy makers/ member states/ moh/who staff | who | hq/whe/eios | eios@who.int | arabic, english, french, portuguese, spanish | who academy | https://whoacademy.org/coursewares/course-v1:whoacademy-hosted+h0119en+2025_q1?source=edx"
  },
  {
    "id": "b34e41c0dcaddbbdc95adce8",
    "sourceRow": 25,
    "learningName": "Introduction to IHR Monitoring and Evaluation",
    "description": "Build M&E capacities necessary to monitor implementation of IHR among member states. * \"The training will need to be updated to align with the IHR amendments when they enter into force\"",
    "technicalArea": "Research & monitoring and evaluation",
    "focusArea": "IHR",
    "intendedAudience": "WHO and partners staff.",
    "owner": "WHO",
    "developer": "HQ/WHE",
    "contactDetails": "",
    "languages": [
      "English"
    ],
    "modalityRaw": "Online",
    "modality": "online",
    "platform": "HSLP",
    "link": "https://extranet.who.int/hslp/training/enrol/index.php?id=345",
    "comment": "",
    "signoffStatus": "",
    "normalizedLink": "https://extranet.who.int/hslp/training/enrol/index.php?id=345",
    "searchText": "introduction to ihr monitoring and evaluation | build m&e capacities necessary to monitor implementation of ihr among member states. * \"the training will need to be updated to align with the ihr amendments when they enter into force\" | research & monitoring and evaluation | ihr | who and partners staff. | who | hq/whe |  | english | hslp | https://extranet.who.int/hslp/training/enrol/index.php?id=345"
  },
  {
    "id": "61eb93924f95d74d9c1d676e",
    "sourceRow": 26,
    "learningName": "Introduction to Marburg Virus Disease",
    "description": "Overview of the signs, symptoms, transmission routes, diagnosis, and epidemiology of the disease. It also discusses prevention and control strategies.",
    "technicalArea": "Health emergency preparedness and response management",
    "focusArea": "Marburg Virus",
    "intendedAudience": "WHO staff",
    "owner": "WHO",
    "developer": "HQ/WHE",
    "contactDetails": "WHEtraining@who.int",
    "languages": [
      "English",
      "Spanish",
      "French",
      "Dholuo",
      "Kiswahili",
      "Kirundi"
    ],
    "modalityRaw": "Online",
    "modality": "online",
    "platform": "OpenWHO",
    "link": "https://openwho.org/media/MVD%20Module%201%3A%20Introduction/0_8004qjw3/536450",
    "comment": "",
    "signoffStatus": "",
    "normalizedLink": "https://openwho.org/media/MVD%20Module%201%3A%20Introduction/0_8004qjw3/536450",
    "searchText": "introduction to marburg virus disease | overview of the signs, symptoms, transmission routes, diagnosis, and epidemiology of the disease. it also discusses prevention and control strategies. | health emergency preparedness and response management | marburg virus | who staff | who | hq/whe | whetraining@who.int | english, spanish, french, dholuo, kiswahili, kirundi | openwho | https://openwho.org/media/mvd%20module%201%3a%20introduction/0_8004qjw3/536450"
  },
  {
    "id": "b636ddd731cc620f34c8a113",
    "sourceRow": 27,
    "learningName": "Introduction to Nipah virus disease",
    "description": "Discuss prevention and control strategies.",
    "technicalArea": "Health emergency preparedness and response management",
    "focusArea": "Nipah virus",
    "intendedAudience": "WHO staff/MoH/HCPs",
    "owner": "WHO",
    "developer": "HQ/WHE",
    "contactDetails": "WHEtraining@who.int",
    "languages": [
      "English"
    ],
    "modalityRaw": "Online",
    "modality": "online",
    "platform": "OpenWHO",
    "link": "https://openwho.org/channel/Nipah+virus+disease/538567",
    "comment": "",
    "signoffStatus": "",
    "normalizedLink": "https://openwho.org/channel/Nipah+virus+disease/538567",
    "searchText": "introduction to nipah virus disease | discuss prevention and control strategies. | health emergency preparedness and response management | nipah virus | who staff/moh/hcps | who | hq/whe | whetraining@who.int | english | openwho | https://openwho.org/channel/nipah+virus+disease/538567"
  },
  {
    "id": "586f1aac4b3a458cb781c212",
    "sourceRow": 28,
    "learningName": "Introduction to oxygen systems",
    "description": "The course provides an overview of medical oxygen systems, their ecosystem, life cycle, and global procurement challenges, with a focus on standards and ethical considerations.",
    "technicalArea": "Health services provision",
    "focusArea": "Oxygen supply management",
    "intendedAudience": "WHO staff/MoH/HCPs",
    "owner": "WHO",
    "developer": "HQ/WHE",
    "contactDetails": "WHEtraining@who.int",
    "languages": [
      "English"
    ],
    "modalityRaw": "Online",
    "modality": "online",
    "platform": "OpenWHO",
    "link": "https://openwho.org/media/Oxygen%20ecosystem%20%20oxygen%20systems/0_gd4cunhh/500316",
    "comment": "",
    "signoffStatus": "",
    "normalizedLink": "https://openwho.org/media/Oxygen%20ecosystem%20%20oxygen%20systems/0_gd4cunhh/500316",
    "searchText": "introduction to oxygen systems | the course provides an overview of medical oxygen systems, their ecosystem, life cycle, and global procurement challenges, with a focus on standards and ethical considerations. | health services provision | oxygen supply management | who staff/moh/hcps | who | hq/whe | whetraining@who.int | english | openwho | https://openwho.org/media/oxygen%20ecosystem%20%20oxygen%20systems/0_gd4cunhh/500316"
  },
  {
    "id": "109d081eb014f3a8a5430682",
    "sourceRow": 29,
    "learningName": "Emergency Response Framework (ERF)",
    "description": "The Emergency Response Framework provides WHO staff with essential guidance on how the Organization manages the assessment, grading and response to public health events and emergencies with health consequences, in support of Member States and affected communities. Building on the principles of the ERF, this course provides an overview of WHO’s role in emergencies, the Incident Management System (IMS) and its key functions, and the process from verification to response to a public health emergency.",
    "technicalArea": "Health emergency preparedness and response management",
    "focusArea": "WHO Emergency Framework",
    "intendedAudience": "WHO staff",
    "owner": "WHO",
    "developer": "HQ/WHE",
    "contactDetails": "WHEtraining@who.int",
    "languages": [
      "English"
    ],
    "modalityRaw": "Online",
    "modality": "online",
    "platform": "OpenWHO",
    "link": "https://openwho.org/channel/Emergency+Response+Framework/537832",
    "comment": "",
    "signoffStatus": "",
    "normalizedLink": "https://openwho.org/channel/Emergency+Response+Framework/537832",
    "searchText": "emergency response framework (erf) | the emergency response framework provides who staff with essential guidance on how the organization manages the assessment, grading and response to public health events and emergencies with health consequences, in support of member states and affected communities. building on the principles of the erf, this course provides an overview of who’s role in emergencies, the incident management system (ims) and its key functions, and the process from verification to response to a public health emergency. | health emergency preparedness and response management | who emergency framework | who staff | who | hq/whe | whetraining@who.int | english | openwho | https://openwho.org/channel/emergency+response+framework/537832"
  },
  {
    "id": "96e612ab868b3b670680e000",
    "sourceRow": 30,
    "learningName": "Introduction to the International Health Regulations (IHR)",
    "description": "This course, designed as an evolving scenario-based exercise in a fictional country, aims to equip participants with the knowledge needed to assess public health events and notify them to WHO as required under the International Health Regulations. * \"The training will need to be updated to align with the IHR amendments when they enter into force\"",
    "technicalArea": "IHR Coordination and National IHR Focal Point Functions",
    "focusArea": "IHR",
    "intendedAudience": "\"National International Health Regulations Focal Points,WHO IHR Contact Points, Other IHR stakeholders \"",
    "owner": "WHO",
    "developer": "HQ/WHE",
    "contactDetails": "whoasupport@who.int",
    "languages": [
      "English"
    ],
    "modalityRaw": "Online",
    "modality": "online",
    "platform": "WHO Academy",
    "link": "https://web-staging.lxp.academy.who.int/coursewares/course-v1:WHOA+0092_IHR_EN+2024?from=discovery&amp;source=edX",
    "comment": "",
    "signoffStatus": "",
    "normalizedLink": "https://web-staging.lxp.academy.who.int/coursewares/course-v1:WHOA+0092_IHR_EN+2024?from=discovery&source=edX",
    "searchText": "introduction to the international health regulations (ihr) | this course, designed as an evolving scenario-based exercise in a fictional country, aims to equip participants with the knowledge needed to assess public health events and notify them to who as required under the international health regulations. * \"the training will need to be updated to align with the ihr amendments when they enter into force\" | ihr coordination and national ihr focal point functions | ihr | \"national international health regulations focal points,who ihr contact points, other ihr stakeholders \" | who | hq/whe | whoasupport@who.int | english | who academy | https://web-staging.lxp.academy.who.int/coursewares/course-v1:whoa+0092_ihr_en+2024?from=discovery&source=edx"
  },
  {
    "id": "fa6a19230cbeb911548ea21f",
    "sourceRow": 31,
    "learningName": "Joint External Evaluation - Team Member Orientation",
    "description": "Describe the key steps of the Joint External Evaluation (JEE) process and the role of team members when facilitating technical discussions and drafting the Final Report",
    "technicalArea": "Research & monitoring and evaluation",
    "focusArea": "JEE",
    "intendedAudience": "JEE team members",
    "owner": "WHO",
    "developer": "HQ/WHE",
    "contactDetails": "",
    "languages": [
      "English"
    ],
    "modalityRaw": "Online",
    "modality": "online",
    "platform": "HSLP",
    "link": "https://extranet.who.int/hslp/training/enrol/index.php?id=116",
    "comment": "",
    "signoffStatus": "",
    "normalizedLink": "https://extranet.who.int/hslp/training/enrol/index.php?id=116",
    "searchText": "joint external evaluation - team member orientation | describe the key steps of the joint external evaluation (jee) process and the role of team members when facilitating technical discussions and drafting the final report | research & monitoring and evaluation | jee | jee team members | who | hq/whe |  | english | hslp | https://extranet.who.int/hslp/training/enrol/index.php?id=116"
  },
  {
    "id": "9ec833133edc1f81e8fd63d8",
    "sourceRow": 32,
    "learningName": "Joint External Evaluation : Introduction",
    "description": "The course provides understanding of the JEE process, its objectives, principles, and methods. The course will also demonstrate how the JEE results can inform the strengthening of health security capacities and the development and implementation of the National Action Plan for Health Security (NAPHS).",
    "technicalArea": "Research & monitoring and evaluation",
    "focusArea": "JEE",
    "intendedAudience": "Country teams, external experts and technical writers",
    "owner": "WHO",
    "developer": "HQ/WHE",
    "contactDetails": "WHEtraining@who.int",
    "languages": [
      "English"
    ],
    "modalityRaw": "Online",
    "modality": "online",
    "platform": "OpenWHO",
    "link": "https://openwho.org/playlist/dedicated/501681/0_lse5ad3j/0_kdylw4pv",
    "comment": "",
    "signoffStatus": "",
    "normalizedLink": "https://openwho.org/playlist/dedicated/501681/0_lse5ad3j/0_kdylw4pv",
    "searchText": "joint external evaluation : introduction | the course provides understanding of the jee process, its objectives, principles, and methods. the course will also demonstrate how the jee results can inform the strengthening of health security capacities and the development and implementation of the national action plan for health security (naphs). | research & monitoring and evaluation | jee | country teams, external experts and technical writers | who | hq/whe | whetraining@who.int | english | openwho | https://openwho.org/playlist/dedicated/501681/0_lse5ad3j/0_kdylw4pv"
  },
  {
    "id": "8703538d283fd35e572bba78",
    "sourceRow": 33,
    "learningName": "Joint External Evaluation for Subject Matter Experts",
    "description": "This course aims to provide JEE subject matter experts (JEE SMEs) with an understanding of the JEE process, its objectives, principles, and methods. The course provides an in-depth focus on the role of JEE SMEs in conducting an effective evaluation and writing technical area reports.",
    "technicalArea": "Research & monitoring and evaluation",
    "focusArea": "JEE",
    "intendedAudience": "JEE subject matter experts (JEE SMEs)",
    "owner": "WHO",
    "developer": "HQ/WHE",
    "contactDetails": "WHEtraining@who.int",
    "languages": [
      "English"
    ],
    "modalityRaw": "Online",
    "modality": "online",
    "platform": "OpenWHO",
    "link": "https://openwho.org/playlist/dedicated/501681/0_kgk6qf51/0_hw05biam",
    "comment": "",
    "signoffStatus": "",
    "normalizedLink": "https://openwho.org/playlist/dedicated/501681/0_kgk6qf51/0_hw05biam",
    "searchText": "joint external evaluation for subject matter experts | this course aims to provide jee subject matter experts (jee smes) with an understanding of the jee process, its objectives, principles, and methods. the course provides an in-depth focus on the role of jee smes in conducting an effective evaluation and writing technical area reports. | research & monitoring and evaluation | jee | jee subject matter experts (jee smes) | who | hq/whe | whetraining@who.int | english | openwho | https://openwho.org/playlist/dedicated/501681/0_kgk6qf51/0_hw05biam"
  },
  {
    "id": "74332480970bec447d1cca16",
    "sourceRow": 34,
    "learningName": "Joint External Evaluation for Technical Writers",
    "description": "This course aims to provide technical writers with an understanding of the JEE process, its objectives, principles, and the importance of coming up with a JEE report that reflects the results of the evaluation.",
    "technicalArea": "Research & monitoring and evaluation",
    "focusArea": "JEE",
    "intendedAudience": "Technical writers",
    "owner": "WHO",
    "developer": "HQ/WHE",
    "contactDetails": "WHEtraining@who.int",
    "languages": [
      "English"
    ],
    "modalityRaw": "Online",
    "modality": "online",
    "platform": "OpenWHO",
    "link": "https://openwho.org/playlist/dedicated/501681/0_emyia387/0_6htlnfwz",
    "comment": "",
    "signoffStatus": "",
    "normalizedLink": "https://openwho.org/playlist/dedicated/501681/0_emyia387/0_6htlnfwz",
    "searchText": "joint external evaluation for technical writers | this course aims to provide technical writers with an understanding of the jee process, its objectives, principles, and the importance of coming up with a jee report that reflects the results of the evaluation. | research & monitoring and evaluation | jee | technical writers | who | hq/whe | whetraining@who.int | english | openwho | https://openwho.org/playlist/dedicated/501681/0_emyia387/0_6htlnfwz"
  },
  {
    "id": "62c6facf552cbbc5c4a4a15f",
    "sourceRow": 35,
    "learningName": "Laboratory Quality Management System - Basics",
    "description": "Aimed to the laboratorian who wants to acquire knowledge about five of the building blocks considered as the basics of a laboratory quality management system.",
    "technicalArea": "Laboratory",
    "focusArea": "Laboratory quality",
    "intendedAudience": "Laboratory managers, senior biologists and technologists",
    "owner": "WHO",
    "developer": "HQ/WHE",
    "contactDetails": "",
    "languages": [
      "English",
      "French",
      "Russian",
      "Spanish"
    ],
    "modalityRaw": "Online",
    "modality": "online",
    "platform": "HSLP",
    "link": "https://extranet.who.int/hslp/training/course/index.php?categoryid=41",
    "comment": "",
    "signoffStatus": "",
    "normalizedLink": "https://extranet.who.int/hslp/training/course/index.php?categoryid=41",
    "searchText": "laboratory quality management system - basics | aimed to the laboratorian who wants to acquire knowledge about five of the building blocks considered as the basics of a laboratory quality management system. | laboratory | laboratory quality | laboratory managers, senior biologists and technologists | who | hq/whe |  | english, french, russian, spanish | hslp | https://extranet.who.int/hslp/training/course/index.php?categoryid=41"
  },
  {
    "id": "2d20c39163c34856a5efb1d2",
    "sourceRow": 36,
    "learningName": "Laboratory Quality Management System Training Toolkit",
    "description": "Intend to provide comprehensive materials that will allow for designing and organizing training workshops for all stakeholders in health laboratory processes, from management, to administration, to bench-work laboratorians.",
    "technicalArea": "Laboratory",
    "focusArea": "Laboratory quality",
    "intendedAudience": "Public health institutions (schools of medicine, public health, etc.), ministries and other organizations",
    "owner": "WHO",
    "developer": "HQ/WHE",
    "contactDetails": "",
    "languages": [
      "English"
    ],
    "modalityRaw": "Training toolkits and packages",
    "modality": "toolkit",
    "platform": "HSLP",
    "link": "https://extranet.who.int/hslp/content/LQMS-training-toolkit",
    "comment": "",
    "signoffStatus": "",
    "normalizedLink": "https://extranet.who.int/hslp/content/LQMS-training-toolkit",
    "searchText": "laboratory quality management system training toolkit | intend to provide comprehensive materials that will allow for designing and organizing training workshops for all stakeholders in health laboratory processes, from management, to administration, to bench-work laboratorians. | laboratory | laboratory quality | public health institutions (schools of medicine, public health, etc.), ministries and other organizations | who | hq/whe |  | english | hslp | https://extranet.who.int/hslp/content/lqms-training-toolkit"
  },
  {
    "id": "014bab9e74c09e75b0c9663d",
    "sourceRow": 37,
    "learningName": "Lassa fever Introduction",
    "description": "General introduction to Lassa fever through a downloadable presentation that can be reviewed at your own pace and quizzes to test your knowledge",
    "technicalArea": "Health services provision",
    "focusArea": "Lassa fever",
    "intendedAudience": "WHO staff/MoH/HCPs",
    "owner": "WHO",
    "developer": "HQ/WHE",
    "contactDetails": "WHEtraining@who.int",
    "languages": [
      "English",
      "French"
    ],
    "modalityRaw": "Online",
    "modality": "online",
    "platform": "OpenWHO",
    "link": "https://openwho.org/playlist/dedicated/538566/0_0p8pqfkf/0_konoi3f8",
    "comment": "",
    "signoffStatus": "",
    "normalizedLink": "https://openwho.org/playlist/dedicated/538566/0_0p8pqfkf/0_konoi3f8",
    "searchText": "lassa fever introduction | general introduction to lassa fever through a downloadable presentation that can be reviewed at your own pace and quizzes to test your knowledge | health services provision | lassa fever | who staff/moh/hcps | who | hq/whe | whetraining@who.int | english, french | openwho | https://openwho.org/playlist/dedicated/538566/0_0p8pqfkf/0_konoi3f8"
  },
  {
    "id": "92df24c221b191e60fcca0be",
    "sourceRow": 38,
    "learningName": "Leadership in Emergencies Phase 1",
    "description": "Personal leadership development in emergency setting. The phase one includes online self-paced learning (https://openwho.org/channel/Ready4Response/494536) and eight weeks of online classes focused on developing leadership skills.",
    "technicalArea": "Leadership",
    "focusArea": "Leadership in emergencies",
    "intendedAudience": "MoH and WHO (emergencies) staff: Incident Manager, Health Cluster Coordinator and Function Team Leads",
    "owner": "WHO",
    "developer": "HQ/WHE/LCD",
    "contactDetails": "whetraining@who.int",
    "languages": [
      "English"
    ],
    "modalityRaw": "Online",
    "modality": "online",
    "platform": "",
    "link": "",
    "comment": "",
    "signoffStatus": "",
    "normalizedLink": "",
    "searchText": "leadership in emergencies phase 1 | personal leadership development in emergency setting. the phase one includes online self-paced learning (https://openwho.org/channel/ready4response/494536) and eight weeks of online classes focused on developing leadership skills. | leadership | leadership in emergencies | moh and who (emergencies) staff: incident manager, health cluster coordinator and function team leads | who | hq/whe/lcd | whetraining@who.int | english |  | "
  },
  {
    "id": "65e55aa1922dfe3c83d08c7d",
    "sourceRow": 39,
    "learningName": "Leadership in Emergencies Phase 2",
    "description": "The phase 2 course consists of two elements; an online module and a face-to-face workshop",
    "technicalArea": "Leadership",
    "focusArea": "Leadership in emergencies",
    "intendedAudience": "MoH and WHO (emergencies) staff: Incident Manager, Health Cluster Coordinator and Function Team Leads",
    "owner": "WHO",
    "developer": "HQ/WHE/LCD",
    "contactDetails": "whetraining@who.int",
    "languages": [
      "English"
    ],
    "modalityRaw": "Blended",
    "modality": "blended",
    "platform": "",
    "link": "",
    "comment": "",
    "signoffStatus": "",
    "normalizedLink": "",
    "searchText": "leadership in emergencies phase 2 | the phase 2 course consists of two elements; an online module and a face-to-face workshop | leadership | leadership in emergencies | moh and who (emergencies) staff: incident manager, health cluster coordinator and function team leads | who | hq/whe/lcd | whetraining@who.int | english |  | "
  },
  {
    "id": "fc0f422d7b7fb51a077074ff",
    "sourceRow": 40,
    "learningName": "Learning package for Rapid Response Teams in the context of COVID-19 in India",
    "description": "Short course for COVID-19 rapid response team in India and provides basic information emergency response through five modules.",
    "technicalArea": "Health emergency preparedness and response management",
    "focusArea": "COVID-19",
    "intendedAudience": "COVID-19 Responders in India",
    "owner": "WHO",
    "developer": "SEARO/WCO/INDIA",
    "contactDetails": "WHEtraining@who.int",
    "languages": [
      "English"
    ],
    "modalityRaw": "Online",
    "modality": "online",
    "platform": "OpenWHO",
    "link": "https://openwho.org/playlist/dedicated/528113/0_gdfrptxs/0_fe1db3j1",
    "comment": "",
    "signoffStatus": "",
    "normalizedLink": "https://openwho.org/playlist/dedicated/528113/0_gdfrptxs/0_fe1db3j1",
    "searchText": "learning package for rapid response teams in the context of covid-19 in india | short course for covid-19 rapid response team in india and provides basic information emergency response through five modules. | health emergency preparedness and response management | covid-19 | covid-19 responders in india | who | searo/wco/india | whetraining@who.int | english | openwho | https://openwho.org/playlist/dedicated/528113/0_gdfrptxs/0_fe1db3j1"
  },
  {
    "id": "84aa0301ac99e74b6c71db12",
    "sourceRow": 41,
    "learningName": "Management and Facilitation of a Country COVID-19 Intra-Action Review (IAR)",
    "description": "WHO has developed a Guidance for Conducting a Country COVID-19 Intra-Action Review (IAR) and ten accompanying tools for countries to conduct periodic reviews of their response during this public health emergency of international concern (PHEIC)",
    "technicalArea": "Research & monitoring and evaluation",
    "focusArea": "IAR",
    "intendedAudience": "WHO staff/MoH/HCPs",
    "owner": "WHO",
    "developer": "HQ/WHE",
    "contactDetails": "WHEtraining@who.int",
    "languages": [
      "Arabic",
      "English",
      "Kazakh",
      "Spanish",
      "Portuguese",
      "Russian",
      "Tajik"
    ],
    "modalityRaw": "Online",
    "modality": "online",
    "platform": "OpenWHO",
    "link": "https://openwho.org/playlist/dedicated/552620/0_dahrllhn/0_xerri6jz",
    "comment": "",
    "signoffStatus": "",
    "normalizedLink": "https://openwho.org/playlist/dedicated/552620/0_dahrllhn/0_xerri6jz",
    "searchText": "management and facilitation of a country covid-19 intra-action review (iar) | who has developed a guidance for conducting a country covid-19 intra-action review (iar) and ten accompanying tools for countries to conduct periodic reviews of their response during this public health emergency of international concern (pheic) | research & monitoring and evaluation | iar | who staff/moh/hcps | who | hq/whe | whetraining@who.int | arabic, english, kazakh, spanish, portuguese, russian, tajik | openwho | https://openwho.org/playlist/dedicated/552620/0_dahrllhn/0_xerri6jz"
  },
  {
    "id": "cecc3e3463799ee6d763b0e5",
    "sourceRow": 42,
    "learningName": "Management and Facilitation of an After Action Review AAR",
    "description": "Introduction to the management and the facilitation of an After Action Review (AAR) following the response to an event of public health concern",
    "technicalArea": "Research & monitoring and evaluation",
    "focusArea": "AAR",
    "intendedAudience": "WHO staff",
    "owner": "WHO",
    "developer": "HQ/WHE",
    "contactDetails": "WHEtraining@who.int",
    "languages": [
      "English"
    ],
    "modalityRaw": "Online",
    "modality": "online",
    "platform": "OpenWHO",
    "link": "https://openwho.org/playlist/dedicated/496674/0_bmn0kb3y/0_rvnw5fvh",
    "comment": "",
    "signoffStatus": "",
    "normalizedLink": "https://openwho.org/playlist/dedicated/496674/0_bmn0kb3y/0_rvnw5fvh",
    "searchText": "management and facilitation of an after action review aar | introduction to the management and the facilitation of an after action review (aar) following the response to an event of public health concern | research & monitoring and evaluation | aar | who staff | who | hq/whe | whetraining@who.int | english | openwho | https://openwho.org/playlist/dedicated/496674/0_bmn0kb3y/0_rvnw5fvh"
  },
  {
    "id": "145fa2772d994f91ce64a0bc",
    "sourceRow": 43,
    "learningName": "Management of ill travelers at points of entry in the context of the COVID-19 outbreak",
    "description": "Outline the core capacities and mechanisms to be in place for managing ill travelers suspected to have COVID-19 at points of entry and on conveyances of all types. * \"The training will need to be updated to align with the IHR amendments when they enter into force\"",
    "technicalArea": "Points of entry (PoEs) and border health",
    "focusArea": "COVID-19",
    "intendedAudience": "National IHR Focal Points, public health authorities and operators at Points of Entry, conveyance operators, other stakeholders involved in managing public health events at Points of Entry",
    "owner": "WHO",
    "developer": "HQ/WHE",
    "contactDetails": "",
    "languages": [
      "Arabic",
      "English",
      "French",
      "Russian"
    ],
    "modalityRaw": "Online",
    "modality": "online",
    "platform": "HSLP",
    "link": "https://extranet.who.int/hslp/training/course/view.php?id=325",
    "comment": "",
    "signoffStatus": "",
    "normalizedLink": "https://extranet.who.int/hslp/training/course/view.php?id=325",
    "searchText": "management of ill travelers at points of entry in the context of the covid-19 outbreak | outline the core capacities and mechanisms to be in place for managing ill travelers suspected to have covid-19 at points of entry and on conveyances of all types. * \"the training will need to be updated to align with the ihr amendments when they enter into force\" | points of entry (poes) and border health | covid-19 | national ihr focal points, public health authorities and operators at points of entry, conveyance operators, other stakeholders involved in managing public health events at points of entry | who | hq/whe |  | arabic, english, french, russian | hslp | https://extranet.who.int/hslp/training/course/view.php?id=325"
  },
  {
    "id": "2a2d2871fe8f14691f1d1355",
    "sourceRow": 44,
    "learningName": "Mass Casualty Management",
    "description": "This course equips participants with the knowledge and skills to effectively manage mass casualty incidents. It covers key aspects such as preparedness, response, and recovery based on the emergency unit’s mass casualty management plan. Participants will learn how to assign staff roles, coordinate internal and external communication, and ensure smooth patient flow. The training also focuses on mobilizing necessary equipment and supplies, managing crowds and conflicts, and continuously improving processes through performance analysis.",
    "technicalArea": "Health emergency preparedness and response management",
    "focusArea": "Mass casualty management",
    "intendedAudience": "Professionals in EMT or Emergency Unit",
    "owner": "WHO",
    "developer": "WHO Academy",
    "contactDetails": "whoasupport@who.int",
    "languages": [
      "English"
    ],
    "modalityRaw": "Online",
    "modality": "online",
    "platform": "WHO Academy",
    "link": "https://whoacademy.org/coursewares/course-v1:WHOA+0002_MCM_EN+2025?source=edX",
    "comment": "",
    "signoffStatus": "",
    "normalizedLink": "https://whoacademy.org/coursewares/course-v1:WHOA+0002_MCM_EN+2025?source=edX",
    "searchText": "mass casualty management | this course equips participants with the knowledge and skills to effectively manage mass casualty incidents. it covers key aspects such as preparedness, response, and recovery based on the emergency unit’s mass casualty management plan. participants will learn how to assign staff roles, coordinate internal and external communication, and ensure smooth patient flow. the training also focuses on mobilizing necessary equipment and supplies, managing crowds and conflicts, and continuously improving processes through performance analysis. | health emergency preparedness and response management | mass casualty management | professionals in emt or emergency unit | who | who academy | whoasupport@who.int | english | who academy | https://whoacademy.org/coursewares/course-v1:whoa+0002_mcm_en+2025?source=edx"
  },
  {
    "id": "029ab1a1482bf8f0428d39db",
    "sourceRow": 45,
    "learningName": "Monitoring and evaluation of national action plans on antimicrobial resistance",
    "description": "The aim of this course is to provide guidance for countries on the monitoring and evaluation of national action plans on antimicrobial resistance (AMR NAPs).",
    "technicalArea": "Research & monitoring and evaluation",
    "focusArea": "M&E",
    "intendedAudience": "AMR multisectoral coordination committee or working group, persons responsible for M&E in AMR NAPs",
    "owner": "WHO",
    "developer": "HQ/AMR",
    "contactDetails": "whoasupport@who.int",
    "languages": [
      "English"
    ],
    "modalityRaw": "Online",
    "modality": "online",
    "platform": "WHO Academy",
    "link": "https://web-staging.lxp.academy.who.int/coursewares/course-v1:WHOAcademy-Hosted+H0041EN+H0041EN_Q4_2024?source=edX",
    "comment": "",
    "signoffStatus": "",
    "normalizedLink": "https://web-staging.lxp.academy.who.int/coursewares/course-v1:WHOAcademy-Hosted+H0041EN+H0041EN_Q4_2024?source=edX",
    "searchText": "monitoring and evaluation of national action plans on antimicrobial resistance | the aim of this course is to provide guidance for countries on the monitoring and evaluation of national action plans on antimicrobial resistance (amr naps). | research & monitoring and evaluation | m&e | amr multisectoral coordination committee or working group, persons responsible for m&e in amr naps | who | hq/amr | whoasupport@who.int | english | who academy | https://web-staging.lxp.academy.who.int/coursewares/course-v1:whoacademy-hosted+h0041en+h0041en_q4_2024?source=edx"
  },
  {
    "id": "ec5f0d84ed5f967fb86266c4",
    "sourceRow": 46,
    "learningName": "Mpox and the 2022-2023 global outbreak",
    "description": "This course provides a brief overview of mpox, including new insights on transmission, clinical presentation, preventive measures and outbreak response.",
    "technicalArea": "Health emergency preparedness and response management",
    "focusArea": "Monkeypox",
    "intendedAudience": "Health workers and public",
    "owner": "WHO",
    "developer": "HQ/WHE/EPP",
    "contactDetails": "WHEtraining@who.int",
    "languages": [
      "English",
      "French",
      "Spanish"
    ],
    "modalityRaw": "Online",
    "modality": "online",
    "platform": "OpenWHO",
    "link": "https://openwho.org/playlist/dedicated/503162/0_db1xy1c7/0_p02ol27o",
    "comment": "",
    "signoffStatus": "",
    "normalizedLink": "https://openwho.org/playlist/dedicated/503162/0_db1xy1c7/0_p02ol27o",
    "searchText": "mpox and the 2022-2023 global outbreak | this course provides a brief overview of mpox, including new insights on transmission, clinical presentation, preventive measures and outbreak response. | health emergency preparedness and response management | monkeypox | health workers and public | who | hq/whe/epp | whetraining@who.int | english, french, spanish | openwho | https://openwho.org/playlist/dedicated/503162/0_db1xy1c7/0_p02ol27o"
  },
  {
    "id": "95c416fb5e4c77713ace5b2d",
    "sourceRow": 47,
    "learningName": "Mpox: Epidemiology, preparedness and response for African outbreak contexts",
    "description": "Understand the epidemiology, modes of transmission, clinical presentation, diagnostics, and treatment of mpox, as well as the strategies needed for effective prevention and outbreak investigation and response.",
    "technicalArea": "Health emergency preparedness and response management",
    "focusArea": "Monkeypox",
    "intendedAudience": "Public health professionals/HCPs",
    "owner": "WHO",
    "developer": "HQ/WHE",
    "contactDetails": "WHEtraining@who.int",
    "languages": [
      "Arabic",
      "Chinese",
      "English",
      "French",
      "Portuguese",
      "Russian",
      "Spanish"
    ],
    "modalityRaw": "Online",
    "modality": "online",
    "platform": "OpenWHO",
    "link": "https://openwho.org/playlist/dedicated/503162/0_2y98iloq/0_25is3ot2",
    "comment": "",
    "signoffStatus": "",
    "normalizedLink": "https://openwho.org/playlist/dedicated/503162/0_2y98iloq/0_25is3ot2",
    "searchText": "mpox: epidemiology, preparedness and response for african outbreak contexts | understand the epidemiology, modes of transmission, clinical presentation, diagnostics, and treatment of mpox, as well as the strategies needed for effective prevention and outbreak investigation and response. | health emergency preparedness and response management | monkeypox | public health professionals/hcps | who | hq/whe | whetraining@who.int | arabic, chinese, english, french, portuguese, russian, spanish | openwho | https://openwho.org/playlist/dedicated/503162/0_2y98iloq/0_25is3ot2"
  },
  {
    "id": "b7df3a679b28967e372d3511",
    "sourceRow": 48,
    "learningName": "Mpox: Introductory course for African outbreak contexts",
    "description": "Provide a general introduction to the disease through a video and accompanying downloadable presentation that can be reviewed at your own pace",
    "technicalArea": "Health emergency preparedness and response management",
    "focusArea": "Monkeypox",
    "intendedAudience": "Public health professionals/HCPs",
    "owner": "WHO",
    "developer": "HQ/WHE",
    "contactDetails": "WHEtraining@who.int",
    "languages": [
      "English"
    ],
    "modalityRaw": "Online",
    "modality": "online",
    "platform": "OpenWHO",
    "link": "https://openwho.org/playlist/dedicated/503162/0_k5teeccu/0_mtu9ipu1",
    "comment": "",
    "signoffStatus": "",
    "normalizedLink": "https://openwho.org/playlist/dedicated/503162/0_k5teeccu/0_mtu9ipu1",
    "searchText": "mpox: introductory course for african outbreak contexts | provide a general introduction to the disease through a video and accompanying downloadable presentation that can be reviewed at your own pace | health emergency preparedness and response management | monkeypox | public health professionals/hcps | who | hq/whe | whetraining@who.int | english | openwho | https://openwho.org/playlist/dedicated/503162/0_k5teeccu/0_mtu9ipu1"
  },
  {
    "id": "6ddf622df6f8a85a8a5b286e",
    "sourceRow": 49,
    "learningName": "Multi-Hazard Response Framework: Hospital Planning for Health Emergency and Disaster Response",
    "description": "Provide personnel with the knowledge, contents and methodology for planning hospital response to health emergencies and disasters",
    "technicalArea": "Health services provision",
    "focusArea": "Hospital planning for emergencies",
    "intendedAudience": "WHO staff",
    "owner": "WHO",
    "developer": "PAHO/Virtual campus for public health",
    "contactDetails": "https://campus.paho.org/en/contact",
    "languages": [
      "Spanish"
    ],
    "modalityRaw": "Online",
    "modality": "online",
    "platform": "Virtual campus for public health",
    "link": "https://www.campusvirtualsp.org/es/node/30623",
    "comment": "",
    "signoffStatus": "",
    "normalizedLink": "https://www.campusvirtualsp.org/es/node/30623",
    "searchText": "multi-hazard response framework: hospital planning for health emergency and disaster response | provide personnel with the knowledge, contents and methodology for planning hospital response to health emergencies and disasters | health services provision | hospital planning for emergencies | who staff | who | paho/virtual campus for public health | https://campus.paho.org/en/contact | spanish | virtual campus for public health | https://www.campusvirtualsp.org/es/node/30623"
  },
  {
    "id": "c782919abb72ec708fa32e4d",
    "sourceRow": 50,
    "learningName": "National Action Plans for Health Security (NAPHS)",
    "description": "This introductory level course provides a general overview of the National Action Planning for Health Security (NAPHS) process and methodology. This includes the critical steps necessary to support the development, implementation & monitoring of 5-year strategic NAPHS as well as 12/24 month operational NAPHS.",
    "technicalArea": "Health emergency preparedness and response management",
    "focusArea": "NAPHS",
    "intendedAudience": "Member states/ MoH/WHO staff",
    "owner": "WHO",
    "developer": "HQ/WHE/HSP",
    "contactDetails": "WHEtraining@who.int",
    "languages": [
      "English"
    ],
    "modalityRaw": "Online",
    "modality": "online",
    "platform": "OpenWHO",
    "link": "https://openwho.org/playlist/dedicated/500114/0_xiddrvt4/0_0ft4cjao",
    "comment": "",
    "signoffStatus": "",
    "normalizedLink": "https://openwho.org/playlist/dedicated/500114/0_xiddrvt4/0_0ft4cjao",
    "searchText": "national action plans for health security (naphs) | this introductory level course provides a general overview of the national action planning for health security (naphs) process and methodology. this includes the critical steps necessary to support the development, implementation & monitoring of 5-year strategic naphs as well as 12/24 month operational naphs. | health emergency preparedness and response management | naphs | member states/ moh/who staff | who | hq/whe/hsp | whetraining@who.int | english | openwho | https://openwho.org/playlist/dedicated/500114/0_xiddrvt4/0_0ft4cjao"
  },
  {
    "id": "56ac93f28a3ef3ea633059bb",
    "sourceRow": 51,
    "learningName": "National health emergency risk communication: training package",
    "description": "The capacity-building package on ERC in five steps to support country development or strengthening of ERC under IHR. The five-step package is a unique, sustained, country-tailored capacity-building project in ERC. It comprises: 1. Training 2. Capacity mapping 3. Plan writing 4. Plan testing 5. Plan adoption.",
    "technicalArea": "Risk communication and community engagement (RCCE)",
    "focusArea": "RCCE",
    "intendedAudience": "WHO staff/MoH/HCPs",
    "owner": "WHO",
    "developer": "EURO/WHE/RCCE-IM",
    "contactDetails": "",
    "languages": [
      "English"
    ],
    "modalityRaw": "Training toolkits and packages",
    "modality": "toolkit",
    "platform": "",
    "link": "https://www.who.int/europe/publications/i/item/WHO-EURO-2018-2993-42751-59637",
    "comment": "",
    "signoffStatus": "",
    "normalizedLink": "https://www.who.int/europe/publications/i/item/WHO-EURO-2018-2993-42751-59637",
    "searchText": "national health emergency risk communication: training package | the capacity-building package on erc in five steps to support country development or strengthening of erc under ihr. the five-step package is a unique, sustained, country-tailored capacity-building project in erc. it comprises: 1. training 2. capacity mapping 3. plan writing 4. plan testing 5. plan adoption. | risk communication and community engagement (rcce) | rcce | who staff/moh/hcps | who | euro/whe/rcce-im |  | english |  | https://www.who.int/europe/publications/i/item/who-euro-2018-2993-42751-59637"
  },
  {
    "id": "1394842f256c31e1ccdaf742",
    "sourceRow": 52,
    "learningName": "National IHR Focal Point Workshop",
    "description": "Workshop to build the capacity of NFPs in event detection, verification and risk assessment. * \"The training will need to be updated to align with the IHR amendments when they enter into force\"",
    "technicalArea": "IHR Coordination and National IHR Focal Point Functions",
    "focusArea": "IHR",
    "intendedAudience": "NFPs",
    "owner": "WHO",
    "developer": "HQ/WHE",
    "contactDetails": "",
    "languages": [
      "English"
    ],
    "modalityRaw": "In-person",
    "modality": "in_person",
    "platform": "",
    "link": "",
    "comment": "",
    "signoffStatus": "",
    "normalizedLink": "",
    "searchText": "national ihr focal point workshop | workshop to build the capacity of nfps in event detection, verification and risk assessment. * \"the training will need to be updated to align with the ihr amendments when they enter into force\" | ihr coordination and national ihr focal point functions | ihr | nfps | who | hq/whe |  | english |  | "
  },
  {
    "id": "0dfdab82b5cfe94ff5efb374",
    "sourceRow": 53,
    "learningName": "Next Generation Sequencing (NGS) for Influenza and SARS-CoV-2: From Sample Collection to Analysis",
    "description": "This course explained the end-to-end workflow of NGS, from sample preparation to the upload of genomic sequencing data to public-domain or public-access databases.",
    "technicalArea": "Laboratory",
    "focusArea": "Influenza",
    "intendedAudience": "Laboratory scientists and technicians, laboratory managers and directors who make policies and protocols for their laboratories, and bioinformatics scientists",
    "owner": "WHO",
    "developer": "HQ/WHE",
    "contactDetails": "WHEtraining@who.int",
    "languages": [
      "English"
    ],
    "modalityRaw": "Online",
    "modality": "online",
    "platform": "OpenWHO",
    "link": "https://openwho.org/playlist/dedicated/529855/0_5c4mlcg4/0_cv4xqt8h",
    "comment": "",
    "signoffStatus": "",
    "normalizedLink": "https://openwho.org/playlist/dedicated/529855/0_5c4mlcg4/0_cv4xqt8h",
    "searchText": "next generation sequencing (ngs) for influenza and sars-cov-2: from sample collection to analysis | this course explained the end-to-end workflow of ngs, from sample preparation to the upload of genomic sequencing data to public-domain or public-access databases. | laboratory | influenza | laboratory scientists and technicians, laboratory managers and directors who make policies and protocols for their laboratories, and bioinformatics scientists | who | hq/whe | whetraining@who.int | english | openwho | https://openwho.org/playlist/dedicated/529855/0_5c4mlcg4/0_cv4xqt8h"
  },
  {
    "id": "a505b0d646d0952666fec0b1",
    "sourceRow": 54,
    "learningName": "ONE HEALTH: Basics of multisectoral collaboration at the Human - Animal - Environment interface",
    "description": "Intended to provide comprehensive materials that will allow for designing and organizing training workshops for all stakeholders in health laboratory processes, from management, to administration, to bench-work laboratorians.",
    "technicalArea": "Health emergency preparedness and response management",
    "focusArea": "One Health",
    "intendedAudience": "Professionals from human, animal or environmental health sectors",
    "owner": "WHO",
    "developer": "HQ/WHE",
    "contactDetails": "whoasupport@who.int",
    "languages": [
      "English"
    ],
    "modalityRaw": "Online",
    "modality": "online",
    "platform": "WHO Academy",
    "link": "https://web-staging.lxp.academy.who.int/coursewares/course-v1:WHOA+0094_OH_EN+2024?from=discovery&amp;source=edX",
    "comment": "",
    "signoffStatus": "",
    "normalizedLink": "https://web-staging.lxp.academy.who.int/coursewares/course-v1:WHOA+0094_OH_EN+2024?from=discovery&source=edX",
    "searchText": "one health: basics of multisectoral collaboration at the human - animal - environment interface | intended to provide comprehensive materials that will allow for designing and organizing training workshops for all stakeholders in health laboratory processes, from management, to administration, to bench-work laboratorians. | health emergency preparedness and response management | one health | professionals from human, animal or environmental health sectors | who | hq/whe | whoasupport@who.int | english | who academy | https://web-staging.lxp.academy.who.int/coursewares/course-v1:whoa+0094_oh_en+2024?from=discovery&source=edx"
  },
  {
    "id": "a11e8df50685f2c6235d4ad4",
    "sourceRow": 55,
    "learningName": "Operational Considerations for Managing COVID-19 Cases and Outbreaks in Aviation",
    "description": "Draft an airport public health contingency plan for managing COVID-19 cases and outbreaks in aviation",
    "technicalArea": "Points of entry (PoEs) and border health",
    "focusArea": "IHR",
    "intendedAudience": "National IHR Focal Points (NFPs), airport health authorities and local, provincial, and national health surveillance and response systems, civil aviation authorities, airport operators, aircraft operators, airports, and airlines.",
    "owner": "WHO",
    "developer": "HQ/WHE",
    "contactDetails": "",
    "languages": [
      "English"
    ],
    "modalityRaw": "Online",
    "modality": "online",
    "platform": "HSLP",
    "link": "https://extranet.who.int/hslp/training/enrol/index.php?id=328",
    "comment": "",
    "signoffStatus": "",
    "normalizedLink": "https://extranet.who.int/hslp/training/enrol/index.php?id=328",
    "searchText": "operational considerations for managing covid-19 cases and outbreaks in aviation | draft an airport public health contingency plan for managing covid-19 cases and outbreaks in aviation | points of entry (poes) and border health | ihr | national ihr focal points (nfps), airport health authorities and local, provincial, and national health surveillance and response systems, civil aviation authorities, airport operators, aircraft operators, airports, and airlines. | who | hq/whe |  | english | hslp | https://extranet.who.int/hslp/training/enrol/index.php?id=328"
  },
  {
    "id": "e1db8867fec0684c3e1d9de8",
    "sourceRow": 56,
    "learningName": "Operational Considerations for Managing COVID-19 Cases and Outbreaks on Board Ships",
    "description": "Draft an outbreak management plan for managing COVID-19 cases and outbreaks onboard ships. * \"The training will need to be updated to align with the IHR amendments when they enter into force\"",
    "technicalArea": "Points of entry (PoEs) and border health",
    "focusArea": "IHR",
    "intendedAudience": "National IHR Focal Points, Port health authorities (PHAs) and local, provincial, and national health surveillance and response systems, ship operators and port operators.",
    "owner": "WHO",
    "developer": "HQ/WHE",
    "contactDetails": "",
    "languages": [
      "English"
    ],
    "modalityRaw": "Online",
    "modality": "online",
    "platform": "HSLP",
    "link": "https://extranet.who.int/hslp/training/enrol/index.php?id=326",
    "comment": "",
    "signoffStatus": "",
    "normalizedLink": "https://extranet.who.int/hslp/training/enrol/index.php?id=326",
    "searchText": "operational considerations for managing covid-19 cases and outbreaks on board ships | draft an outbreak management plan for managing covid-19 cases and outbreaks onboard ships. * \"the training will need to be updated to align with the ihr amendments when they enter into force\" | points of entry (poes) and border health | ihr | national ihr focal points, port health authorities (phas) and local, provincial, and national health surveillance and response systems, ship operators and port operators. | who | hq/whe |  | english | hslp | https://extranet.who.int/hslp/training/enrol/index.php?id=326"
  },
  {
    "id": "b0da26cc3f403b2be6f56f6f",
    "sourceRow": 57,
    "learningName": "Operational Planning Guidelines for COVID-19 for UNCT and other partners",
    "description": "Operationalize the strategic plan for the COVID 19 outbreak",
    "technicalArea": "Health emergency preparedness and response management",
    "focusArea": "COVID-19",
    "intendedAudience": "Member states/ MoH/WHO staff",
    "owner": "WHO",
    "developer": "PAHO/Virtual campus for public health",
    "contactDetails": "https://campus.paho.org/en/contact",
    "languages": [
      "Spanish"
    ],
    "modalityRaw": "Online",
    "modality": "online",
    "platform": "Virtual campus for public health",
    "link": "https://www.campusvirtualsp.org/es/node/28952",
    "comment": "",
    "signoffStatus": "",
    "normalizedLink": "https://www.campusvirtualsp.org/es/node/28952",
    "searchText": "operational planning guidelines for covid-19 for unct and other partners | operationalize the strategic plan for the covid 19 outbreak | health emergency preparedness and response management | covid-19 | member states/ moh/who staff | who | paho/virtual campus for public health | https://campus.paho.org/en/contact | spanish | virtual campus for public health | https://www.campusvirtualsp.org/es/node/28952"
  },
  {
    "id": "84e1cb0f7038fed97d6babd1",
    "sourceRow": 58,
    "learningName": "Orientation on the relevance of gender for health emergencies",
    "description": "4/5 hr orientation for WHE staff working at country level, to introduce key concepts and tools available to operationalize a gender analysis within health emergency preparedness and repsonse programming.",
    "technicalArea": "Health emergency preparedness and response management",
    "focusArea": "Gender and health emergencies",
    "intendedAudience": "WHE Staff",
    "owner": "WHO",
    "developer": "HQ/WHE",
    "contactDetails": "",
    "languages": [
      "English"
    ],
    "modalityRaw": "Blended",
    "modality": "blended",
    "platform": "",
    "link": "",
    "comment": "2 pilot sesions held in Turkey in 2022, more forthcoming in 2023.",
    "signoffStatus": "",
    "normalizedLink": "",
    "searchText": "orientation on the relevance of gender for health emergencies | 4/5 hr orientation for whe staff working at country level, to introduce key concepts and tools available to operationalize a gender analysis within health emergency preparedness and repsonse programming. | health emergency preparedness and response management | gender and health emergencies | whe staff | who | hq/whe |  | english |  | "
  },
  {
    "id": "b52ad8bf58cffe1dc2764f41",
    "sourceRow": 59,
    "learningName": "Orientation to International Outbreak Response with GOARN/WHO",
    "description": "This course introduces participants to the opportunities, processes, challenges and realities of working as part of an international multidisciplinary outbreak response team on a GOARN deployment with the World Health Organisation (WHO). This course also details the step involved to apply for deployment and introduces concepts for adapting specialized technical public health skills in a field-setting.",
    "technicalArea": "Health emergency preparedness and response management",
    "focusArea": "Outbreak Response",
    "intendedAudience": "GOARN Partners; MoH; Local Responders",
    "owner": "WHO",
    "developer": "HQ/WHE/GOARN",
    "contactDetails": "goarn@who.int",
    "languages": [
      "English"
    ],
    "modalityRaw": "Blended",
    "modality": "blended",
    "platform": "GOARN",
    "link": "",
    "comment": "",
    "signoffStatus": "",
    "normalizedLink": "",
    "searchText": "orientation to international outbreak response with goarn/who | this course introduces participants to the opportunities, processes, challenges and realities of working as part of an international multidisciplinary outbreak response team on a goarn deployment with the world health organisation (who). this course also details the step involved to apply for deployment and introduces concepts for adapting specialized technical public health skills in a field-setting. | health emergency preparedness and response management | outbreak response | goarn partners; moh; local responders | who | hq/whe/goarn | goarn@who.int | english | goarn | "
  },
  {
    "id": "b694ad585e98047800da9289",
    "sourceRow": 60,
    "learningName": "Preparedness and Resilience for Emerging Threats (PRET)",
    "description": "The resources provided through WHO’s PRET - Preparedness and Resilience for Emerging Threats initiative support countries in updating their pandemic plans by incorporating lessons from recent events. These resources leverage the current global momentum and adopt a &quot;mode of transmission lens&quot; to guide preparedness efforts. The first PRET module specifically addresses preparation for respiratory pathogens.",
    "technicalArea": "Health emergency preparedness and response management",
    "focusArea": "Pandemic planning",
    "intendedAudience": "WHO/MoH",
    "owner": "WHO",
    "developer": "HQ/WHE",
    "contactDetails": "WHEtraining@who.int",
    "languages": [
      "English"
    ],
    "modalityRaw": "Online",
    "modality": "online",
    "platform": "OpenWHO",
    "link": "https://openwho.org/playlist/dedicated/536083/0_aht29z8m/0_9w81mlf1",
    "comment": "",
    "signoffStatus": "",
    "normalizedLink": "https://openwho.org/playlist/dedicated/536083/0_aht29z8m/0_9w81mlf1",
    "searchText": "preparedness and resilience for emerging threats (pret) | the resources provided through who’s pret - preparedness and resilience for emerging threats initiative support countries in updating their pandemic plans by incorporating lessons from recent events. these resources leverage the current global momentum and adopt a &quot;mode of transmission lens&quot; to guide preparedness efforts. the first pret module specifically addresses preparation for respiratory pathogens. | health emergency preparedness and response management | pandemic planning | who/moh | who | hq/whe | whetraining@who.int | english | openwho | https://openwho.org/playlist/dedicated/536083/0_aht29z8m/0_9w81mlf1"
  },
  {
    "id": "bb91dd33f1a80c0df80b089a",
    "sourceRow": 61,
    "learningName": "Personal well-being for deployment",
    "description": "This eModule will detail the importance and possible ways of building resilience to cope with stress and hardship. It will introduce the mental and physical well-being considerations for pre-, during and post-deployment. The module will give you the tools you need to assume responsibility for your personal well-being and to facilitate well-being initiatives. You will also receive practical advice from former deployees for pre-, during and post-deployment. You will be able to apply resilience strategies and tools adapted to your individual needs to enhance your resilience for deployments.",
    "technicalArea": "Health emergency preparedness and response management",
    "focusArea": "Outbreak Response; wellbeing",
    "intendedAudience": "GOARN Partners; MoH; Local Responders",
    "owner": "WHO",
    "developer": "HQ/WHE/GOARN",
    "contactDetails": "goarn@who.int",
    "languages": [
      "English"
    ],
    "modalityRaw": "Online",
    "modality": "online",
    "platform": "GOARN",
    "link": "https://goarnlms.org/group/49",
    "comment": "",
    "signoffStatus": "",
    "normalizedLink": "https://goarnlms.org/group/49",
    "searchText": "personal well-being for deployment | this emodule will detail the importance and possible ways of building resilience to cope with stress and hardship. it will introduce the mental and physical well-being considerations for pre-, during and post-deployment. the module will give you the tools you need to assume responsibility for your personal well-being and to facilitate well-being initiatives. you will also receive practical advice from former deployees for pre-, during and post-deployment. you will be able to apply resilience strategies and tools adapted to your individual needs to enhance your resilience for deployments. | health emergency preparedness and response management | outbreak response; wellbeing | goarn partners; moh; local responders | who | hq/whe/goarn | goarn@who.int | english | goarn | https://goarnlms.org/group/49"
  },
  {
    "id": "f0a2adb11c358f8030137bb1",
    "sourceRow": 62,
    "learningName": "Prevention & response to sexual exploitation & abuse for public health practitioners in Ukraine",
    "description": "This course teaches the basics on PRSEAH including the 6 core principles, accountability frameworks and how to support a survivor/victim in the Ukraine emergency operation.",
    "technicalArea": "Health emergency preparedness and response management",
    "focusArea": "PRSEAH",
    "intendedAudience": "Public health workers in Ukraine",
    "owner": "WHO",
    "developer": "HQ/WHE",
    "contactDetails": "WHEtraining@who.int",
    "languages": [
      "English"
    ],
    "modalityRaw": "Online",
    "modality": "online",
    "platform": "OpenWHO",
    "link": "https://openwho.org/channel/PRSEAH+for+public+health+practitioners+in+Ukraine/527797",
    "comment": "",
    "signoffStatus": "",
    "normalizedLink": "https://openwho.org/channel/PRSEAH+for+public+health+practitioners+in+Ukraine/527797",
    "searchText": "prevention & response to sexual exploitation & abuse for public health practitioners in ukraine | this course teaches the basics on prseah including the 6 core principles, accountability frameworks and how to support a survivor/victim in the ukraine emergency operation. | health emergency preparedness and response management | prseah | public health workers in ukraine | who | hq/whe | whetraining@who.int | english | openwho | https://openwho.org/channel/prseah+for+public+health+practitioners+in+ukraine/527797"
  },
  {
    "id": "172433e64280ada1fbf00932",
    "sourceRow": 63,
    "learningName": "Ready4Response Tier 1: Response context and principles",
    "description": "Ready4Response is a multi-tiered core curriculum that aims to develop consistent learning standards across the emergency response workforces at national level. It equips participants with essential competencies needed to work within public health emergency response.",
    "technicalArea": "Health emergency preparedness and response management",
    "focusArea": "Emergency Response",
    "intendedAudience": "Member states/ MoH/WHO staff",
    "owner": "WHO",
    "developer": "HQ/WHE",
    "contactDetails": "WHEtraining@who.int",
    "languages": [
      "English",
      "French",
      "Ukrainian"
    ],
    "modalityRaw": "Online",
    "modality": "online",
    "platform": "OpenWHO",
    "link": "https://openwho.org/playlist/dedicated/494536/0_zaoidkyu/0_08q2gf61",
    "comment": "",
    "signoffStatus": "",
    "normalizedLink": "https://openwho.org/playlist/dedicated/494536/0_zaoidkyu/0_08q2gf61",
    "searchText": "ready4response tier 1: response context and principles | ready4response is a multi-tiered core curriculum that aims to develop consistent learning standards across the emergency response workforces at national level. it equips participants with essential competencies needed to work within public health emergency response. | health emergency preparedness and response management | emergency response | member states/ moh/who staff | who | hq/whe | whetraining@who.int | english, french, ukrainian | openwho | https://openwho.org/playlist/dedicated/494536/0_zaoidkyu/0_08q2gf61"
  },
  {
    "id": "2b46dec2a3fc62450eaeb6b6",
    "sourceRow": 64,
    "learningName": "Ready4Response Tier 2: Systems, structures and skills",
    "description": "Tier 2 focuses on the Incident Management System (IMS) and its core functions. It also examines core skills required to work effectively in a response team and describes the basic principles of risk management.",
    "technicalArea": "Health emergency preparedness and response management",
    "focusArea": "Emergency Response",
    "intendedAudience": "Member states/ MoH/WHO staff",
    "owner": "WHO",
    "developer": "HQ/WHE",
    "contactDetails": "WHEtraining@who.int",
    "languages": [
      "English",
      "French",
      "Ukrainian"
    ],
    "modalityRaw": "Online",
    "modality": "online",
    "platform": "OpenWHO",
    "link": "https://openwho.org/playlist/dedicated/494536/0_a0z75vwt/0_loggfb63",
    "comment": "",
    "signoffStatus": "",
    "normalizedLink": "https://openwho.org/playlist/dedicated/494536/0_a0z75vwt/0_loggfb63",
    "searchText": "ready4response tier 2: systems, structures and skills | tier 2 focuses on the incident management system (ims) and its core functions. it also examines core skills required to work effectively in a response team and describes the basic principles of risk management. | health emergency preparedness and response management | emergency response | member states/ moh/who staff | who | hq/whe | whetraining@who.int | english, french, ukrainian | openwho | https://openwho.org/playlist/dedicated/494536/0_a0z75vwt/0_loggfb63"
  },
  {
    "id": "0e3c5c611ca15b3594252e7e",
    "sourceRow": 65,
    "learningName": "Regulatory preparedness to authorize the use of pandemic vaccines in importing countries",
    "description": "This course offers opportunities to practise the core competencies required to make timely, effective decisions during a public health emergency, without compromising quality, through multiple choice questions, exploratory tasks, reflection, self-assessment and case studies.",
    "technicalArea": "Health emergency preparedness and response management",
    "focusArea": "Regulations for Vaccines",
    "intendedAudience": "National regulatory authorities (NRAs) of medical product registration, National disease control authorities handling disease control and public health emergency response, National immunization programmes in charge of vaccine deployment, and WHO staff",
    "owner": "WHO",
    "developer": "HQ/WHE",
    "contactDetails": "whoasupport@who.int",
    "languages": [
      "English"
    ],
    "modalityRaw": "Online",
    "modality": "online",
    "platform": "WHO Academy",
    "link": "https://web-staging.lxp.academy.who.int/coursewares/course-v1:WHOA+0027_REGPREP_EN+2023?from=discovery&amp;source=edX",
    "comment": "",
    "signoffStatus": "",
    "normalizedLink": "https://web-staging.lxp.academy.who.int/coursewares/course-v1:WHOA+0027_REGPREP_EN+2023?from=discovery&source=edX",
    "searchText": "regulatory preparedness to authorize the use of pandemic vaccines in importing countries | this course offers opportunities to practise the core competencies required to make timely, effective decisions during a public health emergency, without compromising quality, through multiple choice questions, exploratory tasks, reflection, self-assessment and case studies. | health emergency preparedness and response management | regulations for vaccines | national regulatory authorities (nras) of medical product registration, national disease control authorities handling disease control and public health emergency response, national immunization programmes in charge of vaccine deployment, and who staff | who | hq/whe | whoasupport@who.int | english | who academy | https://web-staging.lxp.academy.who.int/coursewares/course-v1:whoa+0027_regprep_en+2023?from=discovery&source=edx"
  },
  {
    "id": "9abe5ccbe5937acf57d1be63",
    "sourceRow": 66,
    "learningName": "Response Preparedness for Zoonotic Disease Outbreaks Using a One-Health Approach",
    "description": "Introduces the concepts of the coordinated response to manage zoonotic disease outbreaks between sectors for animal health, public health and the environment as well as other relevant stakeholders. In addition, it fosters understanding of the diverse perspectives of different stakeholders during an outbreak response.",
    "technicalArea": "Zoonotic diseases",
    "focusArea": "One Health",
    "intendedAudience": "Member States, One health stakeholders",
    "owner": "WHO",
    "developer": "HQ/WHE",
    "contactDetails": "WHEtraining@who.int",
    "languages": [
      "English"
    ],
    "modalityRaw": "Online",
    "modality": "online",
    "platform": "OpenWHO",
    "link": "https://openwho.org/playlist/dedicated/525718/0_drmgsh37/0_7hsnn5w1",
    "comment": "",
    "signoffStatus": "",
    "normalizedLink": "https://openwho.org/playlist/dedicated/525718/0_drmgsh37/0_7hsnn5w1",
    "searchText": "response preparedness for zoonotic disease outbreaks using a one-health approach | introduces the concepts of the coordinated response to manage zoonotic disease outbreaks between sectors for animal health, public health and the environment as well as other relevant stakeholders. in addition, it fosters understanding of the diverse perspectives of different stakeholders during an outbreak response. | zoonotic diseases | one health | member states, one health stakeholders | who | hq/whe | whetraining@who.int | english | openwho | https://openwho.org/playlist/dedicated/525718/0_drmgsh37/0_7hsnn5w1"
  },
  {
    "id": "1a3a6f54cd56f5cc1883fcff",
    "sourceRow": 67,
    "learningName": "Risk communication essentials",
    "description": "In this set of 5 modules, we will look at: what is risk communication and why it is important; key elements of risk communication; risk communication capacities, such as policy, strategies and evaluation; SOCO, spokesperson tips and message development; and exercises and ways they can be used to test preparedness in communicating risks.",
    "technicalArea": "Risk communication and community engagement (RCCE)",
    "focusArea": "Risk communication",
    "intendedAudience": "Member states/ MoH/WHO staff",
    "owner": "WHO",
    "developer": "HQ/WHE/CRS",
    "contactDetails": "WHEtraining@who.int",
    "languages": [
      "English"
    ],
    "modalityRaw": "Online",
    "modality": "online",
    "platform": "OpenWHO",
    "link": "https://openwho.org/playlist/dedicated/501691/0_8e5kljir/0_2q00gfhv",
    "comment": "",
    "signoffStatus": "",
    "normalizedLink": "https://openwho.org/playlist/dedicated/501691/0_8e5kljir/0_2q00gfhv",
    "searchText": "risk communication essentials | in this set of 5 modules, we will look at: what is risk communication and why it is important; key elements of risk communication; risk communication capacities, such as policy, strategies and evaluation; soco, spokesperson tips and message development; and exercises and ways they can be used to test preparedness in communicating risks. | risk communication and community engagement (rcce) | risk communication | member states/ moh/who staff | who | hq/whe/crs | whetraining@who.int | english | openwho | https://openwho.org/playlist/dedicated/501691/0_8e5kljir/0_2q00gfhv"
  },
  {
    "id": "99f7a9fbb14981c8671ef774",
    "sourceRow": 68,
    "learningName": "SARS-CoV-2 antigen rapid diagnostic testing",
    "description": "All personnel performing SARS-CoV-2 antigen rapid diagnostic tests (Ag-RDT) need to understand how to safely perform testing, ensure quality testing and interpret results. This course was developed by WHO and FIND, the global alliance for diagnostics, to provide theoretical knowledge on SARS-CoV-2 Ag-RDT testing",
    "technicalArea": "Laboratory",
    "focusArea": "COVID-19",
    "intendedAudience": "Member states/ MoH/WHO staff",
    "owner": "WHO",
    "developer": "HQ/WHE",
    "contactDetails": "WHEtraining@who.int",
    "languages": [
      "Arabic",
      "English",
      "Kazakh",
      "Portuguese",
      "Russian",
      "Spanish",
      "Tajik"
    ],
    "modalityRaw": "Online",
    "modality": "online",
    "platform": "OpenWHO",
    "link": "https://openwho.org/playlist/dedicated/529855/0_9v311fgo/0_tkgay1wn",
    "comment": "",
    "signoffStatus": "",
    "normalizedLink": "https://openwho.org/playlist/dedicated/529855/0_9v311fgo/0_tkgay1wn",
    "searchText": "sars-cov-2 antigen rapid diagnostic testing | all personnel performing sars-cov-2 antigen rapid diagnostic tests (ag-rdt) need to understand how to safely perform testing, ensure quality testing and interpret results. this course was developed by who and find, the global alliance for diagnostics, to provide theoretical knowledge on sars-cov-2 ag-rdt testing | laboratory | covid-19 | member states/ moh/who staff | who | hq/whe | whetraining@who.int | arabic, english, kazakh, portuguese, russian, spanish, tajik | openwho | https://openwho.org/playlist/dedicated/529855/0_9v311fgo/0_tkgay1wn"
  },
  {
    "id": "e8379f122ee74710376ba1e9",
    "sourceRow": 69,
    "learningName": "Strengthening collaboration between human and animal health sectors for improved health security",
    "description": "This course provides insight into some of WHO’s work at the animal-human-environment interface, including National Bridging Workshops (NBWs), field simulation exercises, tripartite guidance and practical tools aimed to support countries in the operationalization of One Health mechanisms at their level.",
    "technicalArea": "Health emergency preparedness and response management",
    "focusArea": "One Health",
    "intendedAudience": "Member states/ MoH/WHO staff",
    "owner": "WHO",
    "developer": "HQ/WHE",
    "contactDetails": "WHEtraining@who.int",
    "languages": [
      "English"
    ],
    "modalityRaw": "Online",
    "modality": "online",
    "platform": "OpenWHO",
    "link": "https://openwho.org/playlist/dedicated/525718/0_frz2e7kc/0_e9jqd26k",
    "comment": "",
    "signoffStatus": "",
    "normalizedLink": "https://openwho.org/playlist/dedicated/525718/0_frz2e7kc/0_e9jqd26k",
    "searchText": "strengthening collaboration between human and animal health sectors for improved health security | this course provides insight into some of who’s work at the animal-human-environment interface, including national bridging workshops (nbws), field simulation exercises, tripartite guidance and practical tools aimed to support countries in the operationalization of one health mechanisms at their level. | health emergency preparedness and response management | one health | member states/ moh/who staff | who | hq/whe | whetraining@who.int | english | openwho | https://openwho.org/playlist/dedicated/525718/0_frz2e7kc/0_e9jqd26k"
  },
  {
    "id": "244f1aef4db260fc6cf880d1",
    "sourceRow": 70,
    "learningName": "Strengthening the health sector's role in the sound management of chemicals",
    "description": "Learn about raising awareness on the health impacts of chemicals and empowering the health professional’s role in the sound management of chemicals.",
    "technicalArea": "Chemical, biological, radiological and nuclear emergencies",
    "focusArea": "Management of chemicals",
    "intendedAudience": "Health and related professionals involved in the sound management of chemicals.",
    "owner": "WHO",
    "developer": "HQ/WHO Academy",
    "contactDetails": "whoasupport@who.int",
    "languages": [
      "English"
    ],
    "modalityRaw": "Online",
    "modality": "online",
    "platform": "WHO Academy",
    "link": "https://web-staging.lxp.academy.who.int/coursewares/course-v1:WHOA+0033_CMM_EN+2023?from=discovery&amp;source=edX",
    "comment": "",
    "signoffStatus": "",
    "normalizedLink": "https://web-staging.lxp.academy.who.int/coursewares/course-v1:WHOA+0033_CMM_EN+2023?from=discovery&source=edX",
    "searchText": "strengthening the health sector's role in the sound management of chemicals | learn about raising awareness on the health impacts of chemicals and empowering the health professional’s role in the sound management of chemicals. | chemical, biological, radiological and nuclear emergencies | management of chemicals | health and related professionals involved in the sound management of chemicals. | who | hq/who academy | whoasupport@who.int | english | who academy | https://web-staging.lxp.academy.who.int/coursewares/course-v1:whoa+0033_cmm_en+2023?from=discovery&source=edx"
  },
  {
    "id": "cbe3ff3c08759354e114fc39",
    "sourceRow": 71,
    "learningName": "The Joint Risk Assessment (JRA OT): A Training for Implementers",
    "description": "Participants will explore the step-by-step process for setting up the JRA for zoonotic diseases, conducting the technical risk assessment, and translating results to risk management options and communication needs. The JRA OT allows decision-makers to build and implement science-based risk management measures that are aligned between sectors and implemented jointly.",
    "technicalArea": "Zoonotic diseases",
    "focusArea": "Risk assessment, One health",
    "intendedAudience": "Member states/ MoH/WHO staff",
    "owner": "WHO",
    "developer": "HQ/WHE",
    "contactDetails": "WHEtraining@who.int",
    "languages": [
      "English"
    ],
    "modalityRaw": "Online",
    "modality": "online",
    "platform": "OpenWHO",
    "link": "https://openwho.org/media/JRA%20Training%20for%20implementers%3A%20Overview%20/0_5wvf6ayl/525718",
    "comment": "",
    "signoffStatus": "",
    "normalizedLink": "https://openwho.org/media/JRA%20Training%20for%20implementers%3A%20Overview%20/0_5wvf6ayl/525718",
    "searchText": "the joint risk assessment (jra ot): a training for implementers | participants will explore the step-by-step process for setting up the jra for zoonotic diseases, conducting the technical risk assessment, and translating results to risk management options and communication needs. the jra ot allows decision-makers to build and implement science-based risk management measures that are aligned between sectors and implemented jointly. | zoonotic diseases | risk assessment, one health | member states/ moh/who staff | who | hq/whe | whetraining@who.int | english | openwho | https://openwho.org/media/jra%20training%20for%20implementers%3a%20overview%20/0_5wvf6ayl/525718"
  },
  {
    "id": "bd93b44036005f987fcb3fbe",
    "sourceRow": 72,
    "learningName": "The Role of Parliaments and Parliamentarians in Strengthening Health Security Preparedness",
    "description": "These video resources provides you an in-depth understanding of how parliamentarians can utilize their diverse roles and positions to advocate, lead, and prioritize improved emergency preparedness and health security.",
    "technicalArea": "Leadership",
    "focusArea": "Parliaments in health security",
    "intendedAudience": "Parliamentarians",
    "owner": "WHO",
    "developer": "HQ/WHE",
    "contactDetails": "WHEtraining@who.int",
    "languages": [
      "English",
      "transcripts available in all official UN languages"
    ],
    "modalityRaw": "Online",
    "modality": "online",
    "platform": "OpenWHO",
    "link": "https://openwho.org/playlist/dedicated/538740/0_q449ey6u/0_iq88tn96",
    "comment": "Subtitle availabe in all official UN language",
    "signoffStatus": "",
    "normalizedLink": "https://openwho.org/playlist/dedicated/538740/0_q449ey6u/0_iq88tn96",
    "searchText": "the role of parliaments and parliamentarians in strengthening health security preparedness | these video resources provides you an in-depth understanding of how parliamentarians can utilize their diverse roles and positions to advocate, lead, and prioritize improved emergency preparedness and health security. | leadership | parliaments in health security | parliamentarians | who | hq/whe | whetraining@who.int | english, transcripts available in all official un languages | openwho | https://openwho.org/playlist/dedicated/538740/0_q449ey6u/0_iq88tn96"
  },
  {
    "id": "c84107fd9623b478f3162740",
    "sourceRow": 73,
    "learningName": "Use of Epidemic Intelligence systems with a particular focus on event-based surveillance for pandemic preparedness",
    "description": "This course includes different approaches on Epidemic Intelligence with examples drawn from the work of the World Health Organization (WHO), the European Centre for Disease Prevention and Control (ECDC), the United States Centers for Disease Control and Prevention (US CDC) and the Italian Istituto Superiore di Sanità (ISS). This course aims to support the creation of a culture of epidemic intelligence and increase awareness of the WHO Epidemic Intelligence from Open Sources (EIOS) initiative that could bridge access to Member States for Strengthening their epidemic Intelligence capacity.",
    "technicalArea": "Surveillance",
    "focusArea": "IHR, surveillance",
    "intendedAudience": "Health care workforce, public healht officers and policy makers/ Member states/ MoH/WHO staff",
    "owner": "WHO",
    "developer": "HQ/WHE/EIOS",
    "contactDetails": "eios@who.int",
    "languages": [
      "English"
    ],
    "modalityRaw": "Online",
    "modality": "online",
    "platform": "WHO Academy",
    "link": "https://whoacademy.org/coursewares/course-v1:WHOAcademy-Hosted+H0118EN+2025_Q1?source=edX",
    "comment": "",
    "signoffStatus": "",
    "normalizedLink": "https://whoacademy.org/coursewares/course-v1:WHOAcademy-Hosted+H0118EN+2025_Q1?source=edX",
    "searchText": "use of epidemic intelligence systems with a particular focus on event-based surveillance for pandemic preparedness | this course includes different approaches on epidemic intelligence with examples drawn from the work of the world health organization (who), the european centre for disease prevention and control (ecdc), the united states centers for disease control and prevention (us cdc) and the italian istituto superiore di sanità (iss). this course aims to support the creation of a culture of epidemic intelligence and increase awareness of the who epidemic intelligence from open sources (eios) initiative that could bridge access to member states for strengthening their epidemic intelligence capacity. | surveillance | ihr, surveillance | health care workforce, public healht officers and policy makers/ member states/ moh/who staff | who | hq/whe/eios | eios@who.int | english | who academy | https://whoacademy.org/coursewares/course-v1:whoacademy-hosted+h0118en+2025_q1?source=edx"
  },
  {
    "id": "249b5e6c6a81c0fce155a81c",
    "sourceRow": 74,
    "learningName": "Wheelchairs in emergencies",
    "description": "This course teaches how to provide wheelchairs in emergencies following four service steps",
    "technicalArea": "Health emergency preparedness and response management",
    "focusArea": "Assistive products in emergencies",
    "intendedAudience": "Health workers , first responders, carers",
    "owner": "WHO",
    "developer": "HQ/WHE",
    "contactDetails": "whoasupport@who.int",
    "languages": [
      "English"
    ],
    "modalityRaw": "Online",
    "modality": "online",
    "platform": "WHO Academy",
    "link": "https://web-staging.lxp.academy.who.int/coursewares/wheelchairs-in-emergencies-en?source=gateway",
    "comment": "",
    "signoffStatus": "",
    "normalizedLink": "https://web-staging.lxp.academy.who.int/coursewares/wheelchairs-in-emergencies-en?source=gateway",
    "searchText": "wheelchairs in emergencies | this course teaches how to provide wheelchairs in emergencies following four service steps | health emergency preparedness and response management | assistive products in emergencies | health workers , first responders, carers | who | hq/whe | whoasupport@who.int | english | who academy | https://web-staging.lxp.academy.who.int/coursewares/wheelchairs-in-emergencies-en?source=gateway"
  },
  {
    "id": "ef3efe1bf8062d1879abb805",
    "sourceRow": 75,
    "learningName": "WHO costing and budgeting tool for national action plans on antimicrobial resistance",
    "description": "The aim of this course is to introduce the WHO costing and budgeting tool for national action plans on antimicrobial resistance (AMR).",
    "technicalArea": "Project management",
    "focusArea": "Costing",
    "intendedAudience": "Healthcare workers",
    "owner": "WHO",
    "developer": "HQ/AMR",
    "contactDetails": "whoasupport@who.int",
    "languages": [
      "English",
      "French",
      "Spanish"
    ],
    "modalityRaw": "Online",
    "modality": "online",
    "platform": "WHO Academy",
    "link": "https://web-staging.lxp.academy.who.int/coursewares/course-v1:WHOAcademy-Hosted+H0043EN+H0043EN_Q4_2024?source=edX",
    "comment": "",
    "signoffStatus": "",
    "normalizedLink": "https://web-staging.lxp.academy.who.int/coursewares/course-v1:WHOAcademy-Hosted+H0043EN+H0043EN_Q4_2024?source=edX",
    "searchText": "who costing and budgeting tool for national action plans on antimicrobial resistance | the aim of this course is to introduce the who costing and budgeting tool for national action plans on antimicrobial resistance (amr). | project management | costing | healthcare workers | who | hq/amr | whoasupport@who.int | english, french, spanish | who academy | https://web-staging.lxp.academy.who.int/coursewares/course-v1:whoacademy-hosted+h0043en+h0043en_q4_2024?source=edx"
  },
  {
    "id": "50742e79bea5206eb231f587",
    "sourceRow": 76,
    "learningName": "WHO Standard Operating Procedures (SOPs) for Emergencies",
    "description": "This course on WHO Standard Operating Procedures (SOPs) for Emergencies is designed for personnel who will be assigned by WHO to go on deployment in response to health emergencies. It covers all the essential areas of WHO administrative procedures in response to health emergencies.",
    "technicalArea": "Human resources",
    "focusArea": "SOPs for Emergencies",
    "intendedAudience": "WHO staff /consultants/ Member states",
    "owner": "WHO",
    "developer": "HQ/WHE",
    "contactDetails": "WHEtraining@who.int",
    "languages": [
      "English"
    ],
    "modalityRaw": "Online",
    "modality": "online",
    "platform": "OpenWHO",
    "link": "https://openwho.org/channel/WHO+Standard+Operating+Procedures+for+Emergencies/495160",
    "comment": "",
    "signoffStatus": "",
    "normalizedLink": "https://openwho.org/channel/WHO+Standard+Operating+Procedures+for+Emergencies/495160",
    "searchText": "who standard operating procedures (sops) for emergencies | this course on who standard operating procedures (sops) for emergencies is designed for personnel who will be assigned by who to go on deployment in response to health emergencies. it covers all the essential areas of who administrative procedures in response to health emergencies. | human resources | sops for emergencies | who staff /consultants/ member states | who | hq/whe | whetraining@who.int | english | openwho | https://openwho.org/channel/who+standard+operating+procedures+for+emergencies/495160"
  },
  {
    "id": "0e1ddfc9e89b7d3d6c6bf78a",
    "sourceRow": 77,
    "learningName": "WHO/ICRC Basic Emergency Care: Conflict-Related Injuries",
    "description": "The course support the delivery of quality emergency care for patients with conflict-related trauma, covering penetrating injury, blast injury and burns. The content is meant to be used as refresher material or as a ‘just-in-time' educational resource.",
    "technicalArea": "Health services provision",
    "focusArea": "Clinical care",
    "intendedAudience": "Frontline medical staff (physicians, nurses, emt)",
    "owner": "WHO",
    "developer": "HQ/WHE",
    "contactDetails": "WHEtraining@who.int",
    "languages": [
      "English"
    ],
    "modalityRaw": "Online",
    "modality": "online",
    "platform": "OpenWHO",
    "link": "https://openwho.org/playlist/dedicated/537171/0_an1ufwse/0_tk4xv7rb",
    "comment": "",
    "signoffStatus": "",
    "normalizedLink": "https://openwho.org/playlist/dedicated/537171/0_an1ufwse/0_tk4xv7rb",
    "searchText": "who/icrc basic emergency care: conflict-related injuries | the course support the delivery of quality emergency care for patients with conflict-related trauma, covering penetrating injury, blast injury and burns. the content is meant to be used as refresher material or as a ‘just-in-time' educational resource. | health services provision | clinical care | frontline medical staff (physicians, nurses, emt) | who | hq/whe | whetraining@who.int | english | openwho | https://openwho.org/playlist/dedicated/537171/0_an1ufwse/0_tk4xv7rb"
  },
  {
    "id": "ee0aaa49e763e36edea95f84",
    "sourceRow": 78,
    "learningName": "WHO-ICRC Basic Emergency Care: approach to the acutely ill and injured",
    "description": "The Basic emergency care (BEC) course teaches a systematic approach to the initial assessment and management of time-sensitive critical conditions where early intervention saves lives. The goal of these modules is to prepare and support all health providers as they provide emergency care to seriously ill patients.",
    "technicalArea": "Health services provision",
    "focusArea": "Clinical care",
    "intendedAudience": "Frontline medical staff (physicians, nurses, emt)",
    "owner": "WHO",
    "developer": "HQ/WHE",
    "contactDetails": "WHEtraining@who.int",
    "languages": [
      "English"
    ],
    "modalityRaw": "Online",
    "modality": "online",
    "platform": "OpenWHO",
    "link": "https://openwho.org/playlist/dedicated/537171/0_7mm5wr4l/0_lic60gzx",
    "comment": "",
    "signoffStatus": "",
    "normalizedLink": "https://openwho.org/playlist/dedicated/537171/0_7mm5wr4l/0_lic60gzx",
    "searchText": "who-icrc basic emergency care: approach to the acutely ill and injured | the basic emergency care (bec) course teaches a systematic approach to the initial assessment and management of time-sensitive critical conditions where early intervention saves lives. the goal of these modules is to prepare and support all health providers as they provide emergency care to seriously ill patients. | health services provision | clinical care | frontline medical staff (physicians, nurses, emt) | who | hq/whe | whetraining@who.int | english | openwho | https://openwho.org/playlist/dedicated/537171/0_7mm5wr4l/0_lic60gzx"
  },
  {
    "id": "dec78a2654399112899b79ed",
    "sourceRow": 79,
    "learningName": "Kazakhstan Country-Focused Leadership in Emergencies Course",
    "description": "This course is adapted from the Leadership in Emergencies and is the first multisector country-level Leadership in Emergencies course. The course is designed for 5 days aimed at enhancing critical non-technical skills essential for effective emergency management, such as team coordination, problem-solving, decision-making, and effective communication and negotiation with various stakeholders.",
    "technicalArea": "Leadership",
    "focusArea": "Leadership in emergencies",
    "intendedAudience": "Managers from relevant sectors involved in emergencies at the country level",
    "owner": "WHO",
    "developer": "HQ/WHE/LCD",
    "contactDetails": "WHEtraining@who.int",
    "languages": [
      "English",
      "Kazakh"
    ],
    "modalityRaw": "In-person",
    "modality": "in_person",
    "platform": "",
    "link": "",
    "comment": "",
    "signoffStatus": "",
    "normalizedLink": "",
    "searchText": "kazakhstan country-focused leadership in emergencies course | this course is adapted from the leadership in emergencies and is the first multisector country-level leadership in emergencies course. the course is designed for 5 days aimed at enhancing critical non-technical skills essential for effective emergency management, such as team coordination, problem-solving, decision-making, and effective communication and negotiation with various stakeholders. | leadership | leadership in emergencies | managers from relevant sectors involved in emergencies at the country level | who | hq/whe/lcd | whetraining@who.int | english, kazakh |  | "
  },
  {
    "id": "9a5d4d00eb7bcf3391fb0edd",
    "sourceRow": 80,
    "learningName": "An integrated approach to building health systems resilience",
    "description": "Explore key requirements for enabling health system resilience with an integrated systems approach.",
    "technicalArea": "Health emergency preparedness and response management",
    "focusArea": "Health system resilience",
    "intendedAudience": "WHO staff/MoH/HCPs",
    "owner": "WHO",
    "developer": "HQ/WHE",
    "contactDetails": "",
    "languages": [
      "English"
    ],
    "modalityRaw": "Online",
    "modality": "online",
    "platform": "WHO Academy",
    "link": "https://web-staging.lxp.academy.who.int/coursewares/course-v1:WHOAcademy-Hosted+H0060EN+H0060EN_Q4_2024?source=edX",
    "comment": "",
    "signoffStatus": "",
    "normalizedLink": "https://web-staging.lxp.academy.who.int/coursewares/course-v1:WHOAcademy-Hosted+H0060EN+H0060EN_Q4_2024?source=edX",
    "searchText": "an integrated approach to building health systems resilience | explore key requirements for enabling health system resilience with an integrated systems approach. | health emergency preparedness and response management | health system resilience | who staff/moh/hcps | who | hq/whe |  | english | who academy | https://web-staging.lxp.academy.who.int/coursewares/course-v1:whoacademy-hosted+h0060en+h0060en_q4_2024?source=edx"
  },
  {
    "id": "7428007cf628c409a50f8f68",
    "sourceRow": 81,
    "learningName": "Advancing national civil-military collaboration to strengthen health emergency preparedness",
    "description": "The aim of the course is to provide the public health sector and military actors and services at the national level with guidance for establishing, advancing, and maintaining collaboration and coordination, with the focus on country core capacities required to effectively prevent, detect, respond to, recover from and build back better after health emergencies.",
    "technicalArea": "Health emergency preparedness and response management",
    "focusArea": "Civil-military collaboration",
    "intendedAudience": "Member states/ MoH/WHO staff",
    "owner": "WHO",
    "developer": "HQ/WHE/HSP",
    "contactDetails": "WHEtraining@who.int",
    "languages": [
      "English",
      "transcripts available in all official UN languages"
    ],
    "modalityRaw": "Online",
    "modality": "online",
    "platform": "OpenWHO",
    "link": "https://openwho.org/playlist/dedicated/527251/0_5qpallbj/0_iq88tn96",
    "comment": "",
    "signoffStatus": "",
    "normalizedLink": "https://openwho.org/playlist/dedicated/527251/0_5qpallbj/0_iq88tn96",
    "searchText": "advancing national civil-military collaboration to strengthen health emergency preparedness | the aim of the course is to provide the public health sector and military actors and services at the national level with guidance for establishing, advancing, and maintaining collaboration and coordination, with the focus on country core capacities required to effectively prevent, detect, respond to, recover from and build back better after health emergencies. | health emergency preparedness and response management | civil-military collaboration | member states/ moh/who staff | who | hq/whe/hsp | whetraining@who.int | english, transcripts available in all official un languages | openwho | https://openwho.org/playlist/dedicated/527251/0_5qpallbj/0_iq88tn96"
  },
  {
    "id": "4552b2d59e95c8f78cb4bbb5",
    "sourceRow": 82,
    "learningName": "An introduction to the people-centred approach to addressing antimicrobial resistance in human health",
    "description": "The aim of this course is to introduce the concept and content of the WHO people-centred approach to addressing antimicrobial resistance (AMR) in the human health sector.",
    "technicalArea": "Health emergency preparedness and response management",
    "focusArea": "AMR",
    "intendedAudience": "National and subnational policy-makers responsible for prioritizing and leading AMR interventions in the human health sector",
    "owner": "WHO",
    "developer": "HQ/AMR",
    "contactDetails": "whoasupport@who.int",
    "languages": [
      "English"
    ],
    "modalityRaw": "Online",
    "modality": "online",
    "platform": "WHO Academy",
    "link": "https://web-staging.lxp.academy.who.int/coursewares/course-v1:WHOAcademy-Hosted+H0040EN+H0040EN_Q4_2024?from=discovery&amp;source=edX",
    "comment": "",
    "signoffStatus": "",
    "normalizedLink": "https://web-staging.lxp.academy.who.int/coursewares/course-v1:WHOAcademy-Hosted+H0040EN+H0040EN_Q4_2024?from=discovery&source=edX",
    "searchText": "an introduction to the people-centred approach to addressing antimicrobial resistance in human health | the aim of this course is to introduce the concept and content of the who people-centred approach to addressing antimicrobial resistance (amr) in the human health sector. | health emergency preparedness and response management | amr | national and subnational policy-makers responsible for prioritizing and leading amr interventions in the human health sector | who | hq/amr | whoasupport@who.int | english | who academy | https://web-staging.lxp.academy.who.int/coursewares/course-v1:whoacademy-hosted+h0040en+h0040en_q4_2024?from=discovery&source=edx"
  },
  {
    "id": "d40e4ce98b61a40520b989a4",
    "sourceRow": 83,
    "learningName": "Antimicrobial Stewardship: A competency-based approach",
    "description": "This course will equip clinicians who frequently prescribe antimicrobials with knowledge and tools to improve their use of these essential medications in daily clinical practice.",
    "technicalArea": "Health services provision",
    "focusArea": "Antimicrobial Stewardship",
    "intendedAudience": "Clinicians",
    "owner": "WHO",
    "developer": "HQ/AMR",
    "contactDetails": "whoasupport@who.int",
    "languages": [
      "English"
    ],
    "modalityRaw": "Online",
    "modality": "online",
    "platform": "WHO Academy",
    "link": "https://web-staging.lxp.academy.who.int/coursewares/course-v1:WHOAcademy-Hosted+H0098EN+H0098EN_Q4_2024?source=edX",
    "comment": "",
    "signoffStatus": "",
    "normalizedLink": "https://web-staging.lxp.academy.who.int/coursewares/course-v1:WHOAcademy-Hosted+H0098EN+H0098EN_Q4_2024?source=edX",
    "searchText": "antimicrobial stewardship: a competency-based approach | this course will equip clinicians who frequently prescribe antimicrobials with knowledge and tools to improve their use of these essential medications in daily clinical practice. | health services provision | antimicrobial stewardship | clinicians | who | hq/amr | whoasupport@who.int | english | who academy | https://web-staging.lxp.academy.who.int/coursewares/course-v1:whoacademy-hosted+h0098en+h0098en_q4_2024?source=edx"
  },
  {
    "id": "fe9bf9d323e7cffad26136e2",
    "sourceRow": 84,
    "learningName": "Assistive products in emergencies",
    "description": "This module provides an introduction to assistive products in emergencies.",
    "technicalArea": "Health emergency preparedness and response management",
    "focusArea": "Assistive products in emergencies",
    "intendedAudience": "Health workers , first responders, carers",
    "owner": "WHO",
    "developer": "HQ/WHE",
    "contactDetails": "whoasupport@who.int",
    "languages": [
      "English"
    ],
    "modalityRaw": "Online",
    "modality": "online",
    "platform": "WHO Academy",
    "link": "https://web-staging.lxp.academy.who.int/coursewares/assistive-products-in-emergencies-en?source=gateway",
    "comment": "",
    "signoffStatus": "",
    "normalizedLink": "https://web-staging.lxp.academy.who.int/coursewares/assistive-products-in-emergencies-en?source=gateway",
    "searchText": "assistive products in emergencies | this module provides an introduction to assistive products in emergencies. | health emergency preparedness and response management | assistive products in emergencies | health workers , first responders, carers | who | hq/whe | whoasupport@who.int | english | who academy | https://web-staging.lxp.academy.who.int/coursewares/assistive-products-in-emergencies-en?source=gateway"
  },
  {
    "id": "87ab2d29235171fc83316ae4",
    "sourceRow": 85,
    "learningName": "Avian and other zoonotic influenza: Introduction",
    "description": "This course gives an overview of the key information on animal influenza, human cases, and elements of prevention, preparedness and response to human cases.",
    "technicalArea": "Zoonotic diseases",
    "focusArea": "Influenza",
    "intendedAudience": "Member states/ MoH/WHO staff",
    "owner": "WHO",
    "developer": "HQ/WHE",
    "contactDetails": "WHEtraining@who.int",
    "languages": [
      "English"
    ],
    "modalityRaw": "Online",
    "modality": "online",
    "platform": "OpenWHO",
    "link": "https://openwho.org/media/Introduction%20Zoonotic%20Influenza/0_cq1foy2r/503150",
    "comment": "",
    "signoffStatus": "",
    "normalizedLink": "https://openwho.org/media/Introduction%20Zoonotic%20Influenza/0_cq1foy2r/503150",
    "searchText": "avian and other zoonotic influenza: introduction | this course gives an overview of the key information on animal influenza, human cases, and elements of prevention, preparedness and response to human cases. | zoonotic diseases | influenza | member states/ moh/who staff | who | hq/whe | whetraining@who.int | english | openwho | https://openwho.org/media/introduction%20zoonotic%20influenza/0_cq1foy2r/503150"
  },
  {
    "id": "f5ba28f2a3cff03f46569673",
    "sourceRow": 86,
    "learningName": "Basic Emergency Care Provider Course",
    "description": "Emergency care providers must respond to ‘undifferentiated’ patients, those with acute symptoms for which the cause may not be known. This course introduces a systematic approach to managing acute, potentially life-threatening conditions even before a diagnosis is known, this clinical training aimed at frontline providers (doctors, nurses, clinical officers) who by necessity provide emergency care at their facilities, but have received little or no formal training in the field. The BEC course is traditionally taught over four and a half days, with a final written assessment given on the remaining half day. The course covers five major modules: The ABCDE approach, Trauma, Difficulty in Breathing, Shock, and Altered Mental Status. Each core component re-emphasizes the ABCDE approach as it relates to the management of varied emergency conditions. Participants are assessed using pre- and post-course multiple choice exams, skills performance, attendance, and the ability to manage patient case scenarios. The pre-course exam provides a means of baseline assessment, and is reviewed with the students for educational purposes.",
    "technicalArea": "Health services provision",
    "focusArea": "Clinical care",
    "intendedAudience": "Frontline medical staff (physicians, nurses, emt)",
    "owner": "WHO",
    "developer": "HQ/WHE",
    "contactDetails": "",
    "languages": [
      "English"
    ],
    "modalityRaw": "In-person",
    "modality": "in_person",
    "platform": "",
    "link": "",
    "comment": "",
    "signoffStatus": "",
    "normalizedLink": "",
    "searchText": "basic emergency care provider course | emergency care providers must respond to ‘undifferentiated’ patients, those with acute symptoms for which the cause may not be known. this course introduces a systematic approach to managing acute, potentially life-threatening conditions even before a diagnosis is known, this clinical training aimed at frontline providers (doctors, nurses, clinical officers) who by necessity provide emergency care at their facilities, but have received little or no formal training in the field. the bec course is traditionally taught over four and a half days, with a final written assessment given on the remaining half day. the course covers five major modules: the abcde approach, trauma, difficulty in breathing, shock, and altered mental status. each core component re-emphasizes the abcde approach as it relates to the management of varied emergency conditions. participants are assessed using pre- and post-course multiple choice exams, skills performance, attendance, and the ability to manage patient case scenarios. the pre-course exam provides a means of baseline assessment, and is reviewed with the students for educational purposes. | health services provision | clinical care | frontline medical staff (physicians, nurses, emt) | who | hq/whe |  | english |  | "
  },
  {
    "id": "955edc8e991f1efd9a25c790",
    "sourceRow": 87,
    "learningName": "Basic Precautions: Hand Hygiene (COVID-19)",
    "description": "Demonstrate the WHO correct ways to wash hands",
    "technicalArea": "Infection prevention and control (IPC) & safe environment in health facilities",
    "focusArea": "COVID-19",
    "intendedAudience": "WHO staff/MoH/HCPs",
    "owner": "WHO",
    "developer": "PAHO/Virtual campus for public health",
    "contactDetails": "https://campus.paho.org/en/contact",
    "languages": [
      "Spanish"
    ],
    "modalityRaw": "Online",
    "modality": "online",
    "platform": "Virtual campus for public health",
    "link": "https://www.campusvirtualsp.org/es/node/29045",
    "comment": "",
    "signoffStatus": "",
    "normalizedLink": "https://www.campusvirtualsp.org/es/node/29045",
    "searchText": "basic precautions: hand hygiene (covid-19) | demonstrate the who correct ways to wash hands | infection prevention and control (ipc) & safe environment in health facilities | covid-19 | who staff/moh/hcps | who | paho/virtual campus for public health | https://campus.paho.org/en/contact | spanish | virtual campus for public health | https://www.campusvirtualsp.org/es/node/29045"
  },
  {
    "id": "a667e36bf028fee970129443",
    "sourceRow": 88,
    "learningName": "CBDE Awareness: Recognizing Signs of Deliberate Release of Chemical or Biological Agents",
    "description": "Ensure that all participants recognize possible deliberate events with chemical or biological agents and know the different response types this will require compared to other emergencies.",
    "technicalArea": "Chemical, biological, radiological and nuclear emergencies",
    "focusArea": "CBRN",
    "intendedAudience": "WHO staff and emergency responders",
    "owner": "WHO",
    "developer": "HQ/WHE",
    "contactDetails": "WHEtraining@who.int",
    "languages": [
      "English"
    ],
    "modalityRaw": "Online",
    "modality": "online",
    "platform": "OpenWHO",
    "link": "https://openwho.org/playlist/dedicated/501116/0_gax9z8nk/0_31qixco6",
    "comment": "",
    "signoffStatus": "",
    "normalizedLink": "https://openwho.org/playlist/dedicated/501116/0_gax9z8nk/0_31qixco6",
    "searchText": "cbde awareness: recognizing signs of deliberate release of chemical or biological agents | ensure that all participants recognize possible deliberate events with chemical or biological agents and know the different response types this will require compared to other emergencies. | chemical, biological, radiological and nuclear emergencies | cbrn | who staff and emergency responders | who | hq/whe | whetraining@who.int | english | openwho | https://openwho.org/playlist/dedicated/501116/0_gax9z8nk/0_31qixco6"
  },
  {
    "id": "99d6220483dc0f9c63860cfb",
    "sourceRow": 89,
    "learningName": "CBDE: Preparedness for Health First Responders",
    "description": "Provide them with basic training on managing and responding to a CBDE by looking at it from a health first-responder angle.",
    "technicalArea": "Chemical, biological, radiological and nuclear emergencies",
    "focusArea": "CBRN",
    "intendedAudience": "Public health professionals/HCPs",
    "owner": "WHO",
    "developer": "HQ/WHE",
    "contactDetails": "WHEtraining@who.int",
    "languages": [
      "English"
    ],
    "modalityRaw": "Online",
    "modality": "online",
    "platform": "OpenWHO",
    "link": "https://openwho.org/playlist/dedicated/501116/0_w27tnxn2/0_bfjewsep",
    "comment": "",
    "signoffStatus": "",
    "normalizedLink": "https://openwho.org/playlist/dedicated/501116/0_w27tnxn2/0_bfjewsep",
    "searchText": "cbde: preparedness for health first responders | provide them with basic training on managing and responding to a cbde by looking at it from a health first-responder angle. | chemical, biological, radiological and nuclear emergencies | cbrn | public health professionals/hcps | who | hq/whe | whetraining@who.int | english | openwho | https://openwho.org/playlist/dedicated/501116/0_w27tnxn2/0_bfjewsep"
  },
  {
    "id": "7ae7b3e863dabefc1b6bf2c5",
    "sourceRow": 90,
    "learningName": "CBDE: Preparedness for Public Health Professionals",
    "description": "Address some common misperceptions about Chemical and Biological Deliberate Events",
    "technicalArea": "Chemical, biological, radiological and nuclear emergencies",
    "focusArea": "CBRN",
    "intendedAudience": "Public health professionals",
    "owner": "WHO",
    "developer": "HQ/WHE",
    "contactDetails": "WHEtraining@who.int",
    "languages": [
      "English"
    ],
    "modalityRaw": "Online",
    "modality": "online",
    "platform": "OpenWHO",
    "link": "https://openwho.org/playlist/dedicated/501116/0_y3z538el/0_vv1olcc3",
    "comment": "",
    "signoffStatus": "",
    "normalizedLink": "https://openwho.org/playlist/dedicated/501116/0_y3z538el/0_vv1olcc3",
    "searchText": "cbde: preparedness for public health professionals | address some common misperceptions about chemical and biological deliberate events | chemical, biological, radiological and nuclear emergencies | cbrn | public health professionals | who | hq/whe | whetraining@who.int | english | openwho | https://openwho.org/playlist/dedicated/501116/0_y3z538el/0_vv1olcc3"
  },
  {
    "id": "3424a047bcae05045f501bc5",
    "sourceRow": 91,
    "learningName": "Chemical Hazards Part I: An Introduction to Chemical Hazards",
    "description": "This online learning programme is designed to address this important issue by introducing learners to types of chemical hazards and examples of chemical incidents from history.",
    "technicalArea": "Chemical, biological, radiological and nuclear emergencies",
    "focusArea": "Management of chemicals",
    "intendedAudience": "First responders and clinicians, including doctors and nurses. This includes people who would be first on a scene at a chemical incident, such as fire fighters, police officers, paramedics, hospital management staff, and more.",
    "owner": "WHO",
    "developer": "HQ/WHO Academy",
    "contactDetails": "whoasupport@who.int",
    "languages": [
      "English"
    ],
    "modalityRaw": "Online",
    "modality": "online",
    "platform": "WHO Academy",
    "link": "https://whoacademy.org/coursewares/course-v1:WHOA+0037A_CHEMHAZ_EN+2024?source=edX",
    "comment": "",
    "signoffStatus": "",
    "normalizedLink": "https://whoacademy.org/coursewares/course-v1:WHOA+0037A_CHEMHAZ_EN+2024?source=edX",
    "searchText": "chemical hazards part i: an introduction to chemical hazards | this online learning programme is designed to address this important issue by introducing learners to types of chemical hazards and examples of chemical incidents from history. | chemical, biological, radiological and nuclear emergencies | management of chemicals | first responders and clinicians, including doctors and nurses. this includes people who would be first on a scene at a chemical incident, such as fire fighters, police officers, paramedics, hospital management staff, and more. | who | hq/who academy | whoasupport@who.int | english | who academy | https://whoacademy.org/coursewares/course-v1:whoa+0037a_chemhaz_en+2024?source=edx"
  },
  {
    "id": "1bc7a554cff863404eee44d1",
    "sourceRow": 92,
    "learningName": "Chemical Hazards Part II: Elements for Assessment",
    "description": "This online learning programme is designed to enable practice in the investigation of chemical incidents.",
    "technicalArea": "Chemical, biological, radiological and nuclear emergencies",
    "focusArea": "Management of chemicals",
    "intendedAudience": "First responders and clinicians, including doctors and nurses. This includes people who would be first on a scene at a chemical incident, such as fire fighters, police officers, paramedics, hospital management staff, and more.",
    "owner": "WHO",
    "developer": "HQ/WHO Academy",
    "contactDetails": "whoasupport@who.int",
    "languages": [
      "English"
    ],
    "modalityRaw": "Online",
    "modality": "online",
    "platform": "WHO Academy",
    "link": "https://whoacademy.org/coursewares/course-v1:WHOA+0037B_CHEMHAZ_EN+2024?source=edX",
    "comment": "",
    "signoffStatus": "",
    "normalizedLink": "https://whoacademy.org/coursewares/course-v1:WHOA+0037B_CHEMHAZ_EN+2024?source=edX",
    "searchText": "chemical hazards part ii: elements for assessment | this online learning programme is designed to enable practice in the investigation of chemical incidents. | chemical, biological, radiological and nuclear emergencies | management of chemicals | first responders and clinicians, including doctors and nurses. this includes people who would be first on a scene at a chemical incident, such as fire fighters, police officers, paramedics, hospital management staff, and more. | who | hq/who academy | whoasupport@who.int | english | who academy | https://whoacademy.org/coursewares/course-v1:whoa+0037b_chemhaz_en+2024?source=edx"
  },
  {
    "id": "97da0d222f72439629f9390a",
    "sourceRow": 93,
    "learningName": "Chemical Hazards Part III: Immediate Actions at the Event Site",
    "description": "This online learning programme is designed to enable practice in the actions to take at a chemical incident site.",
    "technicalArea": "Chemical, biological, radiological and nuclear emergencies",
    "focusArea": "Management of chemicals",
    "intendedAudience": "First responders and clinicians, including doctors and nurses. This includes people who would be first on a scene at a chemical incident, such as fire fighters, police officers, paramedics, hospital management staff, and more.",
    "owner": "WHO",
    "developer": "HQ/WHO Academy",
    "contactDetails": "whoasupport@who.int",
    "languages": [
      "English"
    ],
    "modalityRaw": "Online",
    "modality": "online",
    "platform": "WHO Academy",
    "link": "https://whoacademy.org/coursewares/course-v1:WHOA+0037C_CHEMHAZ_EN+2024?source=edX",
    "comment": "",
    "signoffStatus": "",
    "normalizedLink": "https://whoacademy.org/coursewares/course-v1:WHOA+0037C_CHEMHAZ_EN+2024?source=edX",
    "searchText": "chemical hazards part iii: immediate actions at the event site | this online learning programme is designed to enable practice in the actions to take at a chemical incident site. | chemical, biological, radiological and nuclear emergencies | management of chemicals | first responders and clinicians, including doctors and nurses. this includes people who would be first on a scene at a chemical incident, such as fire fighters, police officers, paramedics, hospital management staff, and more. | who | hq/who academy | whoasupport@who.int | english | who academy | https://whoacademy.org/coursewares/course-v1:whoa+0037c_chemhaz_en+2024?source=edx"
  },
  {
    "id": "954b8310f57871286194ea20",
    "sourceRow": 94,
    "learningName": "Chemical, Biological, Radiological and Nuclear (CBRN) considerations in Mass Gatherings",
    "description": "Describe the basics of CBRN incidents, CBRN risk assessment and CBRN incidents management, including Emergency Medical Team's (EMT) role",
    "technicalArea": "Chemical, biological, radiological and nuclear emergencies",
    "focusArea": "CBRN",
    "intendedAudience": "Public health professionals, mass gatherings organizers, public safety and other multi-sectoral emergency planners and responders involved in the planning of delivery of a Mass Gathering event.",
    "owner": "WHO",
    "developer": "HQ/WHE",
    "contactDetails": "",
    "languages": [
      "English"
    ],
    "modalityRaw": "Online",
    "modality": "online",
    "platform": "HSLP",
    "link": "https://extranet.who.int/hslp/training/enrol/index.php?id=388",
    "comment": "",
    "signoffStatus": "",
    "normalizedLink": "https://extranet.who.int/hslp/training/enrol/index.php?id=388",
    "searchText": "chemical, biological, radiological and nuclear (cbrn) considerations in mass gatherings | describe the basics of cbrn incidents, cbrn risk assessment and cbrn incidents management, including emergency medical team's (emt) role | chemical, biological, radiological and nuclear emergencies | cbrn | public health professionals, mass gatherings organizers, public safety and other multi-sectoral emergency planners and responders involved in the planning of delivery of a mass gathering event. | who | hq/whe |  | english | hslp | https://extranet.who.int/hslp/training/enrol/index.php?id=388"
  },
  {
    "id": "042356a8d27e03ab4ced753e",
    "sourceRow": 95,
    "learningName": "Cholera Outbreaks: Emergency Preparedness and Response",
    "description": "This course outlines the objectives of a cholera outbreak response, how to detect and confirm cholera outbreaks and how to effectively organize the response including describing control measures. It also describes steps to take to be better prepared to respond to cholera outbreaks. Good preparedness leads to faster more effective outbreak response.",
    "technicalArea": "Health emergency preparedness and response management",
    "focusArea": "Cholera",
    "intendedAudience": "Member states/ MoH/WHO staff",
    "owner": "WHO",
    "developer": "HQ/WHE",
    "contactDetails": "WHEtraining@who.int",
    "languages": [
      "English",
      "Pashto"
    ],
    "modalityRaw": "Online",
    "modality": "online",
    "platform": "OpenWHO",
    "link": "https://openwho.org/playlist/dedicated/493105/0_txbklgi0/0_rusjh8yz",
    "comment": "",
    "signoffStatus": "",
    "normalizedLink": "https://openwho.org/playlist/dedicated/493105/0_txbklgi0/0_rusjh8yz",
    "searchText": "cholera outbreaks: emergency preparedness and response | this course outlines the objectives of a cholera outbreak response, how to detect and confirm cholera outbreaks and how to effectively organize the response including describing control measures. it also describes steps to take to be better prepared to respond to cholera outbreaks. good preparedness leads to faster more effective outbreak response. | health emergency preparedness and response management | cholera | member states/ moh/who staff | who | hq/whe | whetraining@who.int | english, pashto | openwho | https://openwho.org/playlist/dedicated/493105/0_txbklgi0/0_rusjh8yz"
  },
  {
    "id": "c526933db810e313000a9dc4",
    "sourceRow": 96,
    "learningName": "Clinical management of COVID-19 respiratory equipment",
    "description": "Developed due to the enormous emphasis placed on need for safe provision of oxygen to patients with COVID-19, but can be used for conditions beyond COVID-19.",
    "technicalArea": "Health services provision",
    "focusArea": "COVID-19",
    "intendedAudience": "WHO staff/MoH/HCPs",
    "owner": "WHO",
    "developer": "HQ/WHE/HSP",
    "contactDetails": "WHEtraining@who.int",
    "languages": [
      "English"
    ],
    "modalityRaw": "Online",
    "modality": "online",
    "platform": "OpenWHO",
    "link": "https://openwho.org/playlist/dedicated/529855/0_hor2h1ly/0_jdpzzxap",
    "comment": "",
    "signoffStatus": "",
    "normalizedLink": "https://openwho.org/playlist/dedicated/529855/0_hor2h1ly/0_jdpzzxap",
    "searchText": "clinical management of covid-19 respiratory equipment | developed due to the enormous emphasis placed on need for safe provision of oxygen to patients with covid-19, but can be used for conditions beyond covid-19. | health services provision | covid-19 | who staff/moh/hcps | who | hq/whe/hsp | whetraining@who.int | english | openwho | https://openwho.org/playlist/dedicated/529855/0_hor2h1ly/0_jdpzzxap"
  },
  {
    "id": "975d290f8bb024ecdf56c54a",
    "sourceRow": 97,
    "learningName": "Clinical management of patients with COVID19 General considerations",
    "description": "Presentations address all aspects of clinical management, including facility preparation and surge planning",
    "technicalArea": "Health services provision",
    "focusArea": "COVID-19",
    "intendedAudience": "Member states/ MoH/WHO staff",
    "owner": "WHO",
    "developer": "HQ/WHE",
    "contactDetails": "WHEtraining@who.int",
    "languages": [
      "English",
      "Russian"
    ],
    "modalityRaw": "Online",
    "modality": "online",
    "platform": "OpenWHO",
    "link": "https://openwho.org/playlist/dedicated/500316/0_5lox1o7u/0_tu656kc3",
    "comment": "",
    "signoffStatus": "",
    "normalizedLink": "https://openwho.org/playlist/dedicated/500316/0_5lox1o7u/0_tu656kc3",
    "searchText": "clinical management of patients with covid19 general considerations | presentations address all aspects of clinical management, including facility preparation and surge planning | health services provision | covid-19 | member states/ moh/who staff | who | hq/whe | whetraining@who.int | english, russian | openwho | https://openwho.org/playlist/dedicated/500316/0_5lox1o7u/0_tu656kc3"
  },
  {
    "id": "8651e0294eb66d852c3115e0",
    "sourceRow": 98,
    "learningName": "Clinical management of patients with COVID19 Initial approach to the acutely ill patient",
    "description": "Goal of these modules is to prepare and support health providers as they provide emergency care to seriously ill patients.",
    "technicalArea": "Health services provision",
    "focusArea": "COVID-19",
    "intendedAudience": "WHO staff/MoH/HCPs",
    "owner": "WHO",
    "developer": "HQ/WHE",
    "contactDetails": "WHEtraining@who.int",
    "languages": [
      "English",
      "Russian"
    ],
    "modalityRaw": "Online",
    "modality": "online",
    "platform": "OpenWHO",
    "link": "https://openwho.org/playlist/dedicated/500316/0_xfe055ah/0_sgcgs6yg",
    "comment": "",
    "signoffStatus": "",
    "normalizedLink": "https://openwho.org/playlist/dedicated/500316/0_xfe055ah/0_sgcgs6yg",
    "searchText": "clinical management of patients with covid19 initial approach to the acutely ill patient | goal of these modules is to prepare and support health providers as they provide emergency care to seriously ill patients. | health services provision | covid-19 | who staff/moh/hcps | who | hq/whe | whetraining@who.int | english, russian | openwho | https://openwho.org/playlist/dedicated/500316/0_xfe055ah/0_sgcgs6yg"
  },
  {
    "id": "558fea70d0f9675fc1345261",
    "sourceRow": 99,
    "learningName": "Clinical management of patients with COVID19 Investigations and care for mild moderate and severe disease",
    "description": "Provide an overview of the investigations and management strategies in caring for patients with mild, moderate, and severe COVID-19",
    "technicalArea": "Health services provision",
    "focusArea": "COVID-19",
    "intendedAudience": "WHO staff/MoH/HCPs",
    "owner": "WHO",
    "developer": "HQ/WHE",
    "contactDetails": "WHEtraining@who.int",
    "languages": [
      "English",
      "Russian"
    ],
    "modalityRaw": "Online",
    "modality": "online",
    "platform": "OpenWHO",
    "link": "https://openwho.org/playlist/dedicated/500316/0_5f1x2wvv/0_jlfj5odb",
    "comment": "",
    "signoffStatus": "",
    "normalizedLink": "https://openwho.org/playlist/dedicated/500316/0_5f1x2wvv/0_jlfj5odb",
    "searchText": "clinical management of patients with covid19 investigations and care for mild moderate and severe disease | provide an overview of the investigations and management strategies in caring for patients with mild, moderate, and severe covid-19 | health services provision | covid-19 | who staff/moh/hcps | who | hq/whe | whetraining@who.int | english, russian | openwho | https://openwho.org/playlist/dedicated/500316/0_5f1x2wvv/0_jlfj5odb"
  },
  {
    "id": "15ff6146d759060312f9284e",
    "sourceRow": 100,
    "learningName": "Clinical management of patients with COVID19 Rehabilitation of patients with COVID19",
    "description": "Presentations address all aspects of clinical management, including facility preparation and surge planning",
    "technicalArea": "Health services provision",
    "focusArea": "COVID-19",
    "intendedAudience": "Member states/ MoH/WHO staff",
    "owner": "WHO",
    "developer": "HQ/WHE",
    "contactDetails": "WHEtraining@who.int",
    "languages": [
      "Armenian",
      "Chinese",
      "English",
      "French",
      "Macedonian",
      "Russian",
      "Ukrainian"
    ],
    "modalityRaw": "Online",
    "modality": "online",
    "platform": "OpenWHO",
    "link": "https://openwho.org/playlist/dedicated/500316/0_ic95heel/0_ebpgu9oh",
    "comment": "",
    "signoffStatus": "",
    "normalizedLink": "https://openwho.org/playlist/dedicated/500316/0_ic95heel/0_ebpgu9oh",
    "searchText": "clinical management of patients with covid19 rehabilitation of patients with covid19 | presentations address all aspects of clinical management, including facility preparation and surge planning | health services provision | covid-19 | member states/ moh/who staff | who | hq/whe | whetraining@who.int | armenian, chinese, english, french, macedonian, russian, ukrainian | openwho | https://openwho.org/playlist/dedicated/500316/0_ic95heel/0_ebpgu9oh"
  },
  {
    "id": "fa65b5e34114b31b01cb6b68",
    "sourceRow": 101,
    "learningName": "Controlling the Spread of COVID-19 at Ground Crossings",
    "description": "Manage an outbreak of COVID-19 disease on board a ship",
    "technicalArea": "Points of entry (PoEs) and border health",
    "focusArea": "COVID-19",
    "intendedAudience": "National IHR Focal Points, Port health authorities (PHAs) and local, provincial, and national health surveillance and response systems, ship operators and port operators.",
    "owner": "WHO",
    "developer": "HQ/WHE",
    "contactDetails": "",
    "languages": [
      "English"
    ],
    "modalityRaw": "Online",
    "modality": "online",
    "platform": "HSLP",
    "link": "https://extranet.who.int/hslp/training/enrol/index.php?id=333",
    "comment": "",
    "signoffStatus": "",
    "normalizedLink": "https://extranet.who.int/hslp/training/enrol/index.php?id=333",
    "searchText": "controlling the spread of covid-19 at ground crossings | manage an outbreak of covid-19 disease on board a ship | points of entry (poes) and border health | covid-19 | national ihr focal points, port health authorities (phas) and local, provincial, and national health surveillance and response systems, ship operators and port operators. | who | hq/whe |  | english | hslp | https://extranet.who.int/hslp/training/enrol/index.php?id=333"
  },
  {
    "id": "76f4da2705df645a033d2b6a",
    "sourceRow": 102,
    "learningName": "COVID-19 Simulation Exercises Packages",
    "description": "To support countries' COVID-19 preparedness efforts, the Department of Health Security Preparedness at WHO headquarters has developed various COVID-19 Tabletop Exercise (TTX) and Drill (DR) packages.",
    "technicalArea": "Research & monitoring and evaluation",
    "focusArea": "COVID-19",
    "intendedAudience": "WHO staff/MoH/HCPs",
    "owner": "WHO",
    "developer": "HQ/WHE",
    "contactDetails": "cer@who.int",
    "languages": [
      "English"
    ],
    "modalityRaw": "Training toolkits and packages",
    "modality": "toolkit",
    "platform": "Webpage",
    "link": "https://www.who.int/emergencies/diseases/novel-coronavirus-2019/training/simulation-exercise",
    "comment": "",
    "signoffStatus": "",
    "normalizedLink": "https://www.who.int/emergencies/diseases/novel-coronavirus-2019/training/simulation-exercise",
    "searchText": "covid-19 simulation exercises packages | to support countries' covid-19 preparedness efforts, the department of health security preparedness at who headquarters has developed various covid-19 tabletop exercise (ttx) and drill (dr) packages. | research & monitoring and evaluation | covid-19 | who staff/moh/hcps | who | hq/whe | cer@who.int | english | webpage | https://www.who.int/emergencies/diseases/novel-coronavirus-2019/training/simulation-exercise"
  },
  {
    "id": "92c09ee113c0680df10359d3",
    "sourceRow": 103,
    "learningName": "COVID-19: Putting on and Taking off Personal Protective Equipment (PPE)",
    "description": "Demonstrate the correct way to put on and take off PPE and sanitize hands",
    "technicalArea": "Infection prevention and control (IPC) & safe environment in health facilities",
    "focusArea": "PPE",
    "intendedAudience": "WHO staff/MoH/HCPs",
    "owner": "WHO",
    "developer": "HQ/WHE",
    "contactDetails": "https://campus.paho.org/en/contact",
    "languages": [
      "Spanish"
    ],
    "modalityRaw": "Online",
    "modality": "online",
    "platform": "Virtual campus for public health",
    "link": "https://www.campusvirtualsp.org/es/node/29023",
    "comment": "",
    "signoffStatus": "",
    "normalizedLink": "https://www.campusvirtualsp.org/es/node/29023",
    "searchText": "covid-19: putting on and taking off personal protective equipment (ppe) | demonstrate the correct way to put on and take off ppe and sanitize hands | infection prevention and control (ipc) & safe environment in health facilities | ppe | who staff/moh/hcps | who | hq/whe | https://campus.paho.org/en/contact | spanish | virtual campus for public health | https://www.campusvirtualsp.org/es/node/29023"
  },
  {
    "id": "f90376263a7633bcbce9caa3",
    "sourceRow": 104,
    "learningName": "COVID-19: risk communication and community engagement",
    "description": "This infodemic management course applies evidence-based guidance to the COVID-19 pandemic. It covers key risk communication and community engagement (RCCE) principles and illustrates how they can be operationalized in the context of an extended outbreak that affects different populations with varying risk levels.",
    "technicalArea": "Risk communication and community engagement (RCCE)",
    "focusArea": "RCCE",
    "intendedAudience": "Member states/ MoH/WHO staff",
    "owner": "WHO",
    "developer": "HQ/WHE",
    "contactDetails": "WHEtraining@who.int",
    "languages": [
      "English",
      "Ukrainian"
    ],
    "modalityRaw": "Online",
    "modality": "online",
    "platform": "OpenWHO",
    "link": "https://openwho.org/playlist/dedicated/529855/0_bth07gtj/0_wlhik4bk",
    "comment": "",
    "signoffStatus": "",
    "normalizedLink": "https://openwho.org/playlist/dedicated/529855/0_bth07gtj/0_wlhik4bk",
    "searchText": "covid-19: risk communication and community engagement | this infodemic management course applies evidence-based guidance to the covid-19 pandemic. it covers key risk communication and community engagement (rcce) principles and illustrates how they can be operationalized in the context of an extended outbreak that affects different populations with varying risk levels. | risk communication and community engagement (rcce) | rcce | member states/ moh/who staff | who | hq/whe | whetraining@who.int | english, ukrainian | openwho | https://openwho.org/playlist/dedicated/529855/0_bth07gtj/0_wlhik4bk"
  },
  {
    "id": "04ef654ec8de26853e166d47",
    "sourceRow": 105,
    "learningName": "Early Warning and Response Training",
    "description": "The course covered concepts and methods for EWRS, including inter-sectoral collaboration for EWRS",
    "technicalArea": "Surveillance",
    "focusArea": "EWARS",
    "intendedAudience": "Ministry of Health officials",
    "owner": "WHO",
    "developer": "HQ/WHE",
    "contactDetails": "",
    "languages": [
      "English"
    ],
    "modalityRaw": "In-person",
    "modality": "in_person",
    "platform": "",
    "link": "",
    "comment": "",
    "signoffStatus": "",
    "normalizedLink": "",
    "searchText": "early warning and response training | the course covered concepts and methods for ewrs, including inter-sectoral collaboration for ewrs | surveillance | ewars | ministry of health officials | who | hq/whe |  | english |  | "
  },
  {
    "id": "299126bf9caf8cada5a14ad5",
    "sourceRow": 106,
    "learningName": "Ebola - Entry Screening at Ports, Airports and Land Crossings",
    "description": "Identify key steps for planning entry screening at selected points of entry.",
    "technicalArea": "Points of entry (PoEs) and border health",
    "focusArea": "Ebola",
    "intendedAudience": "Professionals from National IHR Focal Points (NFPs), health authorities, staff working at points of entry (POE).",
    "owner": "WHO",
    "developer": "HQ/WHE",
    "contactDetails": "",
    "languages": [
      "English"
    ],
    "modalityRaw": "Online",
    "modality": "online",
    "platform": "HSLP",
    "link": "https://extranet.who.int/hslp/training/enrol/index.php?id=103",
    "comment": "",
    "signoffStatus": "",
    "normalizedLink": "https://extranet.who.int/hslp/training/enrol/index.php?id=103",
    "searchText": "ebola - entry screening at ports, airports and land crossings | identify key steps for planning entry screening at selected points of entry. | points of entry (poes) and border health | ebola | professionals from national ihr focal points (nfps), health authorities, staff working at points of entry (poe). | who | hq/whe |  | english | hslp | https://extranet.who.int/hslp/training/enrol/index.php?id=103"
  },
  {
    "id": "d2a2bc326b68fc290c2a4035",
    "sourceRow": 107,
    "learningName": "Ebola - Exit Screening at Ports, Airports and Land Crossings",
    "description": "Identify key steps for planning and Implementing exit screening process at selected terminals or facilities",
    "technicalArea": "Points of entry (PoEs) and border health",
    "focusArea": "Ebola",
    "intendedAudience": "Professionals from National IHR Focal Points (NFPs), health authorities, staff working at points of entry (POE).",
    "owner": "WHO",
    "developer": "HQ/WHE",
    "contactDetails": "",
    "languages": [
      "English"
    ],
    "modalityRaw": "Online",
    "modality": "online",
    "platform": "HSLP",
    "link": "https://extranet.who.int/hslp/training/enrol/index.php?id=98",
    "comment": "",
    "signoffStatus": "",
    "normalizedLink": "https://extranet.who.int/hslp/training/enrol/index.php?id=98",
    "searchText": "ebola - exit screening at ports, airports and land crossings | identify key steps for planning and implementing exit screening process at selected terminals or facilities | points of entry (poes) and border health | ebola | professionals from national ihr focal points (nfps), health authorities, staff working at points of entry (poe). | who | hq/whe |  | english | hslp | https://extranet.who.int/hslp/training/enrol/index.php?id=98"
  },
  {
    "id": "390acf0fc022e7e20175a59a",
    "sourceRow": 108,
    "learningName": "Ebola and Marburg diseases screening and treatment center design",
    "description": "In this course, we will explore the fundamental principles and structural requirements underpinning the design and functioning of screening facilities and treatment centres in ebola and marburg diseases context.",
    "technicalArea": "Health services provision",
    "focusArea": "Ebola and Marburg",
    "intendedAudience": "Member states/ MoH/WHO staff",
    "owner": "WHO",
    "developer": "HQ/WHE",
    "contactDetails": "WHEtraining@who.int",
    "languages": [
      "English"
    ],
    "modalityRaw": "Online",
    "modality": "online",
    "platform": "OpenWHO",
    "link": "https://openwho.org/playlist/dedicated/536527/0_rt7m1knx/0_j68o40ng",
    "comment": "",
    "signoffStatus": "",
    "normalizedLink": "https://openwho.org/playlist/dedicated/536527/0_rt7m1knx/0_j68o40ng",
    "searchText": "ebola and marburg diseases screening and treatment center design | in this course, we will explore the fundamental principles and structural requirements underpinning the design and functioning of screening facilities and treatment centres in ebola and marburg diseases context. | health services provision | ebola and marburg | member states/ moh/who staff | who | hq/whe | whetraining@who.int | english | openwho | https://openwho.org/playlist/dedicated/536527/0_rt7m1knx/0_j68o40ng"
  },
  {
    "id": "fb460a78295e7db39ad2603f",
    "sourceRow": 109,
    "learningName": "Clinical management of Ebola virus disease",
    "description": "Information on screening and triage, infection prevention and control, laboratory diagnostics, organization of the Ebola Treatment Centre (ETC), clinical care of patients in the ETC, and investigational therapeutic agents.",
    "technicalArea": "Health services provision",
    "focusArea": "Ebola",
    "intendedAudience": "WHO staff/MoH/HCPs",
    "owner": "WHO",
    "developer": "HQ/WHE",
    "contactDetails": "WHEtraining@who.int",
    "languages": [
      "English"
    ],
    "modalityRaw": "Online",
    "modality": "online",
    "platform": "OpenWHO",
    "link": "https://openwho.org/media/Ebola%20Module%201%3A%20Screening%20and%20triage%3A%20Recognize%20suspect%20patients%20with%20Ebola%20early/0_guwpwaxh/536527",
    "comment": "",
    "signoffStatus": "",
    "normalizedLink": "https://openwho.org/media/Ebola%20Module%201%3A%20Screening%20and%20triage%3A%20Recognize%20suspect%20patients%20with%20Ebola%20early/0_guwpwaxh/536527",
    "searchText": "clinical management of ebola virus disease | information on screening and triage, infection prevention and control, laboratory diagnostics, organization of the ebola treatment centre (etc), clinical care of patients in the etc, and investigational therapeutic agents. | health services provision | ebola | who staff/moh/hcps | who | hq/whe | whetraining@who.int | english | openwho | https://openwho.org/media/ebola%20module%201%3a%20screening%20and%20triage%3a%20recognize%20suspect%20patients%20with%20ebola%20early/0_guwpwaxh/536527"
  },
  {
    "id": "28707ecc01d943cd8cbc22a7",
    "sourceRow": 110,
    "learningName": "Emergency Preparedness and IHR Compliance Simulation",
    "description": "This course is a learning game that will prepare you for national health emergencies by practicing how to make more effective decisions and communicating well with stakeholders. This will be a learning game that may be facilitated both in online and face-to-face formats.",
    "technicalArea": "Research & monitoring and evaluation",
    "focusArea": "Simulation",
    "intendedAudience": "Policymakers; emergency preparedness stakeholders; WHO IHR staff and contact points, staff from State Parties National Focal Points",
    "owner": "WHO",
    "developer": "HQ/WHE",
    "contactDetails": "whoasupport@who.int",
    "languages": [
      "English"
    ],
    "modalityRaw": "Online",
    "modality": "online",
    "platform": "WHO Academy",
    "link": "https://web-staging.lxp.academy.who.int/coursewares/course-v1:WHOA+0019_EPIC_EN+2024?from=discovery&source=edX",
    "comment": "",
    "signoffStatus": "",
    "normalizedLink": "https://web-staging.lxp.academy.who.int/coursewares/course-v1:WHOA+0019_EPIC_EN+2024?from=discovery&source=edX",
    "searchText": "emergency preparedness and ihr compliance simulation | this course is a learning game that will prepare you for national health emergencies by practicing how to make more effective decisions and communicating well with stakeholders. this will be a learning game that may be facilitated both in online and face-to-face formats. | research & monitoring and evaluation | simulation | policymakers; emergency preparedness stakeholders; who ihr staff and contact points, staff from state parties national focal points | who | hq/whe | whoasupport@who.int | english | who academy | https://web-staging.lxp.academy.who.int/coursewares/course-v1:whoa+0019_epic_en+2024?from=discovery&source=edx"
  },
  {
    "id": "56aaec5c0d3267bcbf1d6f0d",
    "sourceRow": 111,
    "learningName": "Emerging respiratory viruses, including COVID-19: methods of detection, prevention, response, and control",
    "description": "Understand the fundamental principles of emerging respiratory viruses and how to effectively respond to an outbreak.",
    "technicalArea": "Health emergency preparedness and response management",
    "focusArea": "COVID-19",
    "intendedAudience": "WHO staff/MoH/HCPs",
    "owner": "WHO",
    "developer": "HQ/WHE",
    "contactDetails": "https://campus.paho.org/en/contact",
    "languages": [
      "Spanish"
    ],
    "modalityRaw": "Online",
    "modality": "online",
    "platform": "Virtual campus for public health",
    "link": "https://www.campusvirtualsp.org/es/node/28738",
    "comment": "",
    "signoffStatus": "",
    "normalizedLink": "https://www.campusvirtualsp.org/es/node/28738",
    "searchText": "emerging respiratory viruses, including covid-19: methods of detection, prevention, response, and control | understand the fundamental principles of emerging respiratory viruses and how to effectively respond to an outbreak. | health emergency preparedness and response management | covid-19 | who staff/moh/hcps | who | hq/whe | https://campus.paho.org/en/contact | spanish | virtual campus for public health | https://www.campusvirtualsp.org/es/node/28738"
  },
  {
    "id": "0b7d2c711e025aaf4714f1d3",
    "sourceRow": 112,
    "learningName": "ePROTECT Respiratory Infections: Occupational Health and Safety (COVID-19)",
    "description": "Know the basic principles of acute respiratory infections",
    "technicalArea": "Infection prevention and control (IPC) & safe environment in health facilities",
    "focusArea": "IPC",
    "intendedAudience": "WHO staff/MoH/HCPs",
    "owner": "WHO",
    "developer": "HQ/WHE",
    "contactDetails": "https://campus.paho.org/en/contact",
    "languages": [
      "Spanish"
    ],
    "modalityRaw": "Online",
    "modality": "online",
    "platform": "Virtual campus for public health",
    "link": "https://www.campusvirtualsp.org/es/node/28882",
    "comment": "",
    "signoffStatus": "",
    "normalizedLink": "https://www.campusvirtualsp.org/es/node/28882",
    "searchText": "eprotect respiratory infections: occupational health and safety (covid-19) | know the basic principles of acute respiratory infections | infection prevention and control (ipc) & safe environment in health facilities | ipc | who staff/moh/hcps | who | hq/whe | https://campus.paho.org/en/contact | spanish | virtual campus for public health | https://www.campusvirtualsp.org/es/node/28882"
  },
  {
    "id": "7c143a1f42c06161150d0359",
    "sourceRow": 113,
    "learningName": "EVD - GO Package",
    "description": "Training to perform work safely as part of the teams working to bring the outbreak under control.",
    "technicalArea": "Health emergency preparedness and response management",
    "focusArea": "Ebola",
    "intendedAudience": "Public health institutions (schools of medicine, public health, etc.), ministries and other organizations",
    "owner": "WHO",
    "developer": "HQ/WHE",
    "contactDetails": "",
    "languages": [
      "English"
    ],
    "modalityRaw": "Training toolkits and packages",
    "modality": "toolkit",
    "platform": "HSLP",
    "link": "https://extranet.who.int/hslp/content/evd-go-package",
    "comment": "",
    "signoffStatus": "",
    "normalizedLink": "https://extranet.who.int/hslp/content/evd-go-package",
    "searchText": "evd - go package | training to perform work safely as part of the teams working to bring the outbreak under control. | health emergency preparedness and response management | ebola | public health institutions (schools of medicine, public health, etc.), ministries and other organizations | who | hq/whe |  | english | hslp | https://extranet.who.int/hslp/content/evd-go-package"
  },
  {
    "id": "6071e6afcc719a14165764b0",
    "sourceRow": 114,
    "learningName": "EVD Preparedness Training Package (WHO Regional Office for Africa – version1)",
    "description": "Include guidance documents for facilitators (facilitation team manual, facilitator guides to run specific sessions) as well as sample evaluation tools to collect participants' and facilitators' feedback.",
    "technicalArea": "Health emergency preparedness and response management",
    "focusArea": "Ebola",
    "intendedAudience": "Public health institutions (schools of medicine, public health, etc.), ministries and other organizations",
    "owner": "WHO",
    "developer": "HQ/WHE",
    "contactDetails": "",
    "languages": [
      "English",
      "French",
      "Portuguese"
    ],
    "modalityRaw": "Training toolkits and packages",
    "modality": "toolkit",
    "platform": "HSLP",
    "link": "https://extranet.who.int/hslp/content/evd-training-package-1",
    "comment": "",
    "signoffStatus": "",
    "normalizedLink": "https://extranet.who.int/hslp/content/evd-training-package-1",
    "searchText": "evd preparedness training package (who regional office for africa – version1) | include guidance documents for facilitators (facilitation team manual, facilitator guides to run specific sessions) as well as sample evaluation tools to collect participants' and facilitators' feedback. | health emergency preparedness and response management | ebola | public health institutions (schools of medicine, public health, etc.), ministries and other organizations | who | hq/whe |  | english, french, portuguese | hslp | https://extranet.who.int/hslp/content/evd-training-package-1"
  },
  {
    "id": "50e2cba46710419f0eba0eb6",
    "sourceRow": 115,
    "learningName": "EVD Rapid Response Teams Training Package",
    "description": "Reinforce the capacity and skills of multidisciplinary RRTs and their individual members to early detect and effectively respond to a potential EVD outbreak.",
    "technicalArea": "Health emergency preparedness and response management",
    "focusArea": "Ebola",
    "intendedAudience": "Public health institutions (schools of medicine, public health, etc.), ministries and other organizations",
    "owner": "WHO",
    "developer": "HQ/WHE",
    "contactDetails": "",
    "languages": [
      "English",
      "French"
    ],
    "modalityRaw": "Training toolkits and packages",
    "modality": "toolkit",
    "platform": "HSLP",
    "link": "https://extranet.who.int/hslp/content/evd-rrt-training-package",
    "comment": "",
    "signoffStatus": "",
    "normalizedLink": "https://extranet.who.int/hslp/content/evd-rrt-training-package",
    "searchText": "evd rapid response teams training package | reinforce the capacity and skills of multidisciplinary rrts and their individual members to early detect and effectively respond to a potential evd outbreak. | health emergency preparedness and response management | ebola | public health institutions (schools of medicine, public health, etc.), ministries and other organizations | who | hq/whe |  | english, french | hslp | https://extranet.who.int/hslp/content/evd-rrt-training-package"
  },
  {
    "id": "263c4ea63e9a291caf9db501",
    "sourceRow": 116,
    "learningName": "EVD Training Package - gCHV Training on EBOLA Flipbook and IPC",
    "description": "Provide instructions and training material (flipbook) to generic Community Health Volunteers (gCHVs) in conducting training in communities /houses on how to reduce and stop the spread of Ebola and how to protect themselves, their family, and their communities from Ebola",
    "technicalArea": "Health emergency preparedness and response management",
    "focusArea": "Ebola",
    "intendedAudience": "Public health institutions (schools of medicine, public health, etc.), ministries and other organizations",
    "owner": "WHO",
    "developer": "HQ/WHE",
    "contactDetails": "",
    "languages": [
      "English"
    ],
    "modalityRaw": "Training toolkits and packages",
    "modality": "toolkit",
    "platform": "HSLP",
    "link": "https://extranet.who.int/hslp/content/training-package-2",
    "comment": "",
    "signoffStatus": "",
    "normalizedLink": "https://extranet.who.int/hslp/content/training-package-2",
    "searchText": "evd training package - gchv training on ebola flipbook and ipc | provide instructions and training material (flipbook) to generic community health volunteers (gchvs) in conducting training in communities /houses on how to reduce and stop the spread of ebola and how to protect themselves, their family, and their communities from ebola | health emergency preparedness and response management | ebola | public health institutions (schools of medicine, public health, etc.), ministries and other organizations | who | hq/whe |  | english | hslp | https://extranet.who.int/hslp/content/training-package-2"
  },
  {
    "id": "e28bbfe2823992821c34152e",
    "sourceRow": 117,
    "learningName": "EVD Training Package - Providing Safe Care in the Community",
    "description": "Training material that brings together locally practiced methods in caring for the sick and best available infection prevention measures in the community.",
    "technicalArea": "Health emergency preparedness and response management",
    "focusArea": "Ebola",
    "intendedAudience": "Public health institutions (schools of medicine, public health, etc.), ministries and other organizations",
    "owner": "WHO",
    "developer": "HQ/WHE",
    "contactDetails": "",
    "languages": [
      "English"
    ],
    "modalityRaw": "Training toolkits and packages",
    "modality": "toolkit",
    "platform": "HSLP",
    "link": "https://extranet.who.int/hslp/content/training-package-3",
    "comment": "",
    "signoffStatus": "",
    "normalizedLink": "https://extranet.who.int/hslp/content/training-package-3",
    "searchText": "evd training package - providing safe care in the community | training material that brings together locally practiced methods in caring for the sick and best available infection prevention measures in the community. | health emergency preparedness and response management | ebola | public health institutions (schools of medicine, public health, etc.), ministries and other organizations | who | hq/whe |  | english | hslp | https://extranet.who.int/hslp/content/training-package-3"
  },
  {
    "id": "23644fe9a2a4cd5642b3dc6b",
    "sourceRow": 118,
    "learningName": "Event Information Site for National IHR Focal Points (EIS)",
    "description": "Consist of brief learning modules comprised of bite-sized learning activities designed for quick consumption with the aim of familiarizing NFPs and relevant WHO staff with the EIS platform.",
    "technicalArea": "Surveillance",
    "focusArea": "EIS",
    "intendedAudience": "National IHR Focal Points (NFPs) and WHO staff",
    "owner": "WHO",
    "developer": "HQ/WHE",
    "contactDetails": "",
    "languages": [
      "English"
    ],
    "modalityRaw": "Online",
    "modality": "online",
    "platform": "HSLP",
    "link": "https://extranet.who.int/hslp/training/course/index.php?categoryid=32",
    "comment": "",
    "signoffStatus": "",
    "normalizedLink": "https://extranet.who.int/hslp/training/course/index.php?categoryid=32",
    "searchText": "event information site for national ihr focal points (eis) | consist of brief learning modules comprised of bite-sized learning activities designed for quick consumption with the aim of familiarizing nfps and relevant who staff with the eis platform. | surveillance | eis | national ihr focal points (nfps) and who staff | who | hq/whe |  | english | hslp | https://extranet.who.int/hslp/training/course/index.php?categoryid=32"
  },
  {
    "id": "6c8d6fbc44e8107a1483a06d",
    "sourceRow": 119,
    "learningName": "Event Management at Points of Entry",
    "description": "This online course aims to train relevant personnel at the Points-of-Entry on how to conduct initial risk assessment and management of Ebola event at Points of Entry.",
    "technicalArea": "Points of entry (PoEs) and border health",
    "focusArea": "Ebola",
    "intendedAudience": "National IHR Focal Points",
    "owner": "WHO",
    "developer": "HQ/WHE",
    "contactDetails": "",
    "languages": [
      "English"
    ],
    "modalityRaw": "Online",
    "modality": "online",
    "platform": "HSLP",
    "link": "https://extranet.who.int/hslp/training/course/index.php?categoryid=33",
    "comment": "",
    "signoffStatus": "",
    "normalizedLink": "https://extranet.who.int/hslp/training/course/index.php?categoryid=33",
    "searchText": "event management at points of entry | this online course aims to train relevant personnel at the points-of-entry on how to conduct initial risk assessment and management of ebola event at points of entry. | points of entry (poes) and border health | ebola | national ihr focal points | who | hq/whe |  | english | hslp | https://extranet.who.int/hslp/training/course/index.php?categoryid=33"
  },
  {
    "id": "78c75cebe8f207018206bf38",
    "sourceRow": 120,
    "learningName": "Facilitation skills for workshops and trainings (ToT)",
    "description": "Training on how to design and deliver a training or workshop - support technical knowledge/skills transfer. * \"The training will need to be updated to align with the IHR amendments when they enter into force\"",
    "technicalArea": "IHR Coordination and National IHR Focal Point Functions",
    "focusArea": "PHEOC",
    "intendedAudience": "WHE NPOs/ Hub teams / EMO technical leads",
    "owner": "WHO",
    "developer": "HQ/WHE",
    "contactDetails": "",
    "languages": [
      "English"
    ],
    "modalityRaw": "In-person",
    "modality": "in_person",
    "platform": "",
    "link": "",
    "comment": "",
    "signoffStatus": "",
    "normalizedLink": "",
    "searchText": "facilitation skills for workshops and trainings (tot) | training on how to design and deliver a training or workshop - support technical knowledge/skills transfer. * \"the training will need to be updated to align with the ihr amendments when they enter into force\" | ihr coordination and national ihr focal point functions | pheoc | whe npos/ hub teams / emo technical leads | who | hq/whe |  | english |  | "
  },
  {
    "id": "6231d7d5a1ed44685efefa69",
    "sourceRow": 121,
    "learningName": "Fast Track Training on Public Health Emergencies",
    "description": "The training will provide a comprehensive overview of selected topics that are essential in emergencies. It is the goal to develop basic field public health skills with practical utility in emergency situations. It is a hybrid program with online courses and F2F workshop which will focus on practical application of technical knowledge provided in online sessions.",
    "technicalArea": "Health emergency preparedness and response management",
    "focusArea": "Health emergencies management",
    "intendedAudience": "WHE and affiliated staff in countries affected by humanitarian emergencies in EMRO, AFRO and EURO regions. Preferred participants would be people with practical public health experience building on some formal public health.",
    "owner": "WHO",
    "developer": "HQ/WHE",
    "contactDetails": "",
    "languages": [
      "English"
    ],
    "modalityRaw": "Blended",
    "modality": "blended",
    "platform": "",
    "link": "",
    "comment": "",
    "signoffStatus": "",
    "normalizedLink": "",
    "searchText": "fast track training on public health emergencies | the training will provide a comprehensive overview of selected topics that are essential in emergencies. it is the goal to develop basic field public health skills with practical utility in emergency situations. it is a hybrid program with online courses and f2f workshop which will focus on practical application of technical knowledge provided in online sessions. | health emergency preparedness and response management | health emergencies management | whe and affiliated staff in countries affected by humanitarian emergencies in emro, afro and euro regions. preferred participants would be people with practical public health experience building on some formal public health. | who | hq/whe |  | english |  | "
  },
  {
    "id": "a5b16b19badb07bffd705011",
    "sourceRow": 122,
    "learningName": "Global Laboratory Leadership Programme Learning Package",
    "description": "Foster and mentor current and emerging laboratory leaders to build, strengthen, and sustain national laboratory systems. Access to full course materails is made available only on request",
    "technicalArea": "Laboratory",
    "focusArea": "Laboratory leadership",
    "intendedAudience": "Public health institutions (schools of medicine, public health, etc.), ministries and other organizations",
    "owner": "WHO",
    "developer": "HQ/WHE",
    "contactDetails": "",
    "languages": [
      "English"
    ],
    "modalityRaw": "Training toolkits and packages",
    "modality": "toolkit",
    "platform": "HSLP",
    "link": "https://extranet.who.int/hslp/gllp",
    "comment": "",
    "signoffStatus": "",
    "normalizedLink": "https://extranet.who.int/hslp/gllp",
    "searchText": "global laboratory leadership programme learning package | foster and mentor current and emerging laboratory leaders to build, strengthen, and sustain national laboratory systems. access to full course materails is made available only on request | laboratory | laboratory leadership | public health institutions (schools of medicine, public health, etc.), ministries and other organizations | who | hq/whe |  | english | hslp | https://extranet.who.int/hslp/gllp"
  },
  {
    "id": "6b4577b2ec2cc2dcb2cf0972",
    "sourceRow": 123,
    "learningName": "Go.Data: Building additional dashboards in Power BI",
    "description": "The course covers essential aspects of the creation of customized dashboards in Power BI using the data collected in Go.Data, including how to connect Go.Data to Power BI, how to generate custom dashboards and reports, and how to publish and share the created dashboard with our colleagues or the public.",
    "technicalArea": "Surveillance",
    "focusArea": "Power BI",
    "intendedAudience": "Member states/ MoH/WHO staff",
    "owner": "WHO",
    "developer": "HQ/WHE/GOARN",
    "contactDetails": "goarn@who.int",
    "languages": [
      "English"
    ],
    "modalityRaw": "Online",
    "modality": "online",
    "platform": "OpenWHO",
    "link": "https://openwho.org/playlist/dedicated/502240/0_rwrsmdul/0_6fjycl0h",
    "comment": "",
    "signoffStatus": "",
    "normalizedLink": "https://openwho.org/playlist/dedicated/502240/0_rwrsmdul/0_6fjycl0h",
    "searchText": "go.data: building additional dashboards in power bi | the course covers essential aspects of the creation of customized dashboards in power bi using the data collected in go.data, including how to connect go.data to power bi, how to generate custom dashboards and reports, and how to publish and share the created dashboard with our colleagues or the public. | surveillance | power bi | member states/ moh/who staff | who | hq/whe/goarn | goarn@who.int | english | openwho | https://openwho.org/playlist/dedicated/502240/0_rwrsmdul/0_6fjycl0h"
  },
  {
    "id": "5b2c752a25fe9dda529f4313",
    "sourceRow": 124,
    "learningName": "GOARN Outbreak Response Leadership Training",
    "description": "This programme has been designed to build the individual and collective leadership and crisis management skills of highly experienced outbreak responders to act as influential and trusted leaders during public health emergencies. This course also aims to capacitate senior GOARN deployees with the ability to adapt and apply these leadership and crisis management skills into any kind of public health emergency response and structure.",
    "technicalArea": "Leadership",
    "focusArea": "Outbreak Response; Leadership",
    "intendedAudience": "GOARN Partners; MoH; Local Responders",
    "owner": "WHO",
    "developer": "HQ/WHE/GOARN",
    "contactDetails": "goarn@who.int",
    "languages": [
      "English"
    ],
    "modalityRaw": "Blended",
    "modality": "blended",
    "platform": "GOARN",
    "link": "https://goarn.who.int/handbook",
    "comment": "",
    "signoffStatus": "",
    "normalizedLink": "https://goarn.who.int/handbook",
    "searchText": "goarn outbreak response leadership training | this programme has been designed to build the individual and collective leadership and crisis management skills of highly experienced outbreak responders to act as influential and trusted leaders during public health emergencies. this course also aims to capacitate senior goarn deployees with the ability to adapt and apply these leadership and crisis management skills into any kind of public health emergency response and structure. | leadership | outbreak response; leadership | goarn partners; moh; local responders | who | hq/whe/goarn | goarn@who.int | english | goarn | https://goarn.who.int/handbook"
  },
  {
    "id": "af07152905b7c8a40c02912c",
    "sourceRow": 125,
    "learningName": "GOARN Outbreak Response Scenario Training",
    "description": "The GOARN Outbreak Response Scenario Training is a unique adaptation training designed to orient multidisciplinary GOARN deployees to the processes, realities and challenges of working as part of an international outbreak response team. This training provides a safe space for public health experts of various specialties to build and test their skills, behaviours and attitudes as they work in an international multidisciplinary team in which they must apply their existing technical skills in a new, challenging and dynamic environment in order to effectively solve an evolving outbreak of unknown etiology. This training focuses on the development and assessment of the soft skill behavioural indicators of the GOARN core competencies for working effectively in an international multidisciplinary outbreak response teams.",
    "technicalArea": "Health emergency preparedness and response management",
    "focusArea": "Outbreak Response; Team work",
    "intendedAudience": "GOARN Partners; MoH; Local Responders",
    "owner": "WHO",
    "developer": "HQ/WHE/GOARN",
    "contactDetails": "goarn@who.int",
    "languages": [
      "English"
    ],
    "modalityRaw": "In-person",
    "modality": "in_person",
    "platform": "GOARN",
    "link": "https://goarn.who.int/handbook/annex9",
    "comment": "",
    "signoffStatus": "",
    "normalizedLink": "https://goarn.who.int/handbook/annex9",
    "searchText": "goarn outbreak response scenario training | the goarn outbreak response scenario training is a unique adaptation training designed to orient multidisciplinary goarn deployees to the processes, realities and challenges of working as part of an international outbreak response team. this training provides a safe space for public health experts of various specialties to build and test their skills, behaviours and attitudes as they work in an international multidisciplinary team in which they must apply their existing technical skills in a new, challenging and dynamic environment in order to effectively solve an evolving outbreak of unknown etiology. this training focuses on the development and assessment of the soft skill behavioural indicators of the goarn core competencies for working effectively in an international multidisciplinary outbreak response teams. | health emergency preparedness and response management | outbreak response; team work | goarn partners; moh; local responders | who | hq/whe/goarn | goarn@who.int | english | goarn | https://goarn.who.int/handbook/annex9"
  },
  {
    "id": "760b2597e5a4fff5478f3d52",
    "sourceRow": 126,
    "learningName": "Infection prevention and control for COVID-19 in health care and community settings",
    "description": "Provide information on what facilities should be doing to be prepared to respond to a case of an emerging respiratory virus such as the novel coronavirus, how to identify a case once it occurs, and how to properly implement IPC measures to ensure there is no further transmission to HCW or to other patients and others in the healthcare facility.",
    "technicalArea": "Infection prevention and control (IPC) & safe environment in health facilities",
    "focusArea": "COVID-19",
    "intendedAudience": "WHO staff/MoH/HCPs",
    "owner": "WHO",
    "developer": "HQ/WHE",
    "contactDetails": "WHEtraining@who.int",
    "languages": [
      "English"
    ],
    "modalityRaw": "Online",
    "modality": "online",
    "platform": "OpenWHO",
    "link": "https://openwho.org/playlist/dedicated/521973/0_h5hxtqyg/0_j4iv6bgk",
    "comment": "",
    "signoffStatus": "",
    "normalizedLink": "https://openwho.org/playlist/dedicated/521973/0_h5hxtqyg/0_j4iv6bgk",
    "searchText": "infection prevention and control for covid-19 in health care and community settings | provide information on what facilities should be doing to be prepared to respond to a case of an emerging respiratory virus such as the novel coronavirus, how to identify a case once it occurs, and how to properly implement ipc measures to ensure there is no further transmission to hcw or to other patients and others in the healthcare facility. | infection prevention and control (ipc) & safe environment in health facilities | covid-19 | who staff/moh/hcps | who | hq/whe | whetraining@who.int | english | openwho | https://openwho.org/playlist/dedicated/521973/0_h5hxtqyg/0_j4iv6bgk"
  },
  {
    "id": "83dfa0ef49ee26c13fc2324e",
    "sourceRow": 127,
    "learningName": "Influenza prevention and control",
    "description": "Overview of the tools to prevent and control influenza",
    "technicalArea": "Health services provision",
    "focusArea": "Influenza",
    "intendedAudience": "WHO staff/MoH/HCPs",
    "owner": "WHO",
    "developer": "HQ/WHE",
    "contactDetails": "WHEtraining@who.int",
    "languages": [
      "Arabic",
      "Albanian",
      "Chinese",
      "English",
      "French",
      "Portuguese",
      "Spanish",
      "Russian"
    ],
    "modalityRaw": "Online",
    "modality": "online",
    "platform": "OpenWHO",
    "link": "https://openwho.org/playlist/dedicated/501679/0_xor51fug/0_jbf659cx",
    "comment": "",
    "signoffStatus": "",
    "normalizedLink": "https://openwho.org/playlist/dedicated/501679/0_xor51fug/0_jbf659cx",
    "searchText": "influenza prevention and control | overview of the tools to prevent and control influenza | health services provision | influenza | who staff/moh/hcps | who | hq/whe | whetraining@who.int | arabic, albanian, chinese, english, french, portuguese, spanish, russian | openwho | https://openwho.org/playlist/dedicated/501679/0_xor51fug/0_jbf659cx"
  },
  {
    "id": "548370b5e26eadccefd35d50",
    "sourceRow": 128,
    "learningName": "PHEOC intermediate and advanced courses",
    "description": "PHEOC_net courses for supporting MS PHEOC capacity stregthening",
    "technicalArea": "Health emergency preparedness and response management",
    "focusArea": "PHEOC",
    "intendedAudience": "MS PHEOC Staff",
    "owner": "WHO / CDC",
    "developer": "HQ/WHE",
    "contactDetails": "",
    "languages": [
      "English"
    ],
    "modalityRaw": "In-person",
    "modality": "in_person",
    "platform": "",
    "link": "",
    "comment": "",
    "signoffStatus": "",
    "normalizedLink": "",
    "searchText": "pheoc intermediate and advanced courses | pheoc_net courses for supporting ms pheoc capacity stregthening | health emergency preparedness and response management | pheoc | ms pheoc staff | who / cdc | hq/whe |  | english |  | "
  },
  {
    "id": "997bc1616bcbd41e05e90043",
    "sourceRow": 129,
    "learningName": "Simulation Exercise Management: Introduction",
    "description": "This course is an introduction to simulation exercises and their value as part of wider emergency preparedness to raise awareness among a non-technical audience. The goal of this course is to support the development and management of an effective fit-for-purpose exercise programme, by providing consistent practical guidance and tools on exercise design and implementation.",
    "technicalArea": "Research & monitoring and evaluation",
    "focusArea": "Simulation",
    "intendedAudience": "Member states/ MoH/WHO staff",
    "owner": "WHO",
    "developer": "HQ/WHE/HSP",
    "contactDetails": "WHEtraining@who.int",
    "languages": [
      "English"
    ],
    "modalityRaw": "Online",
    "modality": "online",
    "platform": "OpenWHO",
    "link": "https://openwho.org/playlist/dedicated/500867/0_sz4szoxc/0_qkklla2u",
    "comment": "",
    "signoffStatus": "",
    "normalizedLink": "https://openwho.org/playlist/dedicated/500867/0_sz4szoxc/0_qkklla2u",
    "searchText": "simulation exercise management: introduction | this course is an introduction to simulation exercises and their value as part of wider emergency preparedness to raise awareness among a non-technical audience. the goal of this course is to support the development and management of an effective fit-for-purpose exercise programme, by providing consistent practical guidance and tools on exercise design and implementation. | research & monitoring and evaluation | simulation | member states/ moh/who staff | who | hq/whe/hsp | whetraining@who.int | english | openwho | https://openwho.org/playlist/dedicated/500867/0_sz4szoxc/0_qkklla2u"
  },
  {
    "id": "659b14b93e298bf0fcfb8202",
    "sourceRow": 130,
    "learningName": "Six steps for sustainable implementation of national action plans on antimicrobial resistance",
    "description": "The aim of this course is to provide information on the “WHO implementation handbook for national action plans on antimicrobial resistance: guidance for the human health sector” and the 6 steps for sustainable implementation of NAPs on AMR.",
    "technicalArea": "Health emergency preparedness and response management",
    "focusArea": "AMR",
    "intendedAudience": "National and subnational policy-makers responsible for prioritizing and leading AMR interventions in the human health sector",
    "owner": "WHO",
    "developer": "HQ/AMR",
    "contactDetails": "whoasupport@who.int",
    "languages": [
      "English",
      "French",
      "Spanish"
    ],
    "modalityRaw": "Online",
    "modality": "online",
    "platform": "WHO Academy",
    "link": "https://web-staging.lxp.academy.who.int/coursewares/course-v1:WHOAcademy-Hosted+H0042EN+H0042EN_Q4_2024?source=edX",
    "comment": "",
    "signoffStatus": "",
    "normalizedLink": "https://web-staging.lxp.academy.who.int/coursewares/course-v1:WHOAcademy-Hosted+H0042EN+H0042EN_Q4_2024?source=edX",
    "searchText": "six steps for sustainable implementation of national action plans on antimicrobial resistance | the aim of this course is to provide information on the “who implementation handbook for national action plans on antimicrobial resistance: guidance for the human health sector” and the 6 steps for sustainable implementation of naps on amr. | health emergency preparedness and response management | amr | national and subnational policy-makers responsible for prioritizing and leading amr interventions in the human health sector | who | hq/amr | whoasupport@who.int | english, french, spanish | who academy | https://web-staging.lxp.academy.who.int/coursewares/course-v1:whoacademy-hosted+h0042en+h0042en_q4_2024?source=edx"
  },
  {
    "id": "48861951438c31db703360e2",
    "sourceRow": 131,
    "learningName": "SocialNet: Empowering communities before, during, and after an infectious disease outbreak",
    "description": "The aim of this course is to provide an overview of operational concepts in relation to community engagement, risk communication, and the application of social science interventions. This course is designed for health emergency preparedness and response professionals, policy makers and partners.",
    "technicalArea": "Risk communication and community engagement (RCCE)",
    "focusArea": "RCCE",
    "intendedAudience": "Member states/ MoH/WHO staff",
    "owner": "WHO",
    "developer": "HQ/WHE",
    "contactDetails": "WHEtraining@who.int",
    "languages": [
      "Arabic",
      "Chinese",
      "English",
      "French",
      "Russian",
      "Spanish"
    ],
    "modalityRaw": "Online",
    "modality": "online",
    "platform": "OpenWHO",
    "link": "https://openwho.org/playlist/dedicated/501691/0_gu0eoh5o/0_udh6fa42",
    "comment": "",
    "signoffStatus": "",
    "normalizedLink": "https://openwho.org/playlist/dedicated/501691/0_gu0eoh5o/0_udh6fa42",
    "searchText": "socialnet: empowering communities before, during, and after an infectious disease outbreak | the aim of this course is to provide an overview of operational concepts in relation to community engagement, risk communication, and the application of social science interventions. this course is designed for health emergency preparedness and response professionals, policy makers and partners. | risk communication and community engagement (rcce) | rcce | member states/ moh/who staff | who | hq/whe | whetraining@who.int | arabic, chinese, english, french, russian, spanish | openwho | https://openwho.org/playlist/dedicated/501691/0_gu0eoh5o/0_udh6fa42"
  },
  {
    "id": "4138cb7967dc306a0c69043e",
    "sourceRow": 132,
    "learningName": "WHO Simulation Exercise Management Training",
    "description": "This course is designed to provide participants with a foundational understanding of Simulation Exercises (Simex) in the context of public health. It introduces the benefits of Simex as a valuable tool for strengthening emergency preparedness and response, particularly within the framework of WHO guidance. Participants will gain knowledge of key terminology, concepts, and principles outlined in the WHO Simex Manual, and explore the various phases of the Exercise Project Cycle—from planning to conduct and post-exercise review. By the end of the course, learners will be equipped to identify and select the most appropriate type of exercise based on specific objectives and apply their understanding to effectively support public health preparedness initiatives.",
    "technicalArea": "Research & monitoring and evaluation",
    "focusArea": "Simulation",
    "intendedAudience": "MoH/WHO",
    "owner": "WHO",
    "developer": "HQ/WHE/HSP",
    "contactDetails": "",
    "languages": [
      "English"
    ],
    "modalityRaw": "Online",
    "modality": "online",
    "platform": "iLearn",
    "link": "https://who.csod.com/ui/lms-learning-details/app/course/01ac7d5d-5d87-4c89-8fd0-99998c806a50",
    "comment": "",
    "signoffStatus": "",
    "normalizedLink": "https://who.csod.com/ui/lms-learning-details/app/course/01ac7d5d-5d87-4c89-8fd0-99998c806a50",
    "searchText": "who simulation exercise management training | this course is designed to provide participants with a foundational understanding of simulation exercises (simex) in the context of public health. it introduces the benefits of simex as a valuable tool for strengthening emergency preparedness and response, particularly within the framework of who guidance. participants will gain knowledge of key terminology, concepts, and principles outlined in the who simex manual, and explore the various phases of the exercise project cycle—from planning to conduct and post-exercise review. by the end of the course, learners will be equipped to identify and select the most appropriate type of exercise based on specific objectives and apply their understanding to effectively support public health preparedness initiatives. | research & monitoring and evaluation | simulation | moh/who | who | hq/whe/hsp |  | english | ilearn | https://who.csod.com/ui/lms-learning-details/app/course/01ac7d5d-5d87-4c89-8fd0-99998c806a50"
  },
  {
    "id": "c591480388870a91e87d7723",
    "sourceRow": 133,
    "learningName": "Introduction to the International Health Regulations Monitoring and Evaluation Framework",
    "description": "This course aims to equip participants with the knowledge and skills required to objectively monitor and evaluate the implementation of the IHR at country level and to prioritize actions for developing National Action Plans for Health Security (NAPHS) aimed to improve pandemic preparedness. * \"The training will need to be updated to align with the IHR amendments when they enter into force\"",
    "technicalArea": "Health emergency preparedness and response management",
    "focusArea": "IHR",
    "intendedAudience": "NFPs/WHO WHE staffs/MoH",
    "owner": "WHO",
    "developer": "WHO Academy",
    "contactDetails": "whoasupport@who.int",
    "languages": [
      "English"
    ],
    "modalityRaw": "Online",
    "modality": "online",
    "platform": "WHO Academy",
    "link": "https://web-staging.lxp.academy.who.int/coursewares/course-v1:WHOA+0093_IHRME_EN+2024?source=edX",
    "comment": "",
    "signoffStatus": "",
    "normalizedLink": "https://web-staging.lxp.academy.who.int/coursewares/course-v1:WHOA+0093_IHRME_EN+2024?source=edX",
    "searchText": "introduction to the international health regulations monitoring and evaluation framework | this course aims to equip participants with the knowledge and skills required to objectively monitor and evaluate the implementation of the ihr at country level and to prioritize actions for developing national action plans for health security (naphs) aimed to improve pandemic preparedness. * \"the training will need to be updated to align with the ihr amendments when they enter into force\" | health emergency preparedness and response management | ihr | nfps/who whe staffs/moh | who | who academy | whoasupport@who.int | english | who academy | https://web-staging.lxp.academy.who.int/coursewares/course-v1:whoa+0093_ihrme_en+2024?source=edx"
  },
  {
    "id": "1be0174ec391f61f14309908",
    "sourceRow": 134,
    "learningName": "Leadership and programme management in infection prevention and control module, Trainers guide",
    "description": "The Leadership and programme management in infection prevention and control (IPC) advanced training module is part of a package designed for advanced IPC focal persons working in low-resource settings. It is designed to support the implementation of the World Health Organization (WHO) Guidelines on core components of IPC programmes at the national and acute health care facility level as part of a multifaceted approach to capacity building.",
    "technicalArea": "Infection prevention and control (IPC) & safe environment in health facilities",
    "focusArea": "Leadership in IPC",
    "intendedAudience": "Senior leadership position in IPC at the national, sub-national and health facility level.",
    "owner": "WHO",
    "developer": "HQ/UHC/HIS/IPC",
    "contactDetails": "coutinhoa@who.int",
    "languages": [
      "English"
    ],
    "modalityRaw": "Training toolkits and packages",
    "modality": "toolkit",
    "platform": "",
    "link": "https://cdn.who.int/media/docs/default-source/integrated-health-services-(ihs)/core-components/trainer-guide.pdf?sfvrsn=aa7f38b1_4&download=true",
    "comment": "Link for power point slides - https://www.who.int/publications/m/item/ipc-training-leadership-and-programme-management-in-infection-prevention-and-control-module-presentation; Link to the student handbook",
    "signoffStatus": "",
    "normalizedLink": "https://cdn.who.int/media/docs/default-source/integrated-health-services-(ihs)/core-components/trainer-guide.pdf?sfvrsn=aa7f38b1_4&download=true",
    "searchText": "leadership and programme management in infection prevention and control module, trainers guide | the leadership and programme management in infection prevention and control (ipc) advanced training module is part of a package designed for advanced ipc focal persons working in low-resource settings. it is designed to support the implementation of the world health organization (who) guidelines on core components of ipc programmes at the national and acute health care facility level as part of a multifaceted approach to capacity building. | infection prevention and control (ipc) & safe environment in health facilities | leadership in ipc | senior leadership position in ipc at the national, sub-national and health facility level. | who | hq/uhc/his/ipc | coutinhoa@who.int | english |  | https://cdn.who.int/media/docs/default-source/integrated-health-services-(ihs)/core-components/trainer-guide.pdf?sfvrsn=aa7f38b1_4&download=true"
  },
  {
    "id": "0b3b1463ca5cfa16ef361551",
    "sourceRow": 135,
    "learningName": "Infection prevention and control measures in health-care settings for Ebola or Marburg disease outbreaks",
    "description": "This course on IPC for Ebola and Marburg disease consists of four modules which will highlight the infection prevention and control recommendations as outlined in the WHO Infection prevention and control guideline for Ebola disease and Marburg disease (August 2023)",
    "technicalArea": "Infection prevention and control (IPC) & safe environment in health facilities",
    "focusArea": "Ebola and Marburg",
    "intendedAudience": "IPC leads and staffs in health care settings",
    "owner": "WHO",
    "developer": "HQ/WHE/IPC",
    "contactDetails": "WHEtraining@who.int",
    "languages": [
      "English"
    ],
    "modalityRaw": "Online",
    "modality": "online",
    "platform": "OpenWHO",
    "link": "https://openwho.org/playlist/dedicated/521973/0_qv81s96r/0_w6xwueg3",
    "comment": "",
    "signoffStatus": "",
    "normalizedLink": "https://openwho.org/playlist/dedicated/521973/0_qv81s96r/0_w6xwueg3",
    "searchText": "infection prevention and control measures in health-care settings for ebola or marburg disease outbreaks | this course on ipc for ebola and marburg disease consists of four modules which will highlight the infection prevention and control recommendations as outlined in the who infection prevention and control guideline for ebola disease and marburg disease (august 2023) | infection prevention and control (ipc) & safe environment in health facilities | ebola and marburg | ipc leads and staffs in health care settings | who | hq/whe/ipc | whetraining@who.int | english | openwho | https://openwho.org/playlist/dedicated/521973/0_qv81s96r/0_w6xwueg3"
  },
  {
    "id": "ecf6cfa34910de87bf4081ff",
    "sourceRow": 136,
    "learningName": "Prevention of surgical site infection (SSI) – December 2018 update",
    "description": "This course is designed to support implementation of the WHO global guidelines for the prevention of surgical site infection (SSI). It introduces recommended best practices and a multimodal approach for successful implementation and improvement. Trainees are expected to possess at least basic experience and competence in IPC to participate in this training.",
    "technicalArea": "Infection prevention and control (IPC) & safe environment in health facilities",
    "focusArea": "SSI",
    "intendedAudience": "IPC leads and staffs in health care settings",
    "owner": "WHO",
    "developer": "HQ/UHC/HIS/IPC",
    "contactDetails": "coutinhoa@who.int",
    "languages": [
      "English"
    ],
    "modalityRaw": "Training toolkits and packages",
    "modality": "toolkit",
    "platform": "Webpage",
    "link": "https://www.who.int/teams/integrated-health-services/infection-prevention-control/ipc-training-resources#ssi",
    "comment": "",
    "signoffStatus": "",
    "normalizedLink": "https://www.who.int/teams/integrated-health-services/infection-prevention-control/ipc-training-resources#ssi",
    "searchText": "prevention of surgical site infection (ssi) – december 2018 update | this course is designed to support implementation of the who global guidelines for the prevention of surgical site infection (ssi). it introduces recommended best practices and a multimodal approach for successful implementation and improvement. trainees are expected to possess at least basic experience and competence in ipc to participate in this training. | infection prevention and control (ipc) & safe environment in health facilities | ssi | ipc leads and staffs in health care settings | who | hq/uhc/his/ipc | coutinhoa@who.int | english | webpage | https://www.who.int/teams/integrated-health-services/infection-prevention-control/ipc-training-resources#ssi"
  },
  {
    "id": "6c6e42f42061327276d5ef64",
    "sourceRow": 137,
    "learningName": "Prevention of catheter-associated urinary tract infections (CAUTI)",
    "description": "The training on Prevention of Catheter-Associated Urinary Tract Infections (CAUTI) aims to enhance healthcare workers’ knowledge of CAUTI risk factors and evidence-based prevention strategies. It seeks to promote adherence to infection prevention and control (IPC) guidelines, including appropriate catheter use and maintenance.",
    "technicalArea": "Infection prevention and control (IPC) & safe environment in health facilities",
    "focusArea": "IPC",
    "intendedAudience": "IPC leads and staffs in health care settings",
    "owner": "WHO",
    "developer": "HQ/UHC/HIS/IPC",
    "contactDetails": "",
    "languages": [
      "English"
    ],
    "modalityRaw": "Training toolkits and packages",
    "modality": "toolkit",
    "platform": "Webpage",
    "link": "https://www.who.int/teams/integrated-health-services/infection-prevention-control/ipc-training-resources#CAUTI",
    "comment": "",
    "signoffStatus": "",
    "normalizedLink": "https://www.who.int/teams/integrated-health-services/infection-prevention-control/ipc-training-resources#CAUTI",
    "searchText": "prevention of catheter-associated urinary tract infections (cauti) | the training on prevention of catheter-associated urinary tract infections (cauti) aims to enhance healthcare workers’ knowledge of cauti risk factors and evidence-based prevention strategies. it seeks to promote adherence to infection prevention and control (ipc) guidelines, including appropriate catheter use and maintenance. | infection prevention and control (ipc) & safe environment in health facilities | ipc | ipc leads and staffs in health care settings | who | hq/uhc/his/ipc |  | english | webpage | https://www.who.int/teams/integrated-health-services/infection-prevention-control/ipc-training-resources#cauti"
  },
  {
    "id": "5199c74ad3996d03cf99fd46",
    "sourceRow": 138,
    "learningName": "Standard precautions: Injection safety and needle-stick injury management",
    "description": "In this course, you will learn about the causes of unsafe injection practices, how to safely give injections, and how to safely dispose of needles and other sharps. You will also learn what to do when needle-stick injuries occur, how to manage potential exposures, and ways to protect yourself, the staff and patients in your facility, and your community.",
    "technicalArea": "Infection prevention and control (IPC) & safe environment in health facilities",
    "focusArea": "Injection safety",
    "intendedAudience": "Healthcare professionals",
    "owner": "WHO",
    "developer": "HQ/UHC/HIS/IPC",
    "contactDetails": "",
    "languages": [
      "English"
    ],
    "modalityRaw": "Online",
    "modality": "online",
    "platform": "WHO Academy",
    "link": "https://whoacademy.org/coursewares/course-v1:WHOAcademy-Hosted+H0113EN+2025_Q1",
    "comment": "Training package is available here https://www.who.int/teams/integrated-health-services/infection-prevention-control/ipc-training-resources#injection%20safety",
    "signoffStatus": "",
    "normalizedLink": "https://whoacademy.org/coursewares/course-v1:WHOAcademy-Hosted+H0113EN+2025_Q1",
    "searchText": "standard precautions: injection safety and needle-stick injury management | in this course, you will learn about the causes of unsafe injection practices, how to safely give injections, and how to safely dispose of needles and other sharps. you will also learn what to do when needle-stick injuries occur, how to manage potential exposures, and ways to protect yourself, the staff and patients in your facility, and your community. | infection prevention and control (ipc) & safe environment in health facilities | injection safety | healthcare professionals | who | hq/uhc/his/ipc |  | english | who academy | https://whoacademy.org/coursewares/course-v1:whoacademy-hosted+h0113en+2025_q1"
  },
  {
    "id": "5dfbb5648caa3598281aabc1",
    "sourceRow": 139,
    "learningName": "IPC to combat AMR in health care settings: trainer guide",
    "description": "This course is designed to support implementation of the WHO guidelines on core components of infection prevention and control programmes at the national and acute health care facility level and guidelines for the prevention and control of carbapenem-resistant Enterobacteriaceae, Acinetobacter baumannii and Pseudomonas aeruginosa in health care facilities.It introduces recommended best practices and a multimodal approach for successful implementation and improvement.",
    "technicalArea": "Infection prevention and control (IPC) & safe environment in health facilities",
    "focusArea": "AMR",
    "intendedAudience": "IPC leads and staffs in health care settings",
    "owner": "WHO",
    "developer": "HQ/UHC/HIS/IPC",
    "contactDetails": "coutinhoa@who.int",
    "languages": [
      "English"
    ],
    "modalityRaw": "Training toolkits and packages",
    "modality": "toolkit",
    "platform": "Webpage",
    "link": "https://www.who.int/teams/integrated-health-services/infection-prevention-control/ipc-and-antimicrobial-resistance",
    "comment": "",
    "signoffStatus": "",
    "normalizedLink": "https://www.who.int/teams/integrated-health-services/infection-prevention-control/ipc-and-antimicrobial-resistance",
    "searchText": "ipc to combat amr in health care settings: trainer guide | this course is designed to support implementation of the who guidelines on core components of infection prevention and control programmes at the national and acute health care facility level and guidelines for the prevention and control of carbapenem-resistant enterobacteriaceae, acinetobacter baumannii and pseudomonas aeruginosa in health care facilities.it introduces recommended best practices and a multimodal approach for successful implementation and improvement. | infection prevention and control (ipc) & safe environment in health facilities | amr | ipc leads and staffs in health care settings | who | hq/uhc/his/ipc | coutinhoa@who.int | english | webpage | https://www.who.int/teams/integrated-health-services/infection-prevention-control/ipc-and-antimicrobial-resistance"
  },
  {
    "id": "053c01cf1f033f3119a8a8aa",
    "sourceRow": 140,
    "learningName": "Clinical management of respiratory diphtheria",
    "description": "This course is for clinicians that will be or are caring for patients with respiratory diphtheria during outbreaks in vulnerable settings",
    "technicalArea": "Infection prevention and control (IPC) & safe environment in health facilities",
    "focusArea": "IPC",
    "intendedAudience": "WHO staff/MoH/HCPs",
    "owner": "WHO",
    "developer": "HQ/WHE/IPC",
    "contactDetails": "WHEtraining@who.int",
    "languages": [
      "English"
    ],
    "modalityRaw": "Online",
    "modality": "online",
    "platform": "OpenWHO",
    "link": "https://openwho.org/media/Diphtheria%20Module%204%3A%20Infection%20Prevention%20and%20Control%20(IPC)/0_jqyyet8x/536512",
    "comment": "",
    "signoffStatus": "",
    "normalizedLink": "https://openwho.org/media/Diphtheria%20Module%204%3A%20Infection%20Prevention%20and%20Control%20(IPC)/0_jqyyet8x/536512",
    "searchText": "clinical management of respiratory diphtheria | this course is for clinicians that will be or are caring for patients with respiratory diphtheria during outbreaks in vulnerable settings | infection prevention and control (ipc) & safe environment in health facilities | ipc | who staff/moh/hcps | who | hq/whe/ipc | whetraining@who.int | english | openwho | https://openwho.org/media/diphtheria%20module%204%3a%20infection%20prevention%20and%20control%20(ipc)/0_jqyyet8x/536512"
  },
  {
    "id": "b3f9c53c6606b2b949669fe5",
    "sourceRow": 141,
    "learningName": "Measles outbreak training",
    "description": "All health workers deployed to measles outbreaks must complete the measles and rubella (MR) training to implement quality interventions and work safely and effectively in the field. This course provides the essential preparedness, detection, investigation, response, and recovery skills required to contain the measles outbreak.",
    "technicalArea": "Health emergency preparedness and response management",
    "focusArea": "Measles",
    "intendedAudience": "WHO staff/MoH/HCPs",
    "owner": "WHO",
    "developer": "HQ/WHE",
    "contactDetails": "WHEtraining@who.int",
    "languages": [
      "English",
      "Spanish",
      "Ukrainian"
    ],
    "modalityRaw": "Online",
    "modality": "online",
    "platform": "OpenWHO",
    "link": "https://openwho.org/playlist/dedicated/542027/0_ad0vqtxk/0_mzwkn3v5",
    "comment": "",
    "signoffStatus": "",
    "normalizedLink": "https://openwho.org/playlist/dedicated/542027/0_ad0vqtxk/0_mzwkn3v5",
    "searchText": "measles outbreak training | all health workers deployed to measles outbreaks must complete the measles and rubella (mr) training to implement quality interventions and work safely and effectively in the field. this course provides the essential preparedness, detection, investigation, response, and recovery skills required to contain the measles outbreak. | health emergency preparedness and response management | measles | who staff/moh/hcps | who | hq/whe | whetraining@who.int | english, spanish, ukrainian | openwho | https://openwho.org/playlist/dedicated/542027/0_ad0vqtxk/0_mzwkn3v5"
  },
  {
    "id": "21428b2e3eefe4e15a7114e0",
    "sourceRow": 142,
    "learningName": "Water and Sanitation for Health Facility Improvement Tool (WASH FIT) for improved quality of care",
    "description": "The WHO/UNICEF Water and Sanitation for Health Facility Improvement Tool (WASH FIT) helps facilities to assess, manage and improve these critical services. This course covers the foundational concepts of WASH FIT, the methodology and examples of its application from a wide range of settings. It also includes six technical modules on water, sanitation, hand hygiene, health care waste, environmental cleaning and gender equality, disability and social inclusion (GEDSI).",
    "technicalArea": "Health emergency preparedness and response management",
    "focusArea": "WASH",
    "intendedAudience": "National Health and WASH Sector Leaders/Local and District Health Authorities/Health Facility Managers and Staff",
    "owner": "WHO/UNICEF",
    "developer": "HQ/HEP/ECH/WSH",
    "contactDetails": "whoasupport@who.int",
    "languages": [
      "English"
    ],
    "modalityRaw": "Online",
    "modality": "online",
    "platform": "WHO Academy",
    "link": "https://whoacademy.org/coursewares/course-v1:WHOAcademy-Hosted+H0046EN+H0046EN_Q4_2024?from=discovery&source=edX",
    "comment": "",
    "signoffStatus": "",
    "normalizedLink": "https://whoacademy.org/coursewares/course-v1:WHOAcademy-Hosted+H0046EN+H0046EN_Q4_2024?from=discovery&source=edX",
    "searchText": "water and sanitation for health facility improvement tool (wash fit) for improved quality of care | the who/unicef water and sanitation for health facility improvement tool (wash fit) helps facilities to assess, manage and improve these critical services. this course covers the foundational concepts of wash fit, the methodology and examples of its application from a wide range of settings. it also includes six technical modules on water, sanitation, hand hygiene, health care waste, environmental cleaning and gender equality, disability and social inclusion (gedsi). | health emergency preparedness and response management | wash | national health and wash sector leaders/local and district health authorities/health facility managers and staff | who/unicef | hq/hep/ech/wsh | whoasupport@who.int | english | who academy | https://whoacademy.org/coursewares/course-v1:whoacademy-hosted+h0046en+h0046en_q4_2024?from=discovery&source=edx"
  },
  {
    "id": "c89bb22a4f818c07b6f107ac",
    "sourceRow": 143,
    "learningName": "My Five Moments of Hands Hygiene",
    "description": "Play an ‘out-of-this world’ game with a serious objective: to prevent healthcare-associated infections. The game, developed in collaboration with the WHO Infection Prevention and Control Hub as part of WHO’s ‘Healthcare without avoidable infections’ initiative, is based on the WHO Guidelines on Hand Hygiene in Health Care and aims to target two infectious outcomes – microbial cross-transmission and healthcare-associated infections.",
    "technicalArea": "Infection prevention and control (IPC) & safe environment in health facilities",
    "focusArea": "IPC",
    "intendedAudience": "Clinical health professionals/Students in healthcare education",
    "owner": "WHO",
    "developer": "HQ/UHC/HIS/IPC",
    "contactDetails": "whoasupport@who.int",
    "languages": [
      "English"
    ],
    "modalityRaw": "Online",
    "modality": "online",
    "platform": "WHO Academy",
    "link": "https://whoacademy.org/coursewares/course-v1:WHOA+0018_MFM_EN+2022?from=discovery&source=edX",
    "comment": "",
    "signoffStatus": "",
    "normalizedLink": "https://whoacademy.org/coursewares/course-v1:WHOA+0018_MFM_EN+2022?from=discovery&source=edX",
    "searchText": "my five moments of hands hygiene | play an ‘out-of-this world’ game with a serious objective: to prevent healthcare-associated infections. the game, developed in collaboration with the who infection prevention and control hub as part of who’s ‘healthcare without avoidable infections’ initiative, is based on the who guidelines on hand hygiene in health care and aims to target two infectious outcomes – microbial cross-transmission and healthcare-associated infections. | infection prevention and control (ipc) & safe environment in health facilities | ipc | clinical health professionals/students in healthcare education | who | hq/uhc/his/ipc | whoasupport@who.int | english | who academy | https://whoacademy.org/coursewares/course-v1:whoa+0018_mfm_en+2022?from=discovery&source=edx"
  },
  {
    "id": "54b064fe94eeeb25b63e824d",
    "sourceRow": 144,
    "learningName": "Antimicrobial Resistance in the environment: key concepts and interventions",
    "description": "The environmental dimensions of AMR are often neglected in national action plans and investments on AMR. In this course, you will learn why addressing AMR in the environment is essential and gain insights into how action can be taken to prevent and control AMR in the environment at the national level.",
    "technicalArea": "Health emergency preparedness and response management",
    "focusArea": "AMR",
    "intendedAudience": "WHO staff/MoH/HCPs",
    "owner": "WHO",
    "developer": "HQ/AMR",
    "contactDetails": "whoasupport@who.int",
    "languages": [
      "English"
    ],
    "modalityRaw": "Online",
    "modality": "online",
    "platform": "WHO Academy",
    "link": "https://whoacademy.org/coursewares/course-v1:WHOAcademy-Hosted+H0049EN+H0049EN_Q4_2024?from=discovery&source=edX",
    "comment": "",
    "signoffStatus": "",
    "normalizedLink": "https://whoacademy.org/coursewares/course-v1:WHOAcademy-Hosted+H0049EN+H0049EN_Q4_2024?from=discovery&source=edX",
    "searchText": "antimicrobial resistance in the environment: key concepts and interventions | the environmental dimensions of amr are often neglected in national action plans and investments on amr. in this course, you will learn why addressing amr in the environment is essential and gain insights into how action can be taken to prevent and control amr in the environment at the national level. | health emergency preparedness and response management | amr | who staff/moh/hcps | who | hq/amr | whoasupport@who.int | english | who academy | https://whoacademy.org/coursewares/course-v1:whoacademy-hosted+h0049en+h0049en_q4_2024?from=discovery&source=edx"
  },
  {
    "id": "7afd1cbb003a6eaccfc48879",
    "sourceRow": 145,
    "learningName": "Standard precautions: Waste management",
    "description": "In this course, you will learn about the different categories of waste and the process for waste management. Health care waste includes all waste generated by health, research and laboratory facilities in the course of providing health care services. Health care waste in a facility should be managed from point of generation to final disposal and removal.",
    "technicalArea": "Infection prevention and control (IPC) & safe environment in health facilities",
    "focusArea": "Waste management",
    "intendedAudience": "Healthcare professionals",
    "owner": "WHO",
    "developer": "HQ/UHC/HIS/IPC",
    "contactDetails": "whoasupport@who.int",
    "languages": [
      "English"
    ],
    "modalityRaw": "Online",
    "modality": "online",
    "platform": "WHO Academy",
    "link": "https://whoacademy.org/coursewares/course-v1:WHOAcademy-Hosted+H0109EN+2025_Q1?source=edX",
    "comment": "",
    "signoffStatus": "",
    "normalizedLink": "https://whoacademy.org/coursewares/course-v1:WHOAcademy-Hosted+H0109EN+2025_Q1?source=edX",
    "searchText": "standard precautions: waste management | in this course, you will learn about the different categories of waste and the process for waste management. health care waste includes all waste generated by health, research and laboratory facilities in the course of providing health care services. health care waste in a facility should be managed from point of generation to final disposal and removal. | infection prevention and control (ipc) & safe environment in health facilities | waste management | healthcare professionals | who | hq/uhc/his/ipc | whoasupport@who.int | english | who academy | https://whoacademy.org/coursewares/course-v1:whoacademy-hosted+h0109en+2025_q1?source=edx"
  },
  {
    "id": "fc167fb677d0fc1ff4fad04e",
    "sourceRow": 146,
    "learningName": "Standard precautions: Hand hygiene",
    "description": "This course has been prepared to help summarize the WHO guidelines on hand hygiene, associated tools and ideas for effective implementation.",
    "technicalArea": "Infection prevention and control (IPC) & safe environment in health facilities",
    "focusArea": "IPC",
    "intendedAudience": "Healthcare professionals",
    "owner": "WHO",
    "developer": "HQ/UHC/HIS/IPC",
    "contactDetails": "whoasupport@who.int",
    "languages": [
      "English"
    ],
    "modalityRaw": "Online",
    "modality": "online",
    "platform": "WHO Academy",
    "link": "https://whoacademy.org/coursewares/course-v1:WHOAcademy-Hosted+H0108EN+2025_Q1?source=edX",
    "comment": "",
    "signoffStatus": "",
    "normalizedLink": "https://whoacademy.org/coursewares/course-v1:WHOAcademy-Hosted+H0108EN+2025_Q1?source=edX",
    "searchText": "standard precautions: hand hygiene | this course has been prepared to help summarize the who guidelines on hand hygiene, associated tools and ideas for effective implementation. | infection prevention and control (ipc) & safe environment in health facilities | ipc | healthcare professionals | who | hq/uhc/his/ipc | whoasupport@who.int | english | who academy | https://whoacademy.org/coursewares/course-v1:whoacademy-hosted+h0108en+2025_q1?source=edx"
  },
  {
    "id": "1ea8772ce1a4466ef02045b3",
    "sourceRow": 147,
    "learningName": "Decontamination and sterilization of medical devices",
    "description": "The processes of sterilization and decontamination are complex, requiring specific infrastructure, equipment and process. In this course, which is divided into two parts, you will learn about the overall procedure for managing decontamination and sterilization of medical devices.",
    "technicalArea": "Infection prevention and control (IPC) & safe environment in health facilities",
    "focusArea": "IPC",
    "intendedAudience": "Healthcare professionals",
    "owner": "WHO",
    "developer": "HQ/UHC/HIS/IPC",
    "contactDetails": "whoasupport@who.int",
    "languages": [
      "English"
    ],
    "modalityRaw": "Online",
    "modality": "online",
    "platform": "WHO Academy",
    "link": "https://whoacademy.org/coursewares/course-v1:WHOAcademy-Hosted+H0110EN+2025_Q1",
    "comment": "",
    "signoffStatus": "",
    "normalizedLink": "https://whoacademy.org/coursewares/course-v1:WHOAcademy-Hosted+H0110EN+2025_Q1",
    "searchText": "decontamination and sterilization of medical devices | the processes of sterilization and decontamination are complex, requiring specific infrastructure, equipment and process. in this course, which is divided into two parts, you will learn about the overall procedure for managing decontamination and sterilization of medical devices. | infection prevention and control (ipc) & safe environment in health facilities | ipc | healthcare professionals | who | hq/uhc/his/ipc | whoasupport@who.int | english | who academy | https://whoacademy.org/coursewares/course-v1:whoacademy-hosted+h0110en+2025_q1"
  },
  {
    "id": "a644bce75b95c8bdd38a7f0d",
    "sourceRow": 148,
    "learningName": "Transmission-based Precautions",
    "description": "This course will cover the main modes of transmission, what precautions can be used stop their spread and what personal protective equipment is required when caring for patients under Transmission-based Precautions. Transmission-based Precautions are additional measures we can use in health care to help keep both staff and patients safe.",
    "technicalArea": "Infection prevention and control (IPC) & safe environment in health facilities",
    "focusArea": "IPC",
    "intendedAudience": "Healthcare professionals",
    "owner": "WHO",
    "developer": "HQ/UHC/HIS/IPC",
    "contactDetails": "whoasupport@who.int",
    "languages": [
      "English"
    ],
    "modalityRaw": "Online",
    "modality": "online",
    "platform": "WHO Academy",
    "link": "https://whoacademy.org/coursewares/course-v1:WHOAcademy-Hosted+H0114EN+2025_Q1",
    "comment": "",
    "signoffStatus": "",
    "normalizedLink": "https://whoacademy.org/coursewares/course-v1:WHOAcademy-Hosted+H0114EN+2025_Q1",
    "searchText": "transmission-based precautions | this course will cover the main modes of transmission, what precautions can be used stop their spread and what personal protective equipment is required when caring for patients under transmission-based precautions. transmission-based precautions are additional measures we can use in health care to help keep both staff and patients safe. | infection prevention and control (ipc) & safe environment in health facilities | ipc | healthcare professionals | who | hq/uhc/his/ipc | whoasupport@who.int | english | who academy | https://whoacademy.org/coursewares/course-v1:whoacademy-hosted+h0114en+2025_q1"
  },
  {
    "id": "0cfd67207ec1f6be4f6f7693",
    "sourceRow": 149,
    "learningName": "Ready4Response Tier 3: Activation process",
    "description": "Tier 3 guides the learner through the activation process for the response. It aims to help MoH staff who will be working as part of a response, to build skills and reflect on the processes they use to build situational awareness and manage the response.",
    "technicalArea": "Health emergency preparedness and response management",
    "focusArea": "Emergency Response",
    "intendedAudience": "Member states/ MoH/WHO staff",
    "owner": "WHO",
    "developer": "HQ/WHE",
    "contactDetails": "WHEtraining@who.int",
    "languages": [
      "English"
    ],
    "modalityRaw": "Online",
    "modality": "online",
    "platform": "OpenWHO",
    "link": "https://openwho.org/playlist/dedicated/494536/0_aylkqv61/0_o9y26qzb",
    "comment": "",
    "signoffStatus": "",
    "normalizedLink": "https://openwho.org/playlist/dedicated/494536/0_aylkqv61/0_o9y26qzb",
    "searchText": "ready4response tier 3: activation process | tier 3 guides the learner through the activation process for the response. it aims to help moh staff who will be working as part of a response, to build skills and reflect on the processes they use to build situational awareness and manage the response. | health emergency preparedness and response management | emergency response | member states/ moh/who staff | who | hq/whe | whetraining@who.int | english | openwho | https://openwho.org/playlist/dedicated/494536/0_aylkqv61/0_o9y26qzb"
  },
  {
    "id": "ddccbab6e321a92143b7dbb6",
    "sourceRow": 150,
    "learningName": "Infection Prevention and Control in Maternal and Neonatal Care",
    "description": "The course is divided into 6 modules. The first module covers the essential knowledge of standard precautions required for good infection prevention and control. The other five modules develop this knowledge and apply it clinically to common situations in antenatal care, labour, childbirth and neonatal care.",
    "technicalArea": "Infection prevention and control (IPC) & safe environment in health facilities",
    "focusArea": "IPC",
    "intendedAudience": "Staff working in maternal and neonatal wards",
    "owner": "WHO",
    "developer": "HQ/UHC/HIS/IPC",
    "contactDetails": "whoasupport@who.int",
    "languages": [
      "English"
    ],
    "modalityRaw": "Online",
    "modality": "online",
    "platform": "WHO Academy",
    "link": "https://whoacademy.org/coursewares/course-v1:WHOAcademy-Hosted+H0100EN_Q4_2024+2024_Q4?from=discovery&source=edX",
    "comment": "",
    "signoffStatus": "",
    "normalizedLink": "https://whoacademy.org/coursewares/course-v1:WHOAcademy-Hosted+H0100EN_Q4_2024+2024_Q4?from=discovery&source=edX",
    "searchText": "infection prevention and control in maternal and neonatal care | the course is divided into 6 modules. the first module covers the essential knowledge of standard precautions required for good infection prevention and control. the other five modules develop this knowledge and apply it clinically to common situations in antenatal care, labour, childbirth and neonatal care. | infection prevention and control (ipc) & safe environment in health facilities | ipc | staff working in maternal and neonatal wards | who | hq/uhc/his/ipc | whoasupport@who.int | english | who academy | https://whoacademy.org/coursewares/course-v1:whoacademy-hosted+h0100en_q4_2024+2024_q4?from=discovery&source=edx"
  },
  {
    "id": "8cd0e3e0bbcc0b2f3b36abde",
    "sourceRow": 151,
    "learningName": "Prevention of vascular catheters-associated bloodstream infections",
    "description": "In this course, you will learn more about these specific types of infections, recommended best practices for insertion, maintenance, and removal and ways to achieve effective implementation for prevention.",
    "technicalArea": "Infection prevention and control (IPC) & safe environment in health facilities",
    "focusArea": "IPC",
    "intendedAudience": "Healthcare professionals",
    "owner": "WHO",
    "developer": "HQ/UHC/HIS/IPC",
    "contactDetails": "whoasupport@who.int",
    "languages": [
      "English"
    ],
    "modalityRaw": "Online",
    "modality": "online",
    "platform": "WHO Academy",
    "link": "https://whoacademy.org/coursewares/course-v1:WHOAcademy-Hosted+H0099EN+H0099EN_Q4_2024",
    "comment": "",
    "signoffStatus": "",
    "normalizedLink": "https://whoacademy.org/coursewares/course-v1:WHOAcademy-Hosted+H0099EN+H0099EN_Q4_2024",
    "searchText": "prevention of vascular catheters-associated bloodstream infections | in this course, you will learn more about these specific types of infections, recommended best practices for insertion, maintenance, and removal and ways to achieve effective implementation for prevention. | infection prevention and control (ipc) & safe environment in health facilities | ipc | healthcare professionals | who | hq/uhc/his/ipc | whoasupport@who.int | english | who academy | https://whoacademy.org/coursewares/course-v1:whoacademy-hosted+h0099en+h0099en_q4_2024"
  },
  {
    "id": "c957a51aa05cd0792b565358",
    "sourceRow": 152,
    "learningName": "Antimicrobial resistance and infection prevention and control",
    "description": "This course will equip clinicians who frequently prescribe antimicrobials with knowledge and tools to improve their use of these essential medications in daily clinical practice. Through case based examples, the course will highlight how antimicrobial stewardship principles can be applied to common clinical scenarios.",
    "technicalArea": "Infection prevention and control (IPC) & safe environment in health facilities",
    "focusArea": "IPC",
    "intendedAudience": "Clinicians",
    "owner": "WHO",
    "developer": "HQ/UHC/HIS/IPC",
    "contactDetails": "whoasupport@who.int",
    "languages": [
      "English"
    ],
    "modalityRaw": "Online",
    "modality": "online",
    "platform": "WHO Academy",
    "link": "https://whoacademy.org/coursewares/course-v1:WHOAcademy-Hosted+H0098EN+H0098EN_Q4_2024?from=discovery&source=edX",
    "comment": "",
    "signoffStatus": "",
    "normalizedLink": "https://whoacademy.org/coursewares/course-v1:WHOAcademy-Hosted+H0098EN+H0098EN_Q4_2024?from=discovery&source=edX",
    "searchText": "antimicrobial resistance and infection prevention and control | this course will equip clinicians who frequently prescribe antimicrobials with knowledge and tools to improve their use of these essential medications in daily clinical practice. through case based examples, the course will highlight how antimicrobial stewardship principles can be applied to common clinical scenarios. | infection prevention and control (ipc) & safe environment in health facilities | ipc | clinicians | who | hq/uhc/his/ipc | whoasupport@who.int | english | who academy | https://whoacademy.org/coursewares/course-v1:whoacademy-hosted+h0098en+h0098en_q4_2024?from=discovery&source=edx"
  },
  {
    "id": "097d386147fcb8f1c1737457",
    "sourceRow": 153,
    "learningName": "Public Health Emergency Operations Centre (PHEOC)",
    "description": "This online course is designed as a companion to WHO’s Framework for a Public Health Emergency Operations Centre and is aimed at health emergency preparedness and response professionals, policy makers and partners seeking to implement and sustain Public Health Emergency Operations Centres.",
    "technicalArea": "Health emergency preparedness and response management",
    "focusArea": "PHEOC",
    "intendedAudience": "WHO staff/MoH/",
    "owner": "WHO",
    "developer": "HQ/WHE/SHO",
    "contactDetails": "WHEtraining@who.int",
    "languages": [
      "Chinese",
      "English",
      "French",
      "Macedonian",
      "Portuguese",
      "Spanish",
      "Russian",
      "Ukrainian"
    ],
    "modalityRaw": "Online",
    "modality": "online",
    "platform": "OpenWHO",
    "link": "https://openwho.org/emergencymgmt/577192/Public+Health+Emergency+Operations+Centre",
    "comment": "",
    "signoffStatus": "",
    "normalizedLink": "https://openwho.org/emergencymgmt/577192/Public+Health+Emergency+Operations+Centre",
    "searchText": "public health emergency operations centre (pheoc) | this online course is designed as a companion to who’s framework for a public health emergency operations centre and is aimed at health emergency preparedness and response professionals, policy makers and partners seeking to implement and sustain public health emergency operations centres. | health emergency preparedness and response management | pheoc | who staff/moh/ | who | hq/whe/sho | whetraining@who.int | chinese, english, french, macedonian, portuguese, spanish, russian, ukrainian | openwho | https://openwho.org/emergencymgmt/577192/public+health+emergency+operations+centre"
  },
  {
    "id": "223ec8820eca0d027b4bc5af",
    "sourceRow": 154,
    "learningName": "Module 1: Introduction to vSHOC",
    "description": "This course provides an understanding of vSHOC and its relation to other WHO emergency management software. You will learn what information vSHOC contains and become familiar with its use, including accessing basic operational response information, recording and assigning tasks, creating or updating a focal points list, updating your contact profile, and managing emergency-related documents.",
    "technicalArea": "Health emergency preparedness and response management",
    "focusArea": "vSHOC",
    "intendedAudience": "WHO staff/MoH",
    "owner": "WHO",
    "developer": "HQ/WHE/SHO",
    "contactDetails": "",
    "languages": [
      "English"
    ],
    "modalityRaw": "Online",
    "modality": "online",
    "platform": "iLearn",
    "link": "https://who.csod.com/ui/lms-learning-details/app/course/4b567b8d-b6b8-4fd7-abdd-5365dab37ea2",
    "comment": "",
    "signoffStatus": "",
    "normalizedLink": "https://who.csod.com/ui/lms-learning-details/app/course/4b567b8d-b6b8-4fd7-abdd-5365dab37ea2",
    "searchText": "module 1: introduction to vshoc | this course provides an understanding of vshoc and its relation to other who emergency management software. you will learn what information vshoc contains and become familiar with its use, including accessing basic operational response information, recording and assigning tasks, creating or updating a focal points list, updating your contact profile, and managing emergency-related documents. | health emergency preparedness and response management | vshoc | who staff/moh | who | hq/whe/sho |  | english | ilearn | https://who.csod.com/ui/lms-learning-details/app/course/4b567b8d-b6b8-4fd7-abdd-5365dab37ea2"
  },
  {
    "id": "e2d81130783bafda40569875",
    "sourceRow": 155,
    "learningName": "Module 2: vSHOC Training for Advanced Users",
    "description": "This module is intended for advanced vSHOC users who have completed the basic training. This module will teach how to manage users, register an incident, manage reference data, add and manage data sets and map layers.",
    "technicalArea": "Health emergency preparedness and response management",
    "focusArea": "vSHOC",
    "intendedAudience": "WHO staff/MoH",
    "owner": "WHO",
    "developer": "HQ/WHE/SHO",
    "contactDetails": "",
    "languages": [
      "English"
    ],
    "modalityRaw": "Online",
    "modality": "online",
    "platform": "iLearn",
    "link": "https://who.csod.com/ui/lms-learning-details/app/course/3fec7503-ee30-4804-9d43-0d7db8ed4155",
    "comment": "",
    "signoffStatus": "",
    "normalizedLink": "https://who.csod.com/ui/lms-learning-details/app/course/3fec7503-ee30-4804-9d43-0d7db8ed4155",
    "searchText": "module 2: vshoc training for advanced users | this module is intended for advanced vshoc users who have completed the basic training. this module will teach how to manage users, register an incident, manage reference data, add and manage data sets and map layers. | health emergency preparedness and response management | vshoc | who staff/moh | who | hq/whe/sho |  | english | ilearn | https://who.csod.com/ui/lms-learning-details/app/course/3fec7503-ee30-4804-9d43-0d7db8ed4155"
  },
  {
    "id": "7b69ea5cc262dd8c7d0e7b8a",
    "sourceRow": 156,
    "learningName": "Module 3: vSHOC Emergency Human Resources",
    "description": "By the end of this training module, the trainee should be able to manage incident specific locations reference data, view and manage Human Resource Plans and manage incident specific functions and roles",
    "technicalArea": "Health emergency preparedness and response management",
    "focusArea": "vSHOC",
    "intendedAudience": "WHO staff/MoH",
    "owner": "WHO",
    "developer": "HQ/WHE/SHO",
    "contactDetails": "",
    "languages": [
      "English"
    ],
    "modalityRaw": "Online",
    "modality": "online",
    "platform": "iLearn",
    "link": "https://who.csod.com/ui/lms-learning-details/app/course/5a7d5d19-5427-4456-b009-6b93d2636cba",
    "comment": "",
    "signoffStatus": "",
    "normalizedLink": "https://who.csod.com/ui/lms-learning-details/app/course/5a7d5d19-5427-4456-b009-6b93d2636cba",
    "searchText": "module 3: vshoc emergency human resources | by the end of this training module, the trainee should be able to manage incident specific locations reference data, view and manage human resource plans and manage incident specific functions and roles | health emergency preparedness and response management | vshoc | who staff/moh | who | hq/whe/sho |  | english | ilearn | https://who.csod.com/ui/lms-learning-details/app/course/5a7d5d19-5427-4456-b009-6b93d2636cba"
  },
  {
    "id": "0ba885172064ed8cec51890d",
    "sourceRow": 157,
    "learningName": "Introduction to Event Management System (EMS)",
    "description": "This training module is intended for WHO staff who need to use the Event Management System (EMS) in their work. It provides an overview of the EMS. The module is mandatory to take and pass in order to get an access to the EMS platform.",
    "technicalArea": "Health emergency preparedness and response management",
    "focusArea": "Event management system",
    "intendedAudience": "WHO staff",
    "owner": "WHO",
    "developer": "HQ/WHE/SHO",
    "contactDetails": "",
    "languages": [
      "English"
    ],
    "modalityRaw": "Online",
    "modality": "online",
    "platform": "iLearn",
    "link": "https://who.csod.com/ui/lms-learning-details/app/course/e5194f52-4d3f-4e71-9e86-26b788709135",
    "comment": "",
    "signoffStatus": "",
    "normalizedLink": "https://who.csod.com/ui/lms-learning-details/app/course/e5194f52-4d3f-4e71-9e86-26b788709135",
    "searchText": "introduction to event management system (ems) | this training module is intended for who staff who need to use the event management system (ems) in their work. it provides an overview of the ems. the module is mandatory to take and pass in order to get an access to the ems platform. | health emergency preparedness and response management | event management system | who staff | who | hq/whe/sho |  | english | ilearn | https://who.csod.com/ui/lms-learning-details/app/course/e5194f52-4d3f-4e71-9e86-26b788709135"
  },
  {
    "id": "ae814c863d9b43141a888c09",
    "sourceRow": 158,
    "learningName": "Data procedures in Event Management System (EMS)",
    "description": "This training module is intended for WHO staff that will be using the Event Management System (EMS) for data entry and updating. To perform these activities in the EMS it is mandatory to take and pass this module. Prior to taking this module you must pass the prerequisite training “Introduction to EMS”",
    "technicalArea": "Health emergency preparedness and response management",
    "focusArea": "Event management system",
    "intendedAudience": "WHO staff",
    "owner": "WHO",
    "developer": "HQ/WHE/SHO",
    "contactDetails": "",
    "languages": [
      "English"
    ],
    "modalityRaw": "Online",
    "modality": "online",
    "platform": "iLearn",
    "link": "https://who.csod.com/ui/lms-learning-details/app/course/3475ee5f-244e-438f-98d1-b1d5644e4800",
    "comment": "",
    "signoffStatus": "",
    "normalizedLink": "https://who.csod.com/ui/lms-learning-details/app/course/3475ee5f-244e-438f-98d1-b1d5644e4800",
    "searchText": "data procedures in event management system (ems) | this training module is intended for who staff that will be using the event management system (ems) for data entry and updating. to perform these activities in the ems it is mandatory to take and pass this module. prior to taking this module you must pass the prerequisite training “introduction to ems” | health emergency preparedness and response management | event management system | who staff | who | hq/whe/sho |  | english | ilearn | https://who.csod.com/ui/lms-learning-details/app/course/3475ee5f-244e-438f-98d1-b1d5644e4800"
  },
  {
    "id": "12b69b2670df5f1a4b831958",
    "sourceRow": 159,
    "learningName": "EWARS in a box: electronic early warning, alert and response system implementation in emergencies",
    "description": "EWARS in a box, WHO's electronic early warning, alert, and response system in emergencies, helps detect disease outbreaks early in emergency, fragile, conflict and vulnerable settings. It supports real-time mobile reporting from the most difficult and remote field settings with or without reliable internet or electricity. The web interface helps local epidemiologists and surveillance officers with interactive alert management, data analysis and visualization.",
    "technicalArea": "Surveillance",
    "focusArea": "EWARS",
    "intendedAudience": "Epidemiologists, surveillance officers and frontline responders in emergencies",
    "owner": "WHO",
    "developer": "HQ/WHE/HEI",
    "contactDetails": "ewars@who.int",
    "languages": [
      "English"
    ],
    "modalityRaw": "Online",
    "modality": "online",
    "platform": "OpenWHO",
    "link": "https://openwho.org/playlist/dedicated/541847/0_zsd05l6v/0_och981pp",
    "comment": "",
    "signoffStatus": "",
    "normalizedLink": "https://openwho.org/playlist/dedicated/541847/0_zsd05l6v/0_och981pp",
    "searchText": "ewars in a box: electronic early warning, alert and response system implementation in emergencies | ewars in a box, who's electronic early warning, alert, and response system in emergencies, helps detect disease outbreaks early in emergency, fragile, conflict and vulnerable settings. it supports real-time mobile reporting from the most difficult and remote field settings with or without reliable internet or electricity. the web interface helps local epidemiologists and surveillance officers with interactive alert management, data analysis and visualization. | surveillance | ewars | epidemiologists, surveillance officers and frontline responders in emergencies | who | hq/whe/hei | ewars@who.int | english | openwho | https://openwho.org/playlist/dedicated/541847/0_zsd05l6v/0_och981pp"
  },
  {
    "id": "97389e96d1c93fd2f5dd0e1c",
    "sourceRow": 160,
    "learningName": "PHEOC Virtual TableTop Exercsie",
    "description": "This course will be made available upon request from WHO CO to euroeoc@who.int and accordingly briefing to run the training and the link will be provided.",
    "technicalArea": "Health emergency preparedness and response management",
    "focusArea": "PHEOC",
    "intendedAudience": "Member States and COs",
    "owner": "WHO",
    "developer": "EU/RGO/WHE/EMO",
    "contactDetails": "euroeoc@who.int",
    "languages": [
      "English",
      "Russian",
      "Arabic"
    ],
    "modalityRaw": "Blended",
    "modality": "blended",
    "platform": "",
    "link": "",
    "comment": "",
    "signoffStatus": "",
    "normalizedLink": "",
    "searchText": "pheoc virtual tabletop exercsie | this course will be made available upon request from who co to euroeoc@who.int and accordingly briefing to run the training and the link will be provided. | health emergency preparedness and response management | pheoc | member states and cos | who | eu/rgo/whe/emo | euroeoc@who.int | english, russian, arabic |  | "
  },
  {
    "id": "7a0b52a9ec667ed5c7d63231",
    "sourceRow": 161,
    "learningName": "Virtual Course on Evaluation of Health Facilities using the Hospital Safety Index (HSIv2)",
    "description": "The completion of the course modules will allow the following objectives to be achieved: i) Recognize the elements of a health facility that are evaluated by the Hospital Safety Index. ii) Identify the hazards that put the security of a hospital at risk. iii) Use a standardized qualification of structural and non-structural aspects for the calculation of the hospital safety index. iv)Identify the necessary elements for emergency and disaster management. v) Systematize the procedure for hospital evaluation and analysis of the results.",
    "technicalArea": "Health emergency preparedness and response management",
    "focusArea": "Hospital safety index",
    "intendedAudience": "Health care workers/Other profession supporting health (engineer, architects, specialist in electrical and mechanical equipment, logistics)",
    "owner": "WHO",
    "developer": "PAHO/Virtual campus for public health",
    "contactDetails": "https://campus.paho.org/en/contact",
    "languages": [
      "English"
    ],
    "modalityRaw": "Online",
    "modality": "online",
    "platform": "Virtual campus for public health",
    "link": "https://campus.paho.org/en/course/health-facilities-assessment-using-hospital-safety-index",
    "comment": "",
    "signoffStatus": "",
    "normalizedLink": "https://campus.paho.org/en/course/health-facilities-assessment-using-hospital-safety-index",
    "searchText": "virtual course on evaluation of health facilities using the hospital safety index (hsiv2) | the completion of the course modules will allow the following objectives to be achieved: i) recognize the elements of a health facility that are evaluated by the hospital safety index. ii) identify the hazards that put the security of a hospital at risk. iii) use a standardized qualification of structural and non-structural aspects for the calculation of the hospital safety index. iv)identify the necessary elements for emergency and disaster management. v) systematize the procedure for hospital evaluation and analysis of the results. | health emergency preparedness and response management | hospital safety index | health care workers/other profession supporting health (engineer, architects, specialist in electrical and mechanical equipment, logistics) | who | paho/virtual campus for public health | https://campus.paho.org/en/contact | english | virtual campus for public health | https://campus.paho.org/en/course/health-facilities-assessment-using-hospital-safety-index"
  },
  {
    "id": "3bf7ddc669cce90adb229c38",
    "sourceRow": 162,
    "learningName": "WHO Simulation Exercise management training course",
    "description": "This face-to-face training is based on the WHO Simulation Exercise Manual and will provide the learners with the overview of the different simulation exercise tools and guidelines developed and used by WHO",
    "technicalArea": "Research & monitoring and evaluation",
    "focusArea": "Simulation",
    "intendedAudience": "Member states/ MoH/WHO staff",
    "owner": "WHO",
    "developer": "EURO/WHE/CPI",
    "contactDetails": "esengulova@who.int",
    "languages": [
      "English",
      "Russian"
    ],
    "modalityRaw": "In-person",
    "modality": "in_person",
    "platform": "",
    "link": "",
    "comment": "",
    "signoffStatus": "",
    "normalizedLink": "",
    "searchText": "who simulation exercise management training course | this face-to-face training is based on the who simulation exercise manual and will provide the learners with the overview of the different simulation exercise tools and guidelines developed and used by who | research & monitoring and evaluation | simulation | member states/ moh/who staff | who | euro/whe/cpi | esengulova@who.int | english, russian |  | "
  },
  {
    "id": "1fce0763d389b58711215c93",
    "sourceRow": 163,
    "learningName": "WHO IAR&AAR management course",
    "description": "This course has been designed to introduce the learners to the knowledge and skills needed for a successful management and facilitation of an Intra Action Review (IAAR) and an After Action Review (AAR)",
    "technicalArea": "Research & monitoring and evaluation",
    "focusArea": "IAR/AAR",
    "intendedAudience": "Member states/ MoH/WHO staff",
    "owner": "WHO",
    "developer": "EURO/WHE/CPI",
    "contactDetails": "esengulova@who.int",
    "languages": [
      "English",
      "Russian"
    ],
    "modalityRaw": "In-person",
    "modality": "in_person",
    "platform": "",
    "link": "",
    "comment": "",
    "signoffStatus": "",
    "normalizedLink": "",
    "searchText": "who iar&aar management course | this course has been designed to introduce the learners to the knowledge and skills needed for a successful management and facilitation of an intra action review (iaar) and an after action review (aar) | research & monitoring and evaluation | iar/aar | member states/ moh/who staff | who | euro/whe/cpi | esengulova@who.int | english, russian |  | "
  },
  {
    "id": "2ae6387211e54841b264e9ff",
    "sourceRow": 164,
    "learningName": "Strategic Risk Assessment training for National and Subnational Facilitators using the WHO STAR tool kit",
    "description": "This face-to-face 3 day training is based on the WHO Strategic Tool Kit for Assessing Risk (STAR) and will provide participants with the methodology and the steps to conduct an all-hazards Strategic Risk Assessment at national or subnational level.",
    "technicalArea": "Health emergency preparedness and response management",
    "focusArea": "Strategic risk assessment",
    "intendedAudience": "Member states/ MoH/WHO staff",
    "owner": "WHO",
    "developer": "EURO/WHE/CPI",
    "contactDetails": "cmansilla@who.int",
    "languages": [
      "English"
    ],
    "modalityRaw": "In-person",
    "modality": "in_person",
    "platform": "",
    "link": "",
    "comment": "",
    "signoffStatus": "",
    "normalizedLink": "",
    "searchText": "strategic risk assessment training for national and subnational facilitators using the who star tool kit | this face-to-face 3 day training is based on the who strategic tool kit for assessing risk (star) and will provide participants with the methodology and the steps to conduct an all-hazards strategic risk assessment at national or subnational level. | health emergency preparedness and response management | strategic risk assessment | member states/ moh/who staff | who | euro/whe/cpi | cmansilla@who.int | english |  | "
  },
  {
    "id": "3dd73d7e53ce64f880a0dc62",
    "sourceRow": 165,
    "learningName": "Hospital Safety Index (HSI) Training",
    "description": "This training familiarizes participants with the Hospital Safety Index (HSI) tool and its components, and how to use the tool to obtain a final HSI and specific indexes for structural safety, non-structural safety, and emergency and disaster management. The training will combine classroom theory with hands-on practice in a real hospital setting.",
    "technicalArea": "Health services provision",
    "focusArea": "Hospital Preparedness",
    "intendedAudience": "Health Facility Managers and Staff",
    "owner": "WHO",
    "developer": "EURO/WHE/CPI",
    "contactDetails": "llloydbraff@who.int",
    "languages": [
      "English"
    ],
    "modalityRaw": "In-person",
    "modality": "in_person",
    "platform": "",
    "link": "",
    "comment": "",
    "signoffStatus": "",
    "normalizedLink": "",
    "searchText": "hospital safety index (hsi) training | this training familiarizes participants with the hospital safety index (hsi) tool and its components, and how to use the tool to obtain a final hsi and specific indexes for structural safety, non-structural safety, and emergency and disaster management. the training will combine classroom theory with hands-on practice in a real hospital setting. | health services provision | hospital preparedness | health facility managers and staff | who | euro/whe/cpi | llloydbraff@who.int | english |  | "
  },
  {
    "id": "757253a12b6a089d7c470585",
    "sourceRow": 166,
    "learningName": "Mass Casualty Management Planning Workshop",
    "description": "This course equips participants with the knowledge and skills to effectively manage mass casualty incidents.",
    "technicalArea": "Health services provision",
    "focusArea": "Hospital Preparedness",
    "intendedAudience": "Health Facility Managers and Staff",
    "owner": "WHO",
    "developer": "EURO/WHE/CPI",
    "contactDetails": "llloydbraff@who.int",
    "languages": [
      "English"
    ],
    "modalityRaw": "In-person",
    "modality": "in_person",
    "platform": "",
    "link": "",
    "comment": "",
    "signoffStatus": "",
    "normalizedLink": "",
    "searchText": "mass casualty management planning workshop | this course equips participants with the knowledge and skills to effectively manage mass casualty incidents. | health services provision | hospital preparedness | health facility managers and staff | who | euro/whe/cpi | llloydbraff@who.int | english |  | "
  },
  {
    "id": "36fe8d7441c37c52f870dd7c",
    "sourceRow": 167,
    "learningName": "Hospital Emergency Response Planning Workshop",
    "description": "The aim of the training is to provide information and guidance to develop or revise Emergency Response Plans for hospitals (H-ERPs) in WHO Member States.",
    "technicalArea": "Health services provision",
    "focusArea": "Hospital Preparedness",
    "intendedAudience": "Health Facility Managers and Staff",
    "owner": "WHO",
    "developer": "EURO/WHE/CPI",
    "contactDetails": "llloydbraff@who.int",
    "languages": [
      "English"
    ],
    "modalityRaw": "In-person",
    "modality": "in_person",
    "platform": "",
    "link": "",
    "comment": "",
    "signoffStatus": "",
    "normalizedLink": "",
    "searchText": "hospital emergency response planning workshop | the aim of the training is to provide information and guidance to develop or revise emergency response plans for hospitals (h-erps) in who member states. | health services provision | hospital preparedness | health facility managers and staff | who | euro/whe/cpi | llloydbraff@who.int | english |  | "
  },
  {
    "id": "39d9440a385a12a3c3654f0b",
    "sourceRow": 168,
    "learningName": "NAPHS Training workshop",
    "description": "This training will support participants to reinforce the importance of developing annual operational plans that address current priorities and risks with detailed and tangible activities, and understand the interlinkage of NAPHS components in building capacities for countries to prevent, detect and respond to public health emergencies.",
    "technicalArea": "Health emergency preparedness and response management",
    "focusArea": "NAPHS",
    "intendedAudience": "Member states/ MoH/WHO staff",
    "owner": "WHO",
    "developer": "EURO/WHE/CPI",
    "contactDetails": "eurocme@who.int",
    "languages": [
      "English"
    ],
    "modalityRaw": "In-person",
    "modality": "in_person",
    "platform": "",
    "link": "",
    "comment": "",
    "signoffStatus": "",
    "normalizedLink": "",
    "searchText": "naphs training workshop | this training will support participants to reinforce the importance of developing annual operational plans that address current priorities and risks with detailed and tangible activities, and understand the interlinkage of naphs components in building capacities for countries to prevent, detect and respond to public health emergencies. | health emergency preparedness and response management | naphs | member states/ moh/who staff | who | euro/whe/cpi | eurocme@who.int | english |  | "
  },
  {
    "id": "35ad7880adcd7b7d895103be",
    "sourceRow": 169,
    "learningName": "Introduction to PoE requirements under the IHR",
    "description": "This course provides an overview of Points of Entry (PoE) requirements under the International Health Regulations (IHR), focusing on key obligations, risk management, and compliance strategies. * \"The training will need to be updated to align with the IHR amendments when they enter into force\"",
    "technicalArea": "Points of entry (PoEs) and border health",
    "focusArea": "IHR",
    "intendedAudience": "Member states/ MoH/WHO staff",
    "owner": "WHO",
    "developer": "EURO/WHE/CPI",
    "contactDetails": "schmidtt@who.int",
    "languages": [
      "English",
      "Russian"
    ],
    "modalityRaw": "In-person",
    "modality": "in_person",
    "platform": "",
    "link": "",
    "comment": "",
    "signoffStatus": "",
    "normalizedLink": "",
    "searchText": "introduction to poe requirements under the ihr | this course provides an overview of points of entry (poe) requirements under the international health regulations (ihr), focusing on key obligations, risk management, and compliance strategies. * \"the training will need to be updated to align with the ihr amendments when they enter into force\" | points of entry (poes) and border health | ihr | member states/ moh/who staff | who | euro/whe/cpi | schmidtt@who.int | english, russian |  | "
  },
  {
    "id": "a242edb7c3ed1d6cf1d2815b",
    "sourceRow": 170,
    "learningName": "Assessment of core IHR public health capacities at PoE",
    "description": "The trianing will provide knowledge and skills to conduct assessment in line with the IHR annex 1 provisions at airports, ports and ground crossings, including those for the early detection, reporting and management of public health events. * \"The training will need to be updated to align with the IHR amendments when they enter into force\"",
    "technicalArea": "Points of entry (PoEs) and border health",
    "focusArea": "IHR",
    "intendedAudience": "Member states/ MoH/WHO staff",
    "owner": "WHO",
    "developer": "EURO/WHE/CPI",
    "contactDetails": "schmidtt@who.int",
    "languages": [
      "English",
      "Russian"
    ],
    "modalityRaw": "In-person",
    "modality": "in_person",
    "platform": "",
    "link": "",
    "comment": "",
    "signoffStatus": "",
    "normalizedLink": "",
    "searchText": "assessment of core ihr public health capacities at poe | the trianing will provide knowledge and skills to conduct assessment in line with the ihr annex 1 provisions at airports, ports and ground crossings, including those for the early detection, reporting and management of public health events. * \"the training will need to be updated to align with the ihr amendments when they enter into force\" | points of entry (poes) and border health | ihr | member states/ moh/who staff | who | euro/whe/cpi | schmidtt@who.int | english, russian |  | "
  },
  {
    "id": "47564438f847860d69cc84f5",
    "sourceRow": 171,
    "learningName": "Ship sanitation for the early detection, reporting and management of public health events particularly on board ships",
    "description": "A train-the-trainers programme for global professionals with significant experience in issuing ship sanitation exemption, control and extension certificates for different types of vessels.",
    "technicalArea": "Points of entry (PoEs) and border health",
    "focusArea": "Ship sanitation",
    "intendedAudience": "Member states/ MoH/WHO staff",
    "owner": "WHO",
    "developer": "EURO/WHE/CPI",
    "contactDetails": "schmidtt@who.int",
    "languages": [
      "English",
      "Russian"
    ],
    "modalityRaw": "In-person",
    "modality": "in_person",
    "platform": "",
    "link": "",
    "comment": "",
    "signoffStatus": "",
    "normalizedLink": "",
    "searchText": "ship sanitation for the early detection, reporting and management of public health events particularly on board ships | a train-the-trainers programme for global professionals with significant experience in issuing ship sanitation exemption, control and extension certificates for different types of vessels. | points of entry (poes) and border health | ship sanitation | member states/ moh/who staff | who | euro/whe/cpi | schmidtt@who.int | english, russian |  | "
  },
  {
    "id": "287617986957fb0cd082e36d",
    "sourceRow": 172,
    "learningName": "Development of a public health contingency plan for PoE",
    "description": "This workshop covers the development of a public health contingency plan for Points of Entry (PoE), focusing on preparedness, response strategies, and risk mitigation. Participants will learn how to design and implement effective plans to manage health emergencies and ensure compliance with international regulations.",
    "technicalArea": "Points of entry (PoEs) and border health",
    "focusArea": "Contingency plan",
    "intendedAudience": "Member states/ MoH/WHO staff",
    "owner": "WHO",
    "developer": "EURO/WHE/CPI",
    "contactDetails": "schmidtt@who.int",
    "languages": [
      "English",
      "Russian"
    ],
    "modalityRaw": "In-person",
    "modality": "in_person",
    "platform": "",
    "link": "",
    "comment": "",
    "signoffStatus": "",
    "normalizedLink": "",
    "searchText": "development of a public health contingency plan for poe | this workshop covers the development of a public health contingency plan for points of entry (poe), focusing on preparedness, response strategies, and risk mitigation. participants will learn how to design and implement effective plans to manage health emergencies and ensure compliance with international regulations. | points of entry (poes) and border health | contingency plan | member states/ moh/who staff | who | euro/whe/cpi | schmidtt@who.int | english, russian |  | "
  },
  {
    "id": "5ffe9e740a2c8353550cac3f",
    "sourceRow": 173,
    "learningName": "Global competency standards for the provision of health services to refugees and migrants",
    "description": "This course equips health workers with essential competencies to provide inclusive, people-centred, and culturally sensitive health services to refugees and migrants. Grounded in WHO’s Global Competency Standards, it addresses communication, collaboration, evidence-informed practice, and personal conduct, helping learners navigate the challenges faced by displaced populations in accessing equitable care.",
    "technicalArea": "Health emergency preparedness and response management",
    "focusArea": "Health and migration",
    "intendedAudience": "Health workers & professional working with migrant health",
    "owner": "WHO",
    "developer": "HQ/PHM",
    "contactDetails": "whoasupport@who.int",
    "languages": [
      "English"
    ],
    "modalityRaw": "Online",
    "modality": "online",
    "platform": "WHO Academy",
    "link": "https://whoacademy.org/coursewares/course-v1:WHOAcademy-Hosted+H0125EN+2025_Q2",
    "comment": "",
    "signoffStatus": "",
    "normalizedLink": "https://whoacademy.org/coursewares/course-v1:WHOAcademy-Hosted+H0125EN+2025_Q2",
    "searchText": "global competency standards for the provision of health services to refugees and migrants | this course equips health workers with essential competencies to provide inclusive, people-centred, and culturally sensitive health services to refugees and migrants. grounded in who’s global competency standards, it addresses communication, collaboration, evidence-informed practice, and personal conduct, helping learners navigate the challenges faced by displaced populations in accessing equitable care. | health emergency preparedness and response management | health and migration | health workers & professional working with migrant health | who | hq/phm | whoasupport@who.int | english | who academy | https://whoacademy.org/coursewares/course-v1:whoacademy-hosted+h0125en+2025_q2"
  },
  {
    "id": "f36d86593d7409fbaf5bbc48",
    "sourceRow": 174,
    "learningName": "Health Emergency Prevention, Preparedness, Response and Resilience (HEPR)",
    "description": "This asynchronous, self-paced course equips you with the tools and methodologies to support countries in developing evidence-based national plans for Health Emergency Prevention, Preparedness, Response, and Resilience (HEPR).",
    "technicalArea": "Health emergency preparedness and response management",
    "focusArea": "HEPR",
    "intendedAudience": "MoH/WHO/Consultants and other relevant National staff",
    "owner": "WHO",
    "developer": "HQ/WHE",
    "contactDetails": "whoasupport@who.int",
    "languages": [
      "English"
    ],
    "modalityRaw": "Online",
    "modality": "online",
    "platform": "WHO Academy",
    "link": "https://whoacademy.org/coursewares/course-v1:WHOAcademy-Hosted+H0089EN+2025_Q1?source=edX",
    "comment": "",
    "signoffStatus": "",
    "normalizedLink": "https://whoacademy.org/coursewares/course-v1:WHOAcademy-Hosted+H0089EN+2025_Q1?source=edX",
    "searchText": "health emergency prevention, preparedness, response and resilience (hepr) | this asynchronous, self-paced course equips you with the tools and methodologies to support countries in developing evidence-based national plans for health emergency prevention, preparedness, response, and resilience (hepr). | health emergency preparedness and response management | hepr | moh/who/consultants and other relevant national staff | who | hq/whe | whoasupport@who.int | english | who academy | https://whoacademy.org/coursewares/course-v1:whoacademy-hosted+h0089en+2025_q1?source=edx"
  },
  {
    "id": "640128a37ea326ea98f53ce4",
    "sourceRow": 175,
    "learningName": "RCCE-IM for CBRN Preparedness and Response",
    "description": "Focusing on preparing communities and Ministry teams on the hazards associated with CBRN and how to identify risk perceptions of key groups and respond accordingly.",
    "technicalArea": "Risk communication and community engagement (RCCE)",
    "focusArea": "CBRN",
    "intendedAudience": "Member states/ MoH/WHO staff",
    "owner": "WHO",
    "developer": "EURO/WHE/RCI",
    "contactDetails": "claxtonn@who.int",
    "languages": [
      "English",
      "Slovakian"
    ],
    "modalityRaw": "Blended",
    "modality": "blended",
    "platform": "",
    "link": "",
    "comment": "",
    "signoffStatus": "",
    "normalizedLink": "",
    "searchText": "rcce-im for cbrn preparedness and response | focusing on preparing communities and ministry teams on the hazards associated with cbrn and how to identify risk perceptions of key groups and respond accordingly. | risk communication and community engagement (rcce) | cbrn | member states/ moh/who staff | who | euro/whe/rci | claxtonn@who.int | english, slovakian |  | "
  },
  {
    "id": "d9de31a9204fa09f2fc78f1b",
    "sourceRow": 176,
    "learningName": "RCCE-IM for Mass Gatherings",
    "description": "Against the backdrop of understanding key health risk during planned Mass Gatherings, the course teaches Ministry teams and stakeholder groups in how to identify key risks for each event, gauge risk perceptions and share appropriate messaging with key community groups before and during the events.",
    "technicalArea": "Risk communication and community engagement (RCCE)",
    "focusArea": "Mass gatherings",
    "intendedAudience": "Member states/ MoH/WHO staff",
    "owner": "WHO",
    "developer": "EURO/WHE/RCI",
    "contactDetails": "claxtonn@who.int",
    "languages": [
      "English"
    ],
    "modalityRaw": "Blended",
    "modality": "blended",
    "platform": "",
    "link": "",
    "comment": "",
    "signoffStatus": "",
    "normalizedLink": "",
    "searchText": "rcce-im for mass gatherings | against the backdrop of understanding key health risk during planned mass gatherings, the course teaches ministry teams and stakeholder groups in how to identify key risks for each event, gauge risk perceptions and share appropriate messaging with key community groups before and during the events. | risk communication and community engagement (rcce) | mass gatherings | member states/ moh/who staff | who | euro/whe/rci | claxtonn@who.int | english |  | "
  },
  {
    "id": "c23d46706b08e4b90865b7fb",
    "sourceRow": 177,
    "learningName": "Social Listening",
    "description": "This course focused specifically on the skillsets within Social Listening as a means to gauge risk perceptions on key health topics. Participants are guided to conduct their own Social Listening exercises using low-resource tools.",
    "technicalArea": "Risk communication and community engagement (RCCE)",
    "focusArea": "Social listening",
    "intendedAudience": "Member states/ MoH/WHO communication staff",
    "owner": "WHO",
    "developer": "EURO/WHE/RCI",
    "contactDetails": "claxtonn@who.int",
    "languages": [
      "English"
    ],
    "modalityRaw": "Blended",
    "modality": "blended",
    "platform": "",
    "link": "",
    "comment": "",
    "signoffStatus": "",
    "normalizedLink": "",
    "searchText": "social listening | this course focused specifically on the skillsets within social listening as a means to gauge risk perceptions on key health topics. participants are guided to conduct their own social listening exercises using low-resource tools. | risk communication and community engagement (rcce) | social listening | member states/ moh/who communication staff | who | euro/whe/rci | claxtonn@who.int | english |  | "
  },
  {
    "id": "3f120d65a2b9825718c434d5",
    "sourceRow": 178,
    "learningName": "RCCE-IM in Epidemiology and Outbreak Response",
    "description": "This course targets epidemiologists' unique role in outbreak investigations by teaching how to engage communities and gauge risk perceptions around key health issues and potential vectors.",
    "technicalArea": "Risk communication and community engagement (RCCE)",
    "focusArea": "Outbreak Response",
    "intendedAudience": "Epidemiologists",
    "owner": "WHO",
    "developer": "EURO/WHE/RCI",
    "contactDetails": "claxtonn@who.int",
    "languages": [
      "English",
      "Russian"
    ],
    "modalityRaw": "In-person",
    "modality": "in_person",
    "platform": "",
    "link": "",
    "comment": "",
    "signoffStatus": "",
    "normalizedLink": "",
    "searchText": "rcce-im in epidemiology and outbreak response | this course targets epidemiologists' unique role in outbreak investigations by teaching how to engage communities and gauge risk perceptions around key health issues and potential vectors. | risk communication and community engagement (rcce) | outbreak response | epidemiologists | who | euro/whe/rci | claxtonn@who.int | english, russian |  | "
  },
  {
    "id": "3a81a70fdfd8c9deec851236",
    "sourceRow": 179,
    "learningName": "RCCE-IM for Community Health Workers",
    "description": "This course targets paid and volunteer community health workers' unique role in communities to serve as a listening station for concerns and risk perceptions around health and how to effectively support and respond.",
    "technicalArea": "Risk communication and community engagement (RCCE)",
    "focusArea": "Community health",
    "intendedAudience": "Community health workers",
    "owner": "WHO",
    "developer": "EURO/WHE/RCI",
    "contactDetails": "",
    "languages": [
      "English"
    ],
    "modalityRaw": "In-person",
    "modality": "in_person",
    "platform": "",
    "link": "",
    "comment": "",
    "signoffStatus": "",
    "normalizedLink": "",
    "searchText": "rcce-im for community health workers | this course targets paid and volunteer community health workers' unique role in communities to serve as a listening station for concerns and risk perceptions around health and how to effectively support and respond. | risk communication and community engagement (rcce) | community health | community health workers | who | euro/whe/rci |  | english |  | "
  },
  {
    "id": "bc60f377a0372097b2fe5b8a",
    "sourceRow": 180,
    "learningName": "Community Health Workers Promoting COVID-19 Vaccination",
    "description": "This course uses the tools of RCCE-IM to assess and influence communities that may be hesitant to immunizations, with a focus on COVID19",
    "technicalArea": "Risk communication and community engagement (RCCE)",
    "focusArea": "Immunizations",
    "intendedAudience": "Member states/ MoH/WHO staff",
    "owner": "WHO",
    "developer": "EMRO/WHE",
    "contactDetails": "claxtonn@who.int",
    "languages": [
      "English",
      "Arabic"
    ],
    "modalityRaw": "Online",
    "modality": "online",
    "platform": "Webpage",
    "link": "https://www.emro.who.int/courses/covid-19-vaccine/index.htm",
    "comment": "",
    "signoffStatus": "",
    "normalizedLink": "https://www.emro.who.int/courses/covid-19-vaccine/index.htm",
    "searchText": "community health workers promoting covid-19 vaccination | this course uses the tools of rcce-im to assess and influence communities that may be hesitant to immunizations, with a focus on covid19 | risk communication and community engagement (rcce) | immunizations | member states/ moh/who staff | who | emro/whe | claxtonn@who.int | english, arabic | webpage | https://www.emro.who.int/courses/covid-19-vaccine/index.htm"
  },
  {
    "id": "fd1a97b916d321835cf151e4",
    "sourceRow": 181,
    "learningName": "Effective Online Training",
    "description": "This course models and assess learners for effective use of online methodologies and assessments specific to content and audience to better ensure that learning objectives are effectively met.",
    "technicalArea": "Risk communication and community engagement (RCCE)",
    "focusArea": "Online learning",
    "intendedAudience": "Member states/ MoH/WHO staff",
    "owner": "WHO",
    "developer": "EURO/WHE/RCI",
    "contactDetails": "claxtonn@who.int",
    "languages": [
      "English",
      "Arabic"
    ],
    "modalityRaw": "Online",
    "modality": "online",
    "platform": "",
    "link": "",
    "comment": "",
    "signoffStatus": "",
    "normalizedLink": "",
    "searchText": "effective online training | this course models and assess learners for effective use of online methodologies and assessments specific to content and audience to better ensure that learning objectives are effectively met. | risk communication and community engagement (rcce) | online learning | member states/ moh/who staff | who | euro/whe/rci | claxtonn@who.int | english, arabic |  | "
  },
  {
    "id": "097bb9517bab53fbb7d4e8fd",
    "sourceRow": 182,
    "learningName": "Developing behaviour-based training curriculum",
    "description": "This course goes beyond teaching knowledge-based content and models behaviour-based strategies to improve the likelihood of skill transfer and behaviour and attitude modification around key competencies and capabilities.",
    "technicalArea": "Risk communication and community engagement (RCCE)",
    "focusArea": "Training curriculum",
    "intendedAudience": "Member states/ MoH/WHO staff",
    "owner": "WHO",
    "developer": "EURO/WHE/RCI",
    "contactDetails": "claxtonn@who.int",
    "languages": [
      "English"
    ],
    "modalityRaw": "Online",
    "modality": "online",
    "platform": "",
    "link": "",
    "comment": "",
    "signoffStatus": "",
    "normalizedLink": "",
    "searchText": "developing behaviour-based training curriculum | this course goes beyond teaching knowledge-based content and models behaviour-based strategies to improve the likelihood of skill transfer and behaviour and attitude modification around key competencies and capabilities. | risk communication and community engagement (rcce) | training curriculum | member states/ moh/who staff | who | euro/whe/rci | claxtonn@who.int | english |  | "
  },
  {
    "id": "90fdb84a99eb04b397dadf86",
    "sourceRow": 183,
    "learningName": "Supporting partners across the capacity-building continuum",
    "description": "This course shows the multiple steps and resources available to build capacity - with training events serving as the last resort. The course strengthens how we see each person as a builder of capacity, going beyond structured and expensive training events.",
    "technicalArea": "Risk communication and community engagement (RCCE)",
    "focusArea": "Training",
    "intendedAudience": "Member states/ MoH/WHO staff",
    "owner": "WHO",
    "developer": "EURO/WHE/RCI",
    "contactDetails": "claxtonn@who.int",
    "languages": [
      "English"
    ],
    "modalityRaw": "Blended",
    "modality": "blended",
    "platform": "",
    "link": "",
    "comment": "",
    "signoffStatus": "",
    "normalizedLink": "",
    "searchText": "supporting partners across the capacity-building continuum | this course shows the multiple steps and resources available to build capacity - with training events serving as the last resort. the course strengthens how we see each person as a builder of capacity, going beyond structured and expensive training events. | risk communication and community engagement (rcce) | training | member states/ moh/who staff | who | euro/whe/rci | claxtonn@who.int | english |  | "
  },
  {
    "id": "fd78a302f8b94e6c49d6f7cc",
    "sourceRow": 184,
    "learningName": "Developing behaviour-change-based messages",
    "description": "The construction of effective risk communication messaging is modeled and taught with multiple opportunities for learner trial with feedback loops. Learners learn how to assess risk communications messages for effectiveness including testing of messages and have the opportunity to develop their own messages within their context for feedback and revision.",
    "technicalArea": "Risk communication and community engagement (RCCE)",
    "focusArea": "Risk communications",
    "intendedAudience": "Member states/ MoH/WHO staff",
    "owner": "WHO",
    "developer": "EURO/WHE/RCI",
    "contactDetails": "claxtonn@who.int",
    "languages": [
      "English"
    ],
    "modalityRaw": "Blended",
    "modality": "blended",
    "platform": "",
    "link": "",
    "comment": "",
    "signoffStatus": "",
    "normalizedLink": "",
    "searchText": "developing behaviour-change-based messages | the construction of effective risk communication messaging is modeled and taught with multiple opportunities for learner trial with feedback loops. learners learn how to assess risk communications messages for effectiveness including testing of messages and have the opportunity to develop their own messages within their context for feedback and revision. | risk communication and community engagement (rcce) | risk communications | member states/ moh/who staff | who | euro/whe/rci | claxtonn@who.int | english |  | "
  },
  {
    "id": "91fb04418f6488c360afd563",
    "sourceRow": 185,
    "learningName": "RCCE-IM in the university curricula in faculties of Medicine, Comms and Public Health",
    "description": "Learners are coached on how to assess existing curriculum within both communications and health for possible embedding of risk communications, community engagement and/or infodemic management knowledge, skills and behaviours to improve the quality of programming and increase the reach of WHO programming.",
    "technicalArea": "Risk communication and community engagement (RCCE)",
    "focusArea": "Integrating RCCE-IM",
    "intendedAudience": "Member states/ MoH/WHO staff",
    "owner": "WHO",
    "developer": "EURO/WHE/RCI",
    "contactDetails": "claxtonn@who.int",
    "languages": [
      "English",
      "Arabic"
    ],
    "modalityRaw": "Blended",
    "modality": "blended",
    "platform": "",
    "link": "",
    "comment": "",
    "signoffStatus": "",
    "normalizedLink": "",
    "searchText": "rcce-im in the university curricula in faculties of medicine, comms and public health | learners are coached on how to assess existing curriculum within both communications and health for possible embedding of risk communications, community engagement and/or infodemic management knowledge, skills and behaviours to improve the quality of programming and increase the reach of who programming. | risk communication and community engagement (rcce) | integrating rcce-im | member states/ moh/who staff | who | euro/whe/rci | claxtonn@who.int | english, arabic |  | "
  },
  {
    "id": "2b04e0d65f94ed475f762f05",
    "sourceRow": 186,
    "learningName": "Preventing rheumatic fever and rheumatic heart disease in the community",
    "description": "Using RCCE-IM principles, learners learn about RF and RHD while also the skills of communicating with people about the risks using scenario.",
    "technicalArea": "Risk communication and community engagement (RCCE)",
    "focusArea": "Rheumatic fever",
    "intendedAudience": "Member states/ MoH/WHO staff",
    "owner": "WHO",
    "developer": "EMRO/WHE",
    "contactDetails": "claxtonn@who.int",
    "languages": [
      "English",
      "Arabic"
    ],
    "modalityRaw": "Online",
    "modality": "online",
    "platform": "Webpage",
    "link": "https://www.emro.who.int/courses/preventing-rf-rhd/index.htm",
    "comment": "",
    "signoffStatus": "",
    "normalizedLink": "https://www.emro.who.int/courses/preventing-rf-rhd/index.htm",
    "searchText": "preventing rheumatic fever and rheumatic heart disease in the community | using rcce-im principles, learners learn about rf and rhd while also the skills of communicating with people about the risks using scenario. | risk communication and community engagement (rcce) | rheumatic fever | member states/ moh/who staff | who | emro/whe | claxtonn@who.int | english, arabic | webpage | https://www.emro.who.int/courses/preventing-rf-rhd/index.htm"
  },
  {
    "id": "1ad54b877cd90185f907dafa",
    "sourceRow": 187,
    "learningName": "Open Source Fundamentals",
    "description": "This e-learning course is designed to help WHO teams and partners working with WHO understand Open-Source principles and best practices in the context of health emergency preparedness and response.",
    "technicalArea": "Digital health",
    "focusArea": "Open source",
    "intendedAudience": "Product Owners/Project Leads, Software Developers and Project Managers",
    "owner": "WHO",
    "developer": "HQ/WHE/EII",
    "contactDetails": "pandemichub@who.int",
    "languages": [
      "English"
    ],
    "modalityRaw": "Online",
    "modality": "online",
    "platform": "WHO Academy",
    "link": "https://whoacademy.org/coursewares/course-v1:WHOAcademy-Hosted+H0068EN+2025_Q3?source=edX",
    "comment": "",
    "signoffStatus": "",
    "normalizedLink": "https://whoacademy.org/coursewares/course-v1:WHOAcademy-Hosted+H0068EN+2025_Q3?source=edX",
    "searchText": "open source fundamentals | this e-learning course is designed to help who teams and partners working with who understand open-source principles and best practices in the context of health emergency preparedness and response. | digital health | open source | product owners/project leads, software developers and project managers | who | hq/whe/eii | pandemichub@who.int | english | who academy | https://whoacademy.org/coursewares/course-v1:whoacademy-hosted+h0068en+2025_q3?source=edx"
  },
  {
    "id": "75e5c06f2e4a0b05f87c27eb",
    "sourceRow": 188,
    "learningName": "Outbreak investigations in health facilities",
    "description": "Outbreaks are unfortunate events that afflict both patients and staff as well as the cost of health care. In this course, you will learn how to identify and investigate outbreaks, the importance of communication, how to implement outbreak control measures, and how to identify lessons learned to inform and improve future health care delivery.",
    "technicalArea": "Infection prevention and control (IPC) & safe environment in health facilities",
    "focusArea": "Outbreak investigations",
    "intendedAudience": "Infection prevention and control professionals, public health professionals",
    "owner": "WHO",
    "developer": "HQ/WHE/IPC",
    "contactDetails": "whoasupport@who.int",
    "languages": [
      "English"
    ],
    "modalityRaw": "Online",
    "modality": "online",
    "platform": "WHO Academy",
    "link": "https://whoacademy.org/coursewares/course-v1:WHOAcademy-Hosted+H0080EN+2025_Q1?from=discovery&source=edX",
    "comment": "",
    "signoffStatus": "",
    "normalizedLink": "https://whoacademy.org/coursewares/course-v1:WHOAcademy-Hosted+H0080EN+2025_Q1?from=discovery&source=edX",
    "searchText": "outbreak investigations in health facilities | outbreaks are unfortunate events that afflict both patients and staff as well as the cost of health care. in this course, you will learn how to identify and investigate outbreaks, the importance of communication, how to implement outbreak control measures, and how to identify lessons learned to inform and improve future health care delivery. | infection prevention and control (ipc) & safe environment in health facilities | outbreak investigations | infection prevention and control professionals, public health professionals | who | hq/whe/ipc | whoasupport@who.int | english | who academy | https://whoacademy.org/coursewares/course-v1:whoacademy-hosted+h0080en+2025_q1?from=discovery&source=edx"
  },
  {
    "id": "976db83c9bd531f335739bda",
    "sourceRow": 189,
    "learningName": "Health systems for health security",
    "description": "This course aims to support the implementation of the WHO Health Systems for Health Security Framework and guide learners to bridge health systems and health security. It introduces the framework's key components and provides guidance and scenario-based exercises to bring HSforHS from concept to action. The online course is a self-paced interactive course with a webinar in module 2. The course is broken into two modules. Module 1 focuses on HSforHS-related knowledge dissemination, and Module 2 focuses on utilizing the knowledge gained in Module 1.",
    "technicalArea": "Health emergency preparedness and response management",
    "focusArea": "Health security",
    "intendedAudience": "Health emergencies management officials",
    "owner": "WHO",
    "developer": "HQ/WHE",
    "contactDetails": "whoasupport@who.int",
    "languages": [
      "English"
    ],
    "modalityRaw": "Online",
    "modality": "online",
    "platform": "WHO Academy",
    "link": "https://whoacademy.org/coursewares/course-v1:WHOA+0079_HS_EN+2024?from=discovery&source=edX",
    "comment": "",
    "signoffStatus": "",
    "normalizedLink": "https://whoacademy.org/coursewares/course-v1:WHOA+0079_HS_EN+2024?from=discovery&source=edX",
    "searchText": "health systems for health security | this course aims to support the implementation of the who health systems for health security framework and guide learners to bridge health systems and health security. it introduces the framework's key components and provides guidance and scenario-based exercises to bring hsforhs from concept to action. the online course is a self-paced interactive course with a webinar in module 2. the course is broken into two modules. module 1 focuses on hsforhs-related knowledge dissemination, and module 2 focuses on utilizing the knowledge gained in module 1. | health emergency preparedness and response management | health security | health emergencies management officials | who | hq/whe | whoasupport@who.int | english | who academy | https://whoacademy.org/coursewares/course-v1:whoa+0079_hs_en+2024?from=discovery&source=edx"
  },
  {
    "id": "9567b9ba41cef73879515e99",
    "sourceRow": 190,
    "learningName": "Virtual Course - Medical Coordination and Information Cells (CICOM)",
    "description": "The course provides health emergency staff with theoretical knowledge on how to implement the EMT Medical Coordination and Information Cell (CICOM) methodology to support health Emergency Operations Centers. The CICOM methodology serves as a fundamental support for EOCs, with the goal of strengthening actions and addressing needs related to information management, coordination, and operational support for EMTs and Alternative Medical Care Sites (AMCSs), facilitating decision-making in health EOCs. This is vital in the short term to protect life and alleviate the suffering of affected populations.",
    "technicalArea": "Health emergency preparedness and response management",
    "focusArea": "Emergency Medical Teams (EMTs)",
    "intendedAudience": "All staff involved with the Emergency Medical Teams (EMT) initiative",
    "owner": "WHO",
    "developer": "HQ/WHE",
    "contactDetails": "whoasupport@who.int",
    "languages": [
      "English",
      "French",
      "Portuguese",
      "Spanish"
    ],
    "modalityRaw": "Online",
    "modality": "online",
    "platform": "WHO Academy",
    "link": "https://whoacademy.org/coursewares/PAHO_VCPH_31285?source=gateway",
    "comment": "",
    "signoffStatus": "",
    "normalizedLink": "https://whoacademy.org/coursewares/PAHO_VCPH_31285?source=gateway",
    "searchText": "virtual course - medical coordination and information cells (cicom) | the course provides health emergency staff with theoretical knowledge on how to implement the emt medical coordination and information cell (cicom) methodology to support health emergency operations centers. the cicom methodology serves as a fundamental support for eocs, with the goal of strengthening actions and addressing needs related to information management, coordination, and operational support for emts and alternative medical care sites (amcss), facilitating decision-making in health eocs. this is vital in the short term to protect life and alleviate the suffering of affected populations. | health emergency preparedness and response management | emergency medical teams (emts) | all staff involved with the emergency medical teams (emt) initiative | who | hq/whe | whoasupport@who.int | english, french, portuguese, spanish | who academy | https://whoacademy.org/coursewares/paho_vcph_31285?source=gateway"
  },
  {
    "id": "98efd2600d1bb748b9b611fd",
    "sourceRow": 191,
    "learningName": "Psychological first aid (PFA) in emergency management (Primera ayuda psicológica (PAP) en el manejo de emergencias)",
    "description": "This Psychological First Aid (PFA) course aims to provide people without professional training with tools to provide an appropriate first response to those experiencing psychological difficulties following crisis situations.",
    "technicalArea": "Health services provision",
    "focusArea": "Mental health",
    "intendedAudience": "Community volunteers",
    "owner": "WHO",
    "developer": "Virtual campus for public health",
    "contactDetails": "https://campus.paho.org/es",
    "languages": [
      "Spanish"
    ],
    "modalityRaw": "Online",
    "modality": "online",
    "platform": "WHO Academy",
    "link": "https://whoacademy.org/coursewares/PAHO_VCPH_28927?source=gateway",
    "comment": "",
    "signoffStatus": "",
    "normalizedLink": "https://whoacademy.org/coursewares/PAHO_VCPH_28927?source=gateway",
    "searchText": "psychological first aid (pfa) in emergency management (primera ayuda psicológica (pap) en el manejo de emergencias) | this psychological first aid (pfa) course aims to provide people without professional training with tools to provide an appropriate first response to those experiencing psychological difficulties following crisis situations. | health services provision | mental health | community volunteers | who | virtual campus for public health | https://campus.paho.org/es | spanish | who academy | https://whoacademy.org/coursewares/paho_vcph_28927?source=gateway"
  },
  {
    "id": "bc994b006358885b064968f7",
    "sourceRow": 192,
    "learningName": "Prevention and Control of infections in health emergencies and disasters (Prevención y Control de Infecciones en emergencias de salud y desastres )",
    "description": "The course starts from the need to analyze the importance of infection prevention and control as part of preparedness and responses to health emergencies and disasters, as well as to implement general and specific measures for infection prevention and control in healthcare facilities. The objective is to develop competencies in infection prevention and control in health emergencies and disaster situations among personnel working in healthcare facilities.",
    "technicalArea": "Infection prevention and control (IPC) & safe environment in health facilities",
    "focusArea": "IPC",
    "intendedAudience": "Professionals and technicians from healthcare services, epidemiology, and environmental health.",
    "owner": "WHO",
    "developer": "WHO/PAHO",
    "contactDetails": "https://campus.paho.org/es",
    "languages": [
      "Spanish"
    ],
    "modalityRaw": "Online",
    "modality": "online",
    "platform": "WHO Academy",
    "link": "https://whoacademy.org/coursewares/PAHO_VCPH_100907?source=gateway",
    "comment": "",
    "signoffStatus": "",
    "normalizedLink": "https://whoacademy.org/coursewares/PAHO_VCPH_100907?source=gateway",
    "searchText": "prevention and control of infections in health emergencies and disasters (prevención y control de infecciones en emergencias de salud y desastres ) | the course starts from the need to analyze the importance of infection prevention and control as part of preparedness and responses to health emergencies and disasters, as well as to implement general and specific measures for infection prevention and control in healthcare facilities. the objective is to develop competencies in infection prevention and control in health emergencies and disaster situations among personnel working in healthcare facilities. | infection prevention and control (ipc) & safe environment in health facilities | ipc | professionals and technicians from healthcare services, epidemiology, and environmental health. | who | who/paho | https://campus.paho.org/es | spanish | who academy | https://whoacademy.org/coursewares/paho_vcph_100907?source=gateway"
  },
  {
    "id": "23791a222faa969d503fbc3a",
    "sourceRow": 193,
    "learningName": "Rapid Response Teams (RRT) Training Programme",
    "description": "The Rapid Response Teams Training Programme (RRT TP) is a structured collection of learning resources including learning materials, guidance, and tools enabling Member States to plan, implement and evaluate customized training for RRT managers and RRT members at national and subnational levels.",
    "technicalArea": "Health emergency preparedness and response management",
    "focusArea": "Rapid response training",
    "intendedAudience": "Training Institutions/National Professionals across sectors who may be deployed as RRT members.",
    "owner": "WHO",
    "developer": "HQ/WHE",
    "contactDetails": "WHEtraining@who.int",
    "languages": [
      "English",
      "French"
    ],
    "modalityRaw": "Online",
    "modality": "online",
    "platform": "OpenWHO",
    "link": "https://openwho.org/channel/Rapid+Response+Teams+%28RRT%29+Training+Programme/606945",
    "comment": "",
    "signoffStatus": "",
    "normalizedLink": "https://openwho.org/channel/Rapid+Response+Teams+%28RRT%29+Training+Programme/606945",
    "searchText": "rapid response teams (rrt) training programme | the rapid response teams training programme (rrt tp) is a structured collection of learning resources including learning materials, guidance, and tools enabling member states to plan, implement and evaluate customized training for rrt managers and rrt members at national and subnational levels. | health emergency preparedness and response management | rapid response training | training institutions/national professionals across sectors who may be deployed as rrt members. | who | hq/whe | whetraining@who.int | english, french | openwho | https://openwho.org/channel/rapid+response+teams+%28rrt%29+training+programme/606945"
  },
  {
    "id": "0f956ad0ebefc1294af8ab38",
    "sourceRow": 194,
    "learningName": "Defining an information environment assessment framework",
    "description": "This course introduces health professionals and infodemic managers to methods for analyzing and understanding the information ecosystem during public health emergencies. It provides practical guidance on assessing information flows, identifying risks, and supporting evidence-based strategies to manage misinformation and strengthen community resilience.",
    "technicalArea": "Risk communication and community engagement (RCCE)",
    "focusArea": "Information ecosystem",
    "intendedAudience": "Member states/ MoH/WHO staff",
    "owner": "WHO",
    "developer": "HQ/WHE",
    "contactDetails": "WHEtraining@who.int",
    "languages": [
      "English"
    ],
    "modalityRaw": "Online",
    "modality": "online",
    "platform": "OpenWHO",
    "link": "https://openwho.org/playlist/dedicated/499738/0_fpv6zcpi/0_eodu8xbe",
    "comment": "",
    "signoffStatus": "",
    "normalizedLink": "https://openwho.org/playlist/dedicated/499738/0_fpv6zcpi/0_eodu8xbe",
    "searchText": "defining an information environment assessment framework | this course introduces health professionals and infodemic managers to methods for analyzing and understanding the information ecosystem during public health emergencies. it provides practical guidance on assessing information flows, identifying risks, and supporting evidence-based strategies to manage misinformation and strengthen community resilience. | risk communication and community engagement (rcce) | information ecosystem | member states/ moh/who staff | who | hq/whe | whetraining@who.int | english | openwho | https://openwho.org/playlist/dedicated/499738/0_fpv6zcpi/0_eodu8xbe"
  },
  {
    "id": "bb48085c8742b79911c7d9d0",
    "sourceRow": 195,
    "learningName": "",
    "description": "This module aims at providing technical recommendations to strengthen healthcare infrastructure in the context of mpox outbreaks.",
    "technicalArea": "Health emergency preparedness and response management",
    "focusArea": "Monkeypox",
    "intendedAudience": "Member states/ MoH/WHO staff",
    "owner": "WHO",
    "developer": "HQ/WHE",
    "contactDetails": "WHEtraining@who.int",
    "languages": [
      "English",
      "French"
    ],
    "modalityRaw": "Online",
    "modality": "online",
    "platform": "OpenWHO",
    "link": "https://openwho.org/playlist/dedicated/503162/0_eh39zv4c/0_u7qyxu5y",
    "comment": "",
    "signoffStatus": "",
    "normalizedLink": "https://openwho.org/playlist/dedicated/503162/0_eh39zv4c/0_u7qyxu5y",
    "searchText": " | this module aims at providing technical recommendations to strengthen healthcare infrastructure in the context of mpox outbreaks. | health emergency preparedness and response management | monkeypox | member states/ moh/who staff | who | hq/whe | whetraining@who.int | english, french | openwho | https://openwho.org/playlist/dedicated/503162/0_eh39zv4c/0_u7qyxu5y"
  },
  {
    "id": "5705ad2753da83a97ca1fe3e",
    "sourceRow": 196,
    "learningName": "Community First Aid Response Course",
    "description": "The Community First Aid Response course equips lay responders and community health workers to recognize emergency conditions, provide safe and simple lifesaving actions, and support patients until they reach formal care—particularly in areas with limited emergency services. To be considered complete, the Community First Aid Response course requires participants to attend in-person sessions and demonstrate practical clinical skills. Hands-on practice is essential to ensure confidence and competence in providing emergency first aid.",
    "technicalArea": "Health services provision",
    "focusArea": "First Aid",
    "intendedAudience": "Community members",
    "owner": "WHO",
    "developer": "",
    "contactDetails": "WHEtraining@who.int",
    "languages": [
      "English"
    ],
    "modalityRaw": "Online",
    "modality": "online",
    "platform": "OpenWHO",
    "link": "https://openwho.org/playlist/dedicated/631540/0_yd58jxwl/0_8qdpylyv",
    "comment": "",
    "signoffStatus": "",
    "normalizedLink": "https://openwho.org/playlist/dedicated/631540/0_yd58jxwl/0_8qdpylyv",
    "searchText": "community first aid response course | the community first aid response course equips lay responders and community health workers to recognize emergency conditions, provide safe and simple lifesaving actions, and support patients until they reach formal care—particularly in areas with limited emergency services. to be considered complete, the community first aid response course requires participants to attend in-person sessions and demonstrate practical clinical skills. hands-on practice is essential to ensure confidence and competence in providing emergency first aid. | health services provision | first aid | community members | who |  | whetraining@who.int | english | openwho | https://openwho.org/playlist/dedicated/631540/0_yd58jxwl/0_8qdpylyv"
  },
  {
    "id": "d0c83072a94969f3f76e26c3",
    "sourceRow": 197,
    "learningName": "Cholera case management",
    "description": "This course provides practical guidance on diagnosing and managing cholera cases, including assessing dehydration levels, applying case definitions, and initiating appropriate treatment plans. Participants will learn to use resources from the Global Task Force on Cholera Control (GTFCC), treat cholera in special populations such as pregnant women and malnourished children, and understand indications for antibiotic therapy.",
    "technicalArea": "Health services provision",
    "focusArea": "Cholera",
    "intendedAudience": "Clinical staff working in cholera treatment centers or units.",
    "owner": "WHO",
    "developer": "WHO/WHE",
    "contactDetails": "WHEtraining@who.int",
    "languages": [
      "English"
    ],
    "modalityRaw": "Online",
    "modality": "online",
    "platform": "OpenWHO",
    "link": "https://openwho.org/playlist/dedicated/493105/0_2ag4fqtv/0_s4gyb0h5",
    "comment": "",
    "signoffStatus": "",
    "normalizedLink": "https://openwho.org/playlist/dedicated/493105/0_2ag4fqtv/0_s4gyb0h5",
    "searchText": "cholera case management | this course provides practical guidance on diagnosing and managing cholera cases, including assessing dehydration levels, applying case definitions, and initiating appropriate treatment plans. participants will learn to use resources from the global task force on cholera control (gtfcc), treat cholera in special populations such as pregnant women and malnourished children, and understand indications for antibiotic therapy. | health services provision | cholera | clinical staff working in cholera treatment centers or units. | who | who/whe | whetraining@who.int | english | openwho | https://openwho.org/playlist/dedicated/493105/0_2ag4fqtv/0_s4gyb0h5"
  }
]